{
  "address": "0x99bbA657f2BbC93c02D617f8bA121cB8Fc104Acf",
  "abi": [
    {
      "inputs": [
        {
          "internalType": "address",
          "name": "underlying_",
          "type": "address"
        },
        {
          "internalType": "contract ComptrollerInterface",
          "name": "comptroller_",
          "type": "address"
        },
        {
          "internalType": "contract InterestRateModel",
          "name": "interestRateModel_",
          "type": "address"
        },
        {
          "internalType": "uint256",
          "name": "initialExchangeRateMantissa_",
          "type": "uint256"
        },
        {
          "internalType": "string",
          "name": "name_",
          "type": "string"
        },
        {
          "internalType": "string",
          "name": "symbol_",
          "type": "string"
        },
        {
          "internalType": "uint8",
          "name": "decimals_",
          "type": "uint8"
        },
        {
          "internalType": "address payable",
          "name": "admin_",
          "type": "address"
        }
      ],
      "payable": false,
      "stateMutability": "nonpayable",
      "type": "constructor"
    },
    {
      "anonymous": false,
      "inputs": [
        {
          "indexed": false,
          "internalType": "uint256",
          "name": "cashPrior",
          "type": "uint256"
        },
        {
          "indexed": false,
          "internalType": "uint256",
          "name": "interestAccumulated",
          "type": "uint256"
        },
        {
          "indexed": false,
          "internalType": "uint256",
          "name": "borrowIndex",
          "type": "uint256"
        },
        {
          "indexed": false,
          "internalType": "uint256",
          "name": "totalBorrows",
          "type": "uint256"
        }
      ],
      "name": "AccrueInterest",
      "type": "event"
    },
    {
      "anonymous": false,
      "inputs": [
        {
          "indexed": true,
          "internalType": "address",
          "name": "owner",
          "type": "address"
        },
        {
          "indexed": true,
          "internalType": "address",
          "name": "spender",
          "type": "address"
        },
        {
          "indexed": false,
          "internalType": "uint256",
          "name": "amount",
          "type": "uint256"
        }
      ],
      "name": "Approval",
      "type": "event"
    },
    {
      "anonymous": false,
      "inputs": [
        {
          "indexed": true,
          "internalType": "address",
          "name": "borrower",
          "type": "address"
        },
        {
          "indexed": false,
          "internalType": "uint256",
          "name": "borrowAmount",
          "type": "uint256"
        },
        {
          "indexed": false,
          "internalType": "uint256",
          "name": "accountBorrows",
          "type": "uint256"
        },
        {
          "indexed": false,
          "internalType": "uint256",
          "name": "totalBorrows",
          "type": "uint256"
        }
      ],
      "name": "Borrow",
      "type": "event"
    },
    {
      "anonymous": false,
      "inputs": [
        {
          "indexed": false,
          "internalType": "uint256",
          "name": "error",
          "type": "uint256"
        },
        {
          "indexed": false,
          "internalType": "uint256",
          "name": "info",
          "type": "uint256"
        },
        {
          "indexed": false,
          "internalType": "uint256",
          "name": "detail",
          "type": "uint256"
        }
      ],
      "name": "Failure",
      "type": "event"
    },
    {
      "anonymous": false,
      "inputs": [
        {
          "indexed": true,
          "internalType": "address",
          "name": "liquidator",
          "type": "address"
        },
        {
          "indexed": true,
          "internalType": "address",
          "name": "borrower",
          "type": "address"
        },
        {
          "indexed": false,
          "internalType": "uint256",
          "name": "repayAmount",
          "type": "uint256"
        },
        {
          "indexed": true,
          "internalType": "address",
          "name": "cTokenCollateral",
          "type": "address"
        },
        {
          "indexed": false,
          "internalType": "uint256",
          "name": "seizeTokens",
          "type": "uint256"
        }
      ],
      "name": "LiquidateBorrow",
      "type": "event"
    },
    {
      "anonymous": false,
      "inputs": [
        {
          "indexed": true,
          "internalType": "address",
          "name": "minter",
          "type": "address"
        },
        {
          "indexed": false,
          "internalType": "uint256",
          "name": "mintAmount",
          "type": "uint256"
        },
        {
          "indexed": false,
          "internalType": "uint256",
          "name": "mintTokens",
          "type": "uint256"
        }
      ],
      "name": "Mint",
      "type": "event"
    },
    {
      "anonymous": false,
      "inputs": [
        {
          "indexed": false,
          "internalType": "address",
          "name": "oldAdmin",
          "type": "address"
        },
        {
          "indexed": false,
          "internalType": "address",
          "name": "newAdmin",
          "type": "address"
        }
      ],
      "name": "NewAdmin",
      "type": "event"
    },
    {
      "anonymous": false,
      "inputs": [
        {
          "indexed": false,
          "internalType": "contract ComptrollerInterface",
          "name": "oldComptroller",
          "type": "address"
        },
        {
          "indexed": false,
          "internalType": "contract ComptrollerInterface",
          "name": "newComptroller",
          "type": "address"
        }
      ],
      "name": "NewComptroller",
      "type": "event"
    },
    {
      "anonymous": false,
      "inputs": [
        {
          "indexed": false,
          "internalType": "contract InterestRateModel",
          "name": "oldInterestRateModel",
          "type": "address"
        },
        {
          "indexed": false,
          "internalType": "contract InterestRateModel",
          "name": "newInterestRateModel",
          "type": "address"
        }
      ],
      "name": "NewMarketInterestRateModel",
      "type": "event"
    },
    {
      "anonymous": false,
      "inputs": [
        {
          "indexed": false,
          "internalType": "address",
          "name": "oldPendingAdmin",
          "type": "address"
        },
        {
          "indexed": false,
          "internalType": "address",
          "name": "newPendingAdmin",
          "type": "address"
        }
      ],
      "name": "NewPendingAdmin",
      "type": "event"
    },
    {
      "anonymous": false,
      "inputs": [
        {
          "indexed": false,
          "internalType": "uint256",
          "name": "oldReserveFactorMantissa",
          "type": "uint256"
        },
        {
          "indexed": false,
          "internalType": "uint256",
          "name": "newReserveFactorMantissa",
          "type": "uint256"
        }
      ],
      "name": "NewReserveFactor",
      "type": "event"
    },
    {
      "anonymous": false,
      "inputs": [
        {
          "indexed": true,
          "internalType": "address",
          "name": "redeemer",
          "type": "address"
        },
        {
          "indexed": false,
          "internalType": "uint256",
          "name": "redeemAmount",
          "type": "uint256"
        },
        {
          "indexed": false,
          "internalType": "uint256",
          "name": "redeemTokens",
          "type": "uint256"
        }
      ],
      "name": "Redeem",
      "type": "event"
    },
    {
      "anonymous": false,
      "inputs": [
        {
          "indexed": true,
          "internalType": "address",
          "name": "payer",
          "type": "address"
        },
        {
          "indexed": true,
          "internalType": "address",
          "name": "borrower",
          "type": "address"
        },
        {
          "indexed": false,
          "internalType": "uint256",
          "name": "repayAmount",
          "type": "uint256"
        },
        {
          "indexed": false,
          "internalType": "uint256",
          "name": "accountBorrows",
          "type": "uint256"
        },
        {
          "indexed": false,
          "internalType": "uint256",
          "name": "totalBorrows",
          "type": "uint256"
        }
      ],
      "name": "RepayBorrow",
      "type": "event"
    },
    {
      "anonymous": false,
      "inputs": [
        {
          "indexed": false,
          "internalType": "address",
          "name": "benefactor",
          "type": "address"
        },
        {
          "indexed": false,
          "internalType": "uint256",
          "name": "addAmount",
          "type": "uint256"
        },
        {
          "indexed": false,
          "internalType": "uint256",
          "name": "newTotalReserves",
          "type": "uint256"
        }
      ],
      "name": "ReservesAdded",
      "type": "event"
    },
    {
      "anonymous": false,
      "inputs": [
        {
          "indexed": false,
          "internalType": "address",
          "name": "admin",
          "type": "address"
        },
        {
          "indexed": false,
          "internalType": "uint256",
          "name": "reduceAmount",
          "type": "uint256"
        },
        {
          "indexed": false,
          "internalType": "uint256",
          "name": "newTotalReserves",
          "type": "uint256"
        }
      ],
      "name": "ReservesReduced",
      "type": "event"
    },
    {
      "anonymous": false,
      "inputs": [
        {
          "indexed": false,
          "internalType": "address",
          "name": "benefactor",
          "type": "address"
        },
        {
          "indexed": false,
          "internalType": "uint256",
          "name": "addAmount",
          "type": "uint256"
        },
        {
          "indexed": false,
          "internalType": "uint256",
          "name": "newSubsidyFund",
          "type": "uint256"
        }
      ],
      "name": "SubsidyAdded",
      "type": "event"
    },
    {
      "anonymous": false,
      "inputs": [
        {
          "indexed": true,
          "internalType": "address",
          "name": "from",
          "type": "address"
        },
        {
          "indexed": true,
          "internalType": "address",
          "name": "to",
          "type": "address"
        },
        {
          "indexed": false,
          "internalType": "uint256",
          "name": "amount",
          "type": "uint256"
        }
      ],
      "name": "Transfer",
      "type": "event"
    },
    {
      "constant": false,
      "inputs": [],
      "name": "_acceptAdmin",
      "outputs": [
        {
          "internalType": "uint256",
          "name": "",
          "type": "uint256"
        }
      ],
      "payable": false,
      "stateMutability": "nonpayable",
      "type": "function"
    },
    {
      "constant": false,
      "inputs": [
        {
          "internalType": "uint256",
          "name": "addAmount",
          "type": "uint256"
        }
      ],
      "name": "_addReserves",
      "outputs": [
        {
          "internalType": "uint256",
          "name": "",
          "type": "uint256"
        }
      ],
      "payable": false,
      "stateMutability": "nonpayable",
      "type": "function"
    },
    {
      "constant": false,
      "inputs": [
        {
          "internalType": "uint256",
          "name": "reduceAmount",
          "type": "uint256"
        }
      ],
      "name": "_reduceReserves",
      "outputs": [
        {
          "internalType": "uint256",
          "name": "",
          "type": "uint256"
        }
      ],
      "payable": false,
      "stateMutability": "nonpayable",
      "type": "function"
    },
    {
      "constant": false,
      "inputs": [
        {
          "internalType": "contract ComptrollerInterface",
          "name": "newComptroller",
          "type": "address"
        }
      ],
      "name": "_setComptroller",
      "outputs": [
        {
          "internalType": "uint256",
          "name": "",
          "type": "uint256"
        }
      ],
      "payable": false,
      "stateMutability": "nonpayable",
      "type": "function"
    },
    {
      "constant": false,
      "inputs": [
        {
          "internalType": "contract InterestRateModel",
          "name": "newInterestRateModel",
          "type": "address"
        }
      ],
      "name": "_setInterestRateModel",
      "outputs": [
        {
          "internalType": "uint256",
          "name": "",
          "type": "uint256"
        }
      ],
      "payable": false,
      "stateMutability": "nonpayable",
      "type": "function"
    },
    {
      "constant": false,
      "inputs": [
        {
          "internalType": "address payable",
          "name": "newPendingAdmin",
          "type": "address"
        }
      ],
      "name": "_setPendingAdmin",
      "outputs": [
        {
          "internalType": "uint256",
          "name": "",
          "type": "uint256"
        }
      ],
      "payable": false,
      "stateMutability": "nonpayable",
      "type": "function"
    },
    {
      "constant": false,
      "inputs": [
        {
          "internalType": "uint256",
          "name": "newReserveFactorMantissa",
          "type": "uint256"
        }
      ],
      "name": "_setReserveFactor",
      "outputs": [
        {
          "internalType": "uint256",
          "name": "",
          "type": "uint256"
        }
      ],
      "payable": false,
      "stateMutability": "nonpayable",
      "type": "function"
    },
    {
      "constant": true,
      "inputs": [],
      "name": "accrualBlockNumber",
      "outputs": [
        {
          "internalType": "uint256",
          "name": "",
          "type": "uint256"
        }
      ],
      "payable": false,
      "stateMutability": "view",
      "type": "function"
    },
    {
      "constant": false,
      "inputs": [],
      "name": "accrueInterest",
      "outputs": [
        {
          "internalType": "uint256",
          "name": "",
          "type": "uint256"
        }
      ],
      "payable": false,
      "stateMutability": "nonpayable",
      "type": "function"
    },
    {
      "constant": true,
      "inputs": [],
      "name": "admin",
      "outputs": [
        {
          "internalType": "address payable",
          "name": "",
          "type": "address"
        }
      ],
      "payable": false,
      "stateMutability": "view",
      "type": "function"
    },
    {
      "constant": true,
      "inputs": [
        {
          "internalType": "address",
          "name": "owner",
          "type": "address"
        },
        {
          "internalType": "address",
          "name": "spender",
          "type": "address"
        }
      ],
      "name": "allowance",
      "outputs": [
        {
          "internalType": "uint256",
          "name": "",
          "type": "uint256"
        }
      ],
      "payable": false,
      "stateMutability": "view",
      "type": "function"
    },
    {
      "constant": false,
      "inputs": [
        {
          "internalType": "address",
          "name": "spender",
          "type": "address"
        },
        {
          "internalType": "uint256",
          "name": "amount",
          "type": "uint256"
        }
      ],
      "name": "approve",
      "outputs": [
        {
          "internalType": "bool",
          "name": "",
          "type": "bool"
        }
      ],
      "payable": false,
      "stateMutability": "nonpayable",
      "type": "function"
    },
    {
      "constant": true,
      "inputs": [
        {
          "internalType": "address",
          "name": "owner",
          "type": "address"
        }
      ],
      "name": "balanceOf",
      "outputs": [
        {
          "internalType": "uint256",
          "name": "",
          "type": "uint256"
        }
      ],
      "payable": false,
      "stateMutability": "view",
      "type": "function"
    },
    {
      "constant": false,
      "inputs": [
        {
          "internalType": "address",
          "name": "owner",
          "type": "address"
        }
      ],
      "name": "balanceOfUnderlying",
      "outputs": [
        {
          "internalType": "uint256",
          "name": "",
          "type": "uint256"
        }
      ],
      "payable": false,
      "stateMutability": "nonpayable",
      "type": "function"
    },
    {
      "constant": false,
      "inputs": [
        {
          "internalType": "uint256",
          "name": "borrowAmount",
          "type": "uint256"
        }
      ],
      "name": "borrow",
      "outputs": [
        {
          "internalType": "uint256",
          "name": "",
          "type": "uint256"
        }
      ],
      "payable": false,
      "stateMutability": "nonpayable",
      "type": "function"
    },
    {
      "constant": false,
      "inputs": [
        {
          "internalType": "address",
          "name": "account",
          "type": "address"
        }
      ],
      "name": "borrowBalanceCurrent",
      "outputs": [
        {
          "internalType": "uint256",
          "name": "",
          "type": "uint256"
        }
      ],
      "payable": false,
      "stateMutability": "nonpayable",
      "type": "function"
    },
    {
      "constant": true,
      "inputs": [
        {
          "internalType": "address",
          "name": "account",
          "type": "address"
        }
      ],
      "name": "borrowBalanceStored",
      "outputs": [
        {
          "internalType": "uint256",
          "name": "",
          "type": "uint256"
        }
      ],
      "payable": false,
      "stateMutability": "view",
      "type": "function"
    },
    {
      "constant": true,
      "inputs": [],
      "name": "borrowIndex",
      "outputs": [
        {
          "internalType": "uint256",
          "name": "",
          "type": "uint256"
        }
      ],
      "payable": false,
      "stateMutability": "view",
      "type": "function"
    },
    {
      "constant": true,
      "inputs": [],
      "name": "borrowRatePerBlock",
      "outputs": [
        {
          "internalType": "uint256",
          "name": "",
          "type": "uint256"
        }
      ],
      "payable": false,
      "stateMutability": "view",
      "type": "function"
    },
    {
      "constant": true,
      "inputs": [],
      "name": "comptroller",
      "outputs": [
        {
          "internalType": "contract ComptrollerInterface",
          "name": "",
          "type": "address"
        }
      ],
      "payable": false,
      "stateMutability": "view",
      "type": "function"
    },
    {
      "constant": true,
      "inputs": [],
      "name": "decimals",
      "outputs": [
        {
          "internalType": "uint8",
          "name": "",
          "type": "uint8"
        }
      ],
      "payable": false,
      "stateMutability": "view",
      "type": "function"
    },
    {
      "constant": false,
      "inputs": [],
      "name": "exchangeRateCurrent",
      "outputs": [
        {
          "internalType": "uint256",
          "name": "",
          "type": "uint256"
        }
      ],
      "payable": false,
      "stateMutability": "nonpayable",
      "type": "function"
    },
    {
      "constant": true,
      "inputs": [],
      "name": "exchangeRateStored",
      "outputs": [
        {
          "internalType": "uint256",
          "name": "",
          "type": "uint256"
        }
      ],
      "payable": false,
      "stateMutability": "view",
      "type": "function"
    },
    {
      "constant": true,
      "inputs": [
        {
          "internalType": "address",
          "name": "account",
          "type": "address"
        }
      ],
      "name": "getAccountSnapshot",
      "outputs": [
        {
          "internalType": "uint256",
          "name": "",
          "type": "uint256"
        },
        {
          "internalType": "uint256",
          "name": "",
          "type": "uint256"
        },
        {
          "internalType": "uint256",
          "name": "",
          "type": "uint256"
        },
        {
          "internalType": "uint256",
          "name": "",
          "type": "uint256"
        }
      ],
      "payable": false,
      "stateMutability": "view",
      "type": "function"
    },
    {
      "constant": true,
      "inputs": [],
      "name": "getCash",
      "outputs": [
        {
          "internalType": "uint256",
          "name": "",
          "type": "uint256"
        }
      ],
      "payable": false,
      "stateMutability": "view",
      "type": "function"
    },
    {
      "constant": true,
      "inputs": [],
      "name": "initialExchangeRateMantissa",
      "outputs": [
        {
          "internalType": "uint256",
          "name": "",
          "type": "uint256"
        }
      ],
      "payable": false,
      "stateMutability": "view",
      "type": "function"
    },
    {
      "constant": false,
      "inputs": [
        {
          "internalType": "address",
          "name": "underlying_",
          "type": "address"
        },
        {
          "internalType": "contract ComptrollerInterface",
          "name": "comptroller_",
          "type": "address"
        },
        {
          "internalType": "contract InterestRateModel",
          "name": "interestRateModel_",
          "type": "address"
        },
        {
          "internalType": "uint256",
          "name": "initialExchangeRateMantissa_",
          "type": "uint256"
        },
        {
          "internalType": "string",
          "name": "name_",
          "type": "string"
        },
        {
          "internalType": "string",
          "name": "symbol_",
          "type": "string"
        },
        {
          "internalType": "uint8",
          "name": "decimals_",
          "type": "uint8"
        }
      ],
      "name": "initialize",
      "outputs": [],
      "payable": false,
      "stateMutability": "nonpayable",
      "type": "function"
    },
    {
      "constant": false,
      "inputs": [
        {
          "internalType": "contract ComptrollerInterface",
          "name": "comptroller_",
          "type": "address"
        },
        {
          "internalType": "contract InterestRateModel",
          "name": "interestRateModel_",
          "type": "address"
        },
        {
          "internalType": "uint256",
          "name": "initialExchangeRateMantissa_",
          "type": "uint256"
        },
        {
          "internalType": "string",
          "name": "name_",
          "type": "string"
        },
        {
          "internalType": "string",
          "name": "symbol_",
          "type": "string"
        },
        {
          "internalType": "uint8",
          "name": "decimals_",
          "type": "uint8"
        }
      ],
      "name": "initialize",
      "outputs": [],
      "payable": false,
      "stateMutability": "nonpayable",
      "type": "function"
    },
    {
      "constant": true,
      "inputs": [],
      "name": "interestRateModel",
      "outputs": [
        {
          "internalType": "contract InterestRateModel",
          "name": "",
          "type": "address"
        }
      ],
      "payable": false,
      "stateMutability": "view",
      "type": "function"
    },
    {
      "constant": true,
      "inputs": [],
      "name": "isCToken",
      "outputs": [
        {
          "internalType": "bool",
          "name": "",
          "type": "bool"
        }
      ],
      "payable": false,
      "stateMutability": "view",
      "type": "function"
    },
    {
      "constant": false,
      "inputs": [
        {
          "internalType": "address",
          "name": "borrower",
          "type": "address"
        },
        {
          "internalType": "uint256",
          "name": "repayAmount",
          "type": "uint256"
        },
        {
          "internalType": "contract CTokenInterface",
          "name": "cTokenCollateral",
          "type": "address"
        }
      ],
      "name": "liquidateBorrow",
      "outputs": [
        {
          "internalType": "uint256",
          "name": "",
          "type": "uint256"
        }
      ],
      "payable": false,
      "stateMutability": "nonpayable",
      "type": "function"
    },
    {
      "constant": false,
      "inputs": [
        {
          "internalType": "uint256",
          "name": "mintAmount",
          "type": "uint256"
        }
      ],
      "name": "mint",
      "outputs": [
        {
          "internalType": "uint256",
          "name": "",
          "type": "uint256"
        }
      ],
      "payable": false,
      "stateMutability": "nonpayable",
      "type": "function"
    },
    {
      "constant": true,
      "inputs": [],
      "name": "name",
      "outputs": [
        {
          "internalType": "string",
          "name": "",
          "type": "string"
        }
      ],
      "payable": false,
      "stateMutability": "view",
      "type": "function"
    },
    {
      "constant": true,
      "inputs": [],
      "name": "pendingAdmin",
      "outputs": [
        {
          "internalType": "address payable",
          "name": "",
          "type": "address"
        }
      ],
      "payable": false,
      "stateMutability": "view",
      "type": "function"
    },
    {
      "constant": false,
      "inputs": [
        {
          "internalType": "uint256",
          "name": "redeemTokens",
          "type": "uint256"
        }
      ],
      "name": "redeem",
      "outputs": [
        {
          "internalType": "uint256",
          "name": "",
          "type": "uint256"
        }
      ],
      "payable": false,
      "stateMutability": "nonpayable",
      "type": "function"
    },
    {
      "constant": false,
      "inputs": [
        {
          "internalType": "uint256",
          "name": "redeemAmount",
          "type": "uint256"
        }
      ],
      "name": "redeemUnderlying",
      "outputs": [
        {
          "internalType": "uint256",
          "name": "",
          "type": "uint256"
        }
      ],
      "payable": false,
      "stateMutability": "nonpayable",
      "type": "function"
    },
    {
      "constant": false,
      "inputs": [
        {
          "internalType": "uint256",
          "name": "repayAmount",
          "type": "uint256"
        }
      ],
      "name": "repayBorrow",
      "outputs": [
        {
          "internalType": "uint256",
          "name": "",
          "type": "uint256"
        }
      ],
      "payable": false,
      "stateMutability": "nonpayable",
      "type": "function"
    },
    {
      "constant": false,
      "inputs": [
        {
          "internalType": "address",
          "name": "borrower",
          "type": "address"
        },
        {
          "internalType": "uint256",
          "name": "repayAmount",
          "type": "uint256"
        }
      ],
      "name": "repayBorrowBehalf",
      "outputs": [
        {
          "internalType": "uint256",
          "name": "",
          "type": "uint256"
        }
      ],
      "payable": false,
      "stateMutability": "nonpayable",
      "type": "function"
    },
    {
      "constant": true,
      "inputs": [],
      "name": "reserveFactorMantissa",
      "outputs": [
        {
          "internalType": "uint256",
          "name": "",
          "type": "uint256"
        }
      ],
      "payable": false,
      "stateMutability": "view",
      "type": "function"
    },
    {
      "constant": false,
      "inputs": [
        {
          "internalType": "address",
          "name": "liquidator",
          "type": "address"
        },
        {
          "internalType": "address",
          "name": "borrower",
          "type": "address"
        },
        {
          "internalType": "uint256",
          "name": "seizeTokens",
          "type": "uint256"
        }
      ],
      "name": "seize",
      "outputs": [
        {
          "internalType": "uint256",
          "name": "",
          "type": "uint256"
        }
      ],
      "payable": false,
      "stateMutability": "nonpayable",
      "type": "function"
    },
    {
      "constant": true,
      "inputs": [],
      "name": "subsidyFund",
      "outputs": [
        {
          "internalType": "uint256",
          "name": "",
          "type": "uint256"
        }
      ],
      "payable": false,
      "stateMutability": "view",
      "type": "function"
    },
    {
      "constant": true,
      "inputs": [],
      "name": "supplyRatePerBlock",
      "outputs": [
        {
          "internalType": "uint256",
          "name": "",
          "type": "uint256"
        }
      ],
      "payable": false,
      "stateMutability": "view",
      "type": "function"
    },
    {
      "constant": false,
      "inputs": [
        {
          "internalType": "contract EIP20NonStandardInterface",
          "name": "token",
          "type": "address"
        }
      ],
      "name": "sweepToken",
      "outputs": [],
      "payable": false,
      "stateMutability": "nonpayable",
      "type": "function"
    },
    {
      "constant": true,
      "inputs": [],
      "name": "symbol",
      "outputs": [
        {
          "internalType": "string",
          "name": "",
          "type": "string"
        }
      ],
      "payable": false,
      "stateMutability": "view",
      "type": "function"
    },
    {
      "constant": true,
      "inputs": [],
      "name": "totalBorrows",
      "outputs": [
        {
          "internalType": "uint256",
          "name": "",
          "type": "uint256"
        }
      ],
      "payable": false,
      "stateMutability": "view",
      "type": "function"
    },
    {
      "constant": false,
      "inputs": [],
      "name": "totalBorrowsCurrent",
      "outputs": [
        {
          "internalType": "uint256",
          "name": "",
          "type": "uint256"
        }
      ],
      "payable": false,
      "stateMutability": "nonpayable",
      "type": "function"
    },
    {
      "constant": true,
      "inputs": [],
      "name": "totalReserves",
      "outputs": [
        {
          "internalType": "uint256",
          "name": "",
          "type": "uint256"
        }
      ],
      "payable": false,
      "stateMutability": "view",
      "type": "function"
    },
    {
      "constant": true,
      "inputs": [],
      "name": "totalSupply",
      "outputs": [
        {
          "internalType": "uint256",
          "name": "",
          "type": "uint256"
        }
      ],
      "payable": false,
      "stateMutability": "view",
      "type": "function"
    },
    {
      "constant": false,
      "inputs": [
        {
          "internalType": "address",
          "name": "dst",
          "type": "address"
        },
        {
          "internalType": "uint256",
          "name": "amount",
          "type": "uint256"
        }
      ],
      "name": "transfer",
      "outputs": [
        {
          "internalType": "bool",
          "name": "",
          "type": "bool"
        }
      ],
      "payable": false,
      "stateMutability": "nonpayable",
      "type": "function"
    },
    {
      "constant": false,
      "inputs": [
        {
          "internalType": "address",
          "name": "src",
          "type": "address"
        },
        {
          "internalType": "address",
          "name": "dst",
          "type": "address"
        },
        {
          "internalType": "uint256",
          "name": "amount",
          "type": "uint256"
        }
      ],
      "name": "transferFrom",
      "outputs": [
        {
          "internalType": "bool",
          "name": "",
          "type": "bool"
        }
      ],
      "payable": false,
      "stateMutability": "nonpayable",
      "type": "function"
    },
    {
      "constant": true,
      "inputs": [],
      "name": "underlying",
      "outputs": [
        {
          "internalType": "address",
          "name": "",
          "type": "address"
        }
      ],
      "payable": false,
      "stateMutability": "view",
      "type": "function"
    }
  ],
  "transactionHash": "0x353e14ba2a978a87490c93cb3f2469093a3d198c791e9d40018fc825d151c4f5",
  "receipt": {
    "to": null,
    "from": "0xf39Fd6e51aad88F6F4ce6aB8827279cffFb92266",
    "contractAddress": "0x99bbA657f2BbC93c02D617f8bA121cB8Fc104Acf",
    "transactionIndex": 0,
    "gasUsed": "5312168",
    "logsBloom": "0x00000000000000000000000000000000000000000000000000000000000000000000000000000040000000000000000000000000000000000000000800000000000000000000000000000000000000000000000000000000000000000000000000000100000000000000000000000000000000080000000000000000000000000000000000000000000000000000000000000000000000100000000000000000000000000000000100000000000000000000000000000000000000000000000000000004000000000002000000000000000000000000000000100000000000000000000000000000000000000000000000000000000000000000000000000000",
    "blockHash": "0x10dc9a0952e64e074f05b04ef251537bedec103b2351a139b23d4ca2347e525e",
    "transactionHash": "0x353e14ba2a978a87490c93cb3f2469093a3d198c791e9d40018fc825d151c4f5",
    "logs": [
      {
        "transactionIndex": 0,
        "blockNumber": 43,
        "transactionHash": "0x353e14ba2a978a87490c93cb3f2469093a3d198c791e9d40018fc825d151c4f5",
        "address": "0x99bbA657f2BbC93c02D617f8bA121cB8Fc104Acf",
        "topics": [
          "0x7ac369dbd14fa5ea3f473ed67cc9d598964a77501540ba6751eb0b3decf5870d"
        ],
        "data": "0x00000000000000000000000000000000000000000000000000000000000000000000000000000000000000009a676e781a523b5d0c0e43731313a708cb607508",
        "logIndex": 0,
        "blockHash": "0x10dc9a0952e64e074f05b04ef251537bedec103b2351a139b23d4ca2347e525e"
      },
      {
        "transactionIndex": 0,
        "blockNumber": 43,
        "transactionHash": "0x353e14ba2a978a87490c93cb3f2469093a3d198c791e9d40018fc825d151c4f5",
        "address": "0x99bbA657f2BbC93c02D617f8bA121cB8Fc104Acf",
        "topics": [
          "0xedffc32e068c7c95dfd4bdfd5c4d939a084d6b11c4199eac8436ed234d72f926"
        ],
        "data": "0x000000000000000000000000000000000000000000000000000000000000000000000000000000000000000059b670e9fa9d0a427751af201d676719a970857b",
        "logIndex": 1,
        "blockHash": "0x10dc9a0952e64e074f05b04ef251537bedec103b2351a139b23d4ca2347e525e"
      }
    ],
    "blockNumber": 43,
    "cumulativeGasUsed": "5312168",
    "status": 1,
    "byzantium": true
  },
  "args": [
    "0xDc64a140Aa3E981100a9becA4E685f962f0cF6C9",
    "0x9A676e781A523b5d0C0e43731313A708CB607508",
    "0x59b670e9fA9D0A427751Af201D676719a970857b",
    "20000000000000000",
    "tropykus DOC",
    "cDOC",
    18,
    "0xf39Fd6e51aad88F6F4ce6aB8827279cffFb92266"
  ],
  "solcInputHash": "f248c35aedbb668446e4c5a0022a767b",
  "metadata": "{\"compiler\":{\"version\":\"0.5.17+commit.d19bba13\"},\"language\":\"Solidity\",\"output\":{\"abi\":[{\"inputs\":[{\"internalType\":\"address\",\"name\":\"underlying_\",\"type\":\"address\"},{\"internalType\":\"contract ComptrollerInterface\",\"name\":\"comptroller_\",\"type\":\"address\"},{\"internalType\":\"contract InterestRateModel\",\"name\":\"interestRateModel_\",\"type\":\"address\"},{\"internalType\":\"uint256\",\"name\":\"initialExchangeRateMantissa_\",\"type\":\"uint256\"},{\"internalType\":\"string\",\"name\":\"name_\",\"type\":\"string\"},{\"internalType\":\"string\",\"name\":\"symbol_\",\"type\":\"string\"},{\"internalType\":\"uint8\",\"name\":\"decimals_\",\"type\":\"uint8\"},{\"internalType\":\"address payable\",\"name\":\"admin_\",\"type\":\"address\"}],\"payable\":false,\"stateMutability\":\"nonpayable\",\"type\":\"constructor\"},{\"anonymous\":false,\"inputs\":[{\"indexed\":false,\"internalType\":\"uint256\",\"name\":\"cashPrior\",\"type\":\"uint256\"},{\"indexed\":false,\"internalType\":\"uint256\",\"name\":\"interestAccumulated\",\"type\":\"uint256\"},{\"indexed\":false,\"internalType\":\"uint256\",\"name\":\"borrowIndex\",\"type\":\"uint256\"},{\"indexed\":false,\"internalType\":\"uint256\",\"name\":\"totalBorrows\",\"type\":\"uint256\"}],\"name\":\"AccrueInterest\",\"type\":\"event\"},{\"anonymous\":false,\"inputs\":[{\"indexed\":true,\"internalType\":\"address\",\"name\":\"owner\",\"type\":\"address\"},{\"indexed\":true,\"internalType\":\"address\",\"name\":\"spender\",\"type\":\"address\"},{\"indexed\":false,\"internalType\":\"uint256\",\"name\":\"amount\",\"type\":\"uint256\"}],\"name\":\"Approval\",\"type\":\"event\"},{\"anonymous\":false,\"inputs\":[{\"indexed\":true,\"internalType\":\"address\",\"name\":\"borrower\",\"type\":\"address\"},{\"indexed\":false,\"internalType\":\"uint256\",\"name\":\"borrowAmount\",\"type\":\"uint256\"},{\"indexed\":false,\"internalType\":\"uint256\",\"name\":\"accountBorrows\",\"type\":\"uint256\"},{\"indexed\":false,\"internalType\":\"uint256\",\"name\":\"totalBorrows\",\"type\":\"uint256\"}],\"name\":\"Borrow\",\"type\":\"event\"},{\"anonymous\":false,\"inputs\":[{\"indexed\":false,\"internalType\":\"uint256\",\"name\":\"error\",\"type\":\"uint256\"},{\"indexed\":false,\"internalType\":\"uint256\",\"name\":\"info\",\"type\":\"uint256\"},{\"indexed\":false,\"internalType\":\"uint256\",\"name\":\"detail\",\"type\":\"uint256\"}],\"name\":\"Failure\",\"type\":\"event\"},{\"anonymous\":false,\"inputs\":[{\"indexed\":true,\"internalType\":\"address\",\"name\":\"liquidator\",\"type\":\"address\"},{\"indexed\":true,\"internalType\":\"address\",\"name\":\"borrower\",\"type\":\"address\"},{\"indexed\":false,\"internalType\":\"uint256\",\"name\":\"repayAmount\",\"type\":\"uint256\"},{\"indexed\":true,\"internalType\":\"address\",\"name\":\"cTokenCollateral\",\"type\":\"address\"},{\"indexed\":false,\"internalType\":\"uint256\",\"name\":\"seizeTokens\",\"type\":\"uint256\"}],\"name\":\"LiquidateBorrow\",\"type\":\"event\"},{\"anonymous\":false,\"inputs\":[{\"indexed\":true,\"internalType\":\"address\",\"name\":\"minter\",\"type\":\"address\"},{\"indexed\":false,\"internalType\":\"uint256\",\"name\":\"mintAmount\",\"type\":\"uint256\"},{\"indexed\":false,\"internalType\":\"uint256\",\"name\":\"mintTokens\",\"type\":\"uint256\"}],\"name\":\"Mint\",\"type\":\"event\"},{\"anonymous\":false,\"inputs\":[{\"indexed\":false,\"internalType\":\"address\",\"name\":\"oldAdmin\",\"type\":\"address\"},{\"indexed\":false,\"internalType\":\"address\",\"name\":\"newAdmin\",\"type\":\"address\"}],\"name\":\"NewAdmin\",\"type\":\"event\"},{\"anonymous\":false,\"inputs\":[{\"indexed\":false,\"internalType\":\"contract ComptrollerInterface\",\"name\":\"oldComptroller\",\"type\":\"address\"},{\"indexed\":false,\"internalType\":\"contract ComptrollerInterface\",\"name\":\"newComptroller\",\"type\":\"address\"}],\"name\":\"NewComptroller\",\"type\":\"event\"},{\"anonymous\":false,\"inputs\":[{\"indexed\":false,\"internalType\":\"contract InterestRateModel\",\"name\":\"oldInterestRateModel\",\"type\":\"address\"},{\"indexed\":false,\"internalType\":\"contract InterestRateModel\",\"name\":\"newInterestRateModel\",\"type\":\"address\"}],\"name\":\"NewMarketInterestRateModel\",\"type\":\"event\"},{\"anonymous\":false,\"inputs\":[{\"indexed\":false,\"internalType\":\"address\",\"name\":\"oldPendingAdmin\",\"type\":\"address\"},{\"indexed\":false,\"internalType\":\"address\",\"name\":\"newPendingAdmin\",\"type\":\"address\"}],\"name\":\"NewPendingAdmin\",\"type\":\"event\"},{\"anonymous\":false,\"inputs\":[{\"indexed\":false,\"internalType\":\"uint256\",\"name\":\"oldReserveFactorMantissa\",\"type\":\"uint256\"},{\"indexed\":false,\"internalType\":\"uint256\",\"name\":\"newReserveFactorMantissa\",\"type\":\"uint256\"}],\"name\":\"NewReserveFactor\",\"type\":\"event\"},{\"anonymous\":false,\"inputs\":[{\"indexed\":true,\"internalType\":\"address\",\"name\":\"redeemer\",\"type\":\"address\"},{\"indexed\":false,\"internalType\":\"uint256\",\"name\":\"redeemAmount\",\"type\":\"uint256\"},{\"indexed\":false,\"internalType\":\"uint256\",\"name\":\"redeemTokens\",\"type\":\"uint256\"}],\"name\":\"Redeem\",\"type\":\"event\"},{\"anonymous\":false,\"inputs\":[{\"indexed\":true,\"internalType\":\"address\",\"name\":\"payer\",\"type\":\"address\"},{\"indexed\":true,\"internalType\":\"address\",\"name\":\"borrower\",\"type\":\"address\"},{\"indexed\":false,\"internalType\":\"uint256\",\"name\":\"repayAmount\",\"type\":\"uint256\"},{\"indexed\":false,\"internalType\":\"uint256\",\"name\":\"accountBorrows\",\"type\":\"uint256\"},{\"indexed\":false,\"internalType\":\"uint256\",\"name\":\"totalBorrows\",\"type\":\"uint256\"}],\"name\":\"RepayBorrow\",\"type\":\"event\"},{\"anonymous\":false,\"inputs\":[{\"indexed\":false,\"internalType\":\"address\",\"name\":\"benefactor\",\"type\":\"address\"},{\"indexed\":false,\"internalType\":\"uint256\",\"name\":\"addAmount\",\"type\":\"uint256\"},{\"indexed\":false,\"internalType\":\"uint256\",\"name\":\"newTotalReserves\",\"type\":\"uint256\"}],\"name\":\"ReservesAdded\",\"type\":\"event\"},{\"anonymous\":false,\"inputs\":[{\"indexed\":false,\"internalType\":\"address\",\"name\":\"admin\",\"type\":\"address\"},{\"indexed\":false,\"internalType\":\"uint256\",\"name\":\"reduceAmount\",\"type\":\"uint256\"},{\"indexed\":false,\"internalType\":\"uint256\",\"name\":\"newTotalReserves\",\"type\":\"uint256\"}],\"name\":\"ReservesReduced\",\"type\":\"event\"},{\"anonymous\":false,\"inputs\":[{\"indexed\":false,\"internalType\":\"address\",\"name\":\"benefactor\",\"type\":\"address\"},{\"indexed\":false,\"internalType\":\"uint256\",\"name\":\"addAmount\",\"type\":\"uint256\"},{\"indexed\":false,\"internalType\":\"uint256\",\"name\":\"newSubsidyFund\",\"type\":\"uint256\"}],\"name\":\"SubsidyAdded\",\"type\":\"event\"},{\"anonymous\":false,\"inputs\":[{\"indexed\":true,\"internalType\":\"address\",\"name\":\"from\",\"type\":\"address\"},{\"indexed\":true,\"internalType\":\"address\",\"name\":\"to\",\"type\":\"address\"},{\"indexed\":false,\"internalType\":\"uint256\",\"name\":\"amount\",\"type\":\"uint256\"}],\"name\":\"Transfer\",\"type\":\"event\"},{\"constant\":false,\"inputs\":[],\"name\":\"_acceptAdmin\",\"outputs\":[{\"internalType\":\"uint256\",\"name\":\"\",\"type\":\"uint256\"}],\"payable\":false,\"stateMutability\":\"nonpayable\",\"type\":\"function\"},{\"constant\":false,\"inputs\":[{\"internalType\":\"uint256\",\"name\":\"addAmount\",\"type\":\"uint256\"}],\"name\":\"_addReserves\",\"outputs\":[{\"internalType\":\"uint256\",\"name\":\"\",\"type\":\"uint256\"}],\"payable\":false,\"stateMutability\":\"nonpayable\",\"type\":\"function\"},{\"constant\":false,\"inputs\":[{\"internalType\":\"uint256\",\"name\":\"reduceAmount\",\"type\":\"uint256\"}],\"name\":\"_reduceReserves\",\"outputs\":[{\"internalType\":\"uint256\",\"name\":\"\",\"type\":\"uint256\"}],\"payable\":false,\"stateMutability\":\"nonpayable\",\"type\":\"function\"},{\"constant\":false,\"inputs\":[{\"internalType\":\"contract ComptrollerInterface\",\"name\":\"newComptroller\",\"type\":\"address\"}],\"name\":\"_setComptroller\",\"outputs\":[{\"internalType\":\"uint256\",\"name\":\"\",\"type\":\"uint256\"}],\"payable\":false,\"stateMutability\":\"nonpayable\",\"type\":\"function\"},{\"constant\":false,\"inputs\":[{\"internalType\":\"contract InterestRateModel\",\"name\":\"newInterestRateModel\",\"type\":\"address\"}],\"name\":\"_setInterestRateModel\",\"outputs\":[{\"internalType\":\"uint256\",\"name\":\"\",\"type\":\"uint256\"}],\"payable\":false,\"stateMutability\":\"nonpayable\",\"type\":\"function\"},{\"constant\":false,\"inputs\":[{\"internalType\":\"address payable\",\"name\":\"newPendingAdmin\",\"type\":\"address\"}],\"name\":\"_setPendingAdmin\",\"outputs\":[{\"internalType\":\"uint256\",\"name\":\"\",\"type\":\"uint256\"}],\"payable\":false,\"stateMutability\":\"nonpayable\",\"type\":\"function\"},{\"constant\":false,\"inputs\":[{\"internalType\":\"uint256\",\"name\":\"newReserveFactorMantissa\",\"type\":\"uint256\"}],\"name\":\"_setReserveFactor\",\"outputs\":[{\"internalType\":\"uint256\",\"name\":\"\",\"type\":\"uint256\"}],\"payable\":false,\"stateMutability\":\"nonpayable\",\"type\":\"function\"},{\"constant\":true,\"inputs\":[],\"name\":\"accrualBlockNumber\",\"outputs\":[{\"internalType\":\"uint256\",\"name\":\"\",\"type\":\"uint256\"}],\"payable\":false,\"stateMutability\":\"view\",\"type\":\"function\"},{\"constant\":false,\"inputs\":[],\"name\":\"accrueInterest\",\"outputs\":[{\"internalType\":\"uint256\",\"name\":\"\",\"type\":\"uint256\"}],\"payable\":false,\"stateMutability\":\"nonpayable\",\"type\":\"function\"},{\"constant\":true,\"inputs\":[],\"name\":\"admin\",\"outputs\":[{\"internalType\":\"address payable\",\"name\":\"\",\"type\":\"address\"}],\"payable\":false,\"stateMutability\":\"view\",\"type\":\"function\"},{\"constant\":true,\"inputs\":[{\"internalType\":\"address\",\"name\":\"owner\",\"type\":\"address\"},{\"internalType\":\"address\",\"name\":\"spender\",\"type\":\"address\"}],\"name\":\"allowance\",\"outputs\":[{\"internalType\":\"uint256\",\"name\":\"\",\"type\":\"uint256\"}],\"payable\":false,\"stateMutability\":\"view\",\"type\":\"function\"},{\"constant\":false,\"inputs\":[{\"internalType\":\"address\",\"name\":\"spender\",\"type\":\"address\"},{\"internalType\":\"uint256\",\"name\":\"amount\",\"type\":\"uint256\"}],\"name\":\"approve\",\"outputs\":[{\"internalType\":\"bool\",\"name\":\"\",\"type\":\"bool\"}],\"payable\":false,\"stateMutability\":\"nonpayable\",\"type\":\"function\"},{\"constant\":true,\"inputs\":[{\"internalType\":\"address\",\"name\":\"owner\",\"type\":\"address\"}],\"name\":\"balanceOf\",\"outputs\":[{\"internalType\":\"uint256\",\"name\":\"\",\"type\":\"uint256\"}],\"payable\":false,\"stateMutability\":\"view\",\"type\":\"function\"},{\"constant\":false,\"inputs\":[{\"internalType\":\"address\",\"name\":\"owner\",\"type\":\"address\"}],\"name\":\"balanceOfUnderlying\",\"outputs\":[{\"internalType\":\"uint256\",\"name\":\"\",\"type\":\"uint256\"}],\"payable\":false,\"stateMutability\":\"nonpayable\",\"type\":\"function\"},{\"constant\":false,\"inputs\":[{\"internalType\":\"uint256\",\"name\":\"borrowAmount\",\"type\":\"uint256\"}],\"name\":\"borrow\",\"outputs\":[{\"internalType\":\"uint256\",\"name\":\"\",\"type\":\"uint256\"}],\"payable\":false,\"stateMutability\":\"nonpayable\",\"type\":\"function\"},{\"constant\":false,\"inputs\":[{\"internalType\":\"address\",\"name\":\"account\",\"type\":\"address\"}],\"name\":\"borrowBalanceCurrent\",\"outputs\":[{\"internalType\":\"uint256\",\"name\":\"\",\"type\":\"uint256\"}],\"payable\":false,\"stateMutability\":\"nonpayable\",\"type\":\"function\"},{\"constant\":true,\"inputs\":[{\"internalType\":\"address\",\"name\":\"account\",\"type\":\"address\"}],\"name\":\"borrowBalanceStored\",\"outputs\":[{\"internalType\":\"uint256\",\"name\":\"\",\"type\":\"uint256\"}],\"payable\":false,\"stateMutability\":\"view\",\"type\":\"function\"},{\"constant\":true,\"inputs\":[],\"name\":\"borrowIndex\",\"outputs\":[{\"internalType\":\"uint256\",\"name\":\"\",\"type\":\"uint256\"}],\"payable\":false,\"stateMutability\":\"view\",\"type\":\"function\"},{\"constant\":true,\"inputs\":[],\"name\":\"borrowRatePerBlock\",\"outputs\":[{\"internalType\":\"uint256\",\"name\":\"\",\"type\":\"uint256\"}],\"payable\":false,\"stateMutability\":\"view\",\"type\":\"function\"},{\"constant\":true,\"inputs\":[],\"name\":\"comptroller\",\"outputs\":[{\"internalType\":\"contract ComptrollerInterface\",\"name\":\"\",\"type\":\"address\"}],\"payable\":false,\"stateMutability\":\"view\",\"type\":\"function\"},{\"constant\":true,\"inputs\":[],\"name\":\"decimals\",\"outputs\":[{\"internalType\":\"uint8\",\"name\":\"\",\"type\":\"uint8\"}],\"payable\":false,\"stateMutability\":\"view\",\"type\":\"function\"},{\"constant\":false,\"inputs\":[],\"name\":\"exchangeRateCurrent\",\"outputs\":[{\"internalType\":\"uint256\",\"name\":\"\",\"type\":\"uint256\"}],\"payable\":false,\"stateMutability\":\"nonpayable\",\"type\":\"function\"},{\"constant\":true,\"inputs\":[],\"name\":\"exchangeRateStored\",\"outputs\":[{\"internalType\":\"uint256\",\"name\":\"\",\"type\":\"uint256\"}],\"payable\":false,\"stateMutability\":\"view\",\"type\":\"function\"},{\"constant\":true,\"inputs\":[{\"internalType\":\"address\",\"name\":\"account\",\"type\":\"address\"}],\"name\":\"getAccountSnapshot\",\"outputs\":[{\"internalType\":\"uint256\",\"name\":\"\",\"type\":\"uint256\"},{\"internalType\":\"uint256\",\"name\":\"\",\"type\":\"uint256\"},{\"internalType\":\"uint256\",\"name\":\"\",\"type\":\"uint256\"},{\"internalType\":\"uint256\",\"name\":\"\",\"type\":\"uint256\"}],\"payable\":false,\"stateMutability\":\"view\",\"type\":\"function\"},{\"constant\":true,\"inputs\":[],\"name\":\"getCash\",\"outputs\":[{\"internalType\":\"uint256\",\"name\":\"\",\"type\":\"uint256\"}],\"payable\":false,\"stateMutability\":\"view\",\"type\":\"function\"},{\"constant\":true,\"inputs\":[],\"name\":\"initialExchangeRateMantissa\",\"outputs\":[{\"internalType\":\"uint256\",\"name\":\"\",\"type\":\"uint256\"}],\"payable\":false,\"stateMutability\":\"view\",\"type\":\"function\"},{\"constant\":false,\"inputs\":[{\"internalType\":\"address\",\"name\":\"underlying_\",\"type\":\"address\"},{\"internalType\":\"contract ComptrollerInterface\",\"name\":\"comptroller_\",\"type\":\"address\"},{\"internalType\":\"contract InterestRateModel\",\"name\":\"interestRateModel_\",\"type\":\"address\"},{\"internalType\":\"uint256\",\"name\":\"initialExchangeRateMantissa_\",\"type\":\"uint256\"},{\"internalType\":\"string\",\"name\":\"name_\",\"type\":\"string\"},{\"internalType\":\"string\",\"name\":\"symbol_\",\"type\":\"string\"},{\"internalType\":\"uint8\",\"name\":\"decimals_\",\"type\":\"uint8\"}],\"name\":\"initialize\",\"outputs\":[],\"payable\":false,\"stateMutability\":\"nonpayable\",\"type\":\"function\"},{\"constant\":false,\"inputs\":[{\"internalType\":\"contract ComptrollerInterface\",\"name\":\"comptroller_\",\"type\":\"address\"},{\"internalType\":\"contract InterestRateModel\",\"name\":\"interestRateModel_\",\"type\":\"address\"},{\"internalType\":\"uint256\",\"name\":\"initialExchangeRateMantissa_\",\"type\":\"uint256\"},{\"internalType\":\"string\",\"name\":\"name_\",\"type\":\"string\"},{\"internalType\":\"string\",\"name\":\"symbol_\",\"type\":\"string\"},{\"internalType\":\"uint8\",\"name\":\"decimals_\",\"type\":\"uint8\"}],\"name\":\"initialize\",\"outputs\":[],\"payable\":false,\"stateMutability\":\"nonpayable\",\"type\":\"function\"},{\"constant\":true,\"inputs\":[],\"name\":\"interestRateModel\",\"outputs\":[{\"internalType\":\"contract InterestRateModel\",\"name\":\"\",\"type\":\"address\"}],\"payable\":false,\"stateMutability\":\"view\",\"type\":\"function\"},{\"constant\":true,\"inputs\":[],\"name\":\"isCToken\",\"outputs\":[{\"internalType\":\"bool\",\"name\":\"\",\"type\":\"bool\"}],\"payable\":false,\"stateMutability\":\"view\",\"type\":\"function\"},{\"constant\":false,\"inputs\":[{\"internalType\":\"address\",\"name\":\"borrower\",\"type\":\"address\"},{\"internalType\":\"uint256\",\"name\":\"repayAmount\",\"type\":\"uint256\"},{\"internalType\":\"contract CTokenInterface\",\"name\":\"cTokenCollateral\",\"type\":\"address\"}],\"name\":\"liquidateBorrow\",\"outputs\":[{\"internalType\":\"uint256\",\"name\":\"\",\"type\":\"uint256\"}],\"payable\":false,\"stateMutability\":\"nonpayable\",\"type\":\"function\"},{\"constant\":false,\"inputs\":[{\"internalType\":\"uint256\",\"name\":\"mintAmount\",\"type\":\"uint256\"}],\"name\":\"mint\",\"outputs\":[{\"internalType\":\"uint256\",\"name\":\"\",\"type\":\"uint256\"}],\"payable\":false,\"stateMutability\":\"nonpayable\",\"type\":\"function\"},{\"constant\":true,\"inputs\":[],\"name\":\"name\",\"outputs\":[{\"internalType\":\"string\",\"name\":\"\",\"type\":\"string\"}],\"payable\":false,\"stateMutability\":\"view\",\"type\":\"function\"},{\"constant\":true,\"inputs\":[],\"name\":\"pendingAdmin\",\"outputs\":[{\"internalType\":\"address payable\",\"name\":\"\",\"type\":\"address\"}],\"payable\":false,\"stateMutability\":\"view\",\"type\":\"function\"},{\"constant\":false,\"inputs\":[{\"internalType\":\"uint256\",\"name\":\"redeemTokens\",\"type\":\"uint256\"}],\"name\":\"redeem\",\"outputs\":[{\"internalType\":\"uint256\",\"name\":\"\",\"type\":\"uint256\"}],\"payable\":false,\"stateMutability\":\"nonpayable\",\"type\":\"function\"},{\"constant\":false,\"inputs\":[{\"internalType\":\"uint256\",\"name\":\"redeemAmount\",\"type\":\"uint256\"}],\"name\":\"redeemUnderlying\",\"outputs\":[{\"internalType\":\"uint256\",\"name\":\"\",\"type\":\"uint256\"}],\"payable\":false,\"stateMutability\":\"nonpayable\",\"type\":\"function\"},{\"constant\":false,\"inputs\":[{\"internalType\":\"uint256\",\"name\":\"repayAmount\",\"type\":\"uint256\"}],\"name\":\"repayBorrow\",\"outputs\":[{\"internalType\":\"uint256\",\"name\":\"\",\"type\":\"uint256\"}],\"payable\":false,\"stateMutability\":\"nonpayable\",\"type\":\"function\"},{\"constant\":false,\"inputs\":[{\"internalType\":\"address\",\"name\":\"borrower\",\"type\":\"address\"},{\"internalType\":\"uint256\",\"name\":\"repayAmount\",\"type\":\"uint256\"}],\"name\":\"repayBorrowBehalf\",\"outputs\":[{\"internalType\":\"uint256\",\"name\":\"\",\"type\":\"uint256\"}],\"payable\":false,\"stateMutability\":\"nonpayable\",\"type\":\"function\"},{\"constant\":true,\"inputs\":[],\"name\":\"reserveFactorMantissa\",\"outputs\":[{\"internalType\":\"uint256\",\"name\":\"\",\"type\":\"uint256\"}],\"payable\":false,\"stateMutability\":\"view\",\"type\":\"function\"},{\"constant\":false,\"inputs\":[{\"internalType\":\"address\",\"name\":\"liquidator\",\"type\":\"address\"},{\"internalType\":\"address\",\"name\":\"borrower\",\"type\":\"address\"},{\"internalType\":\"uint256\",\"name\":\"seizeTokens\",\"type\":\"uint256\"}],\"name\":\"seize\",\"outputs\":[{\"internalType\":\"uint256\",\"name\":\"\",\"type\":\"uint256\"}],\"payable\":false,\"stateMutability\":\"nonpayable\",\"type\":\"function\"},{\"constant\":true,\"inputs\":[],\"name\":\"subsidyFund\",\"outputs\":[{\"internalType\":\"uint256\",\"name\":\"\",\"type\":\"uint256\"}],\"payable\":false,\"stateMutability\":\"view\",\"type\":\"function\"},{\"constant\":true,\"inputs\":[],\"name\":\"supplyRatePerBlock\",\"outputs\":[{\"internalType\":\"uint256\",\"name\":\"\",\"type\":\"uint256\"}],\"payable\":false,\"stateMutability\":\"view\",\"type\":\"function\"},{\"constant\":false,\"inputs\":[{\"internalType\":\"contract EIP20NonStandardInterface\",\"name\":\"token\",\"type\":\"address\"}],\"name\":\"sweepToken\",\"outputs\":[],\"payable\":false,\"stateMutability\":\"nonpayable\",\"type\":\"function\"},{\"constant\":true,\"inputs\":[],\"name\":\"symbol\",\"outputs\":[{\"internalType\":\"string\",\"name\":\"\",\"type\":\"string\"}],\"payable\":false,\"stateMutability\":\"view\",\"type\":\"function\"},{\"constant\":true,\"inputs\":[],\"name\":\"totalBorrows\",\"outputs\":[{\"internalType\":\"uint256\",\"name\":\"\",\"type\":\"uint256\"}],\"payable\":false,\"stateMutability\":\"view\",\"type\":\"function\"},{\"constant\":false,\"inputs\":[],\"name\":\"totalBorrowsCurrent\",\"outputs\":[{\"internalType\":\"uint256\",\"name\":\"\",\"type\":\"uint256\"}],\"payable\":false,\"stateMutability\":\"nonpayable\",\"type\":\"function\"},{\"constant\":true,\"inputs\":[],\"name\":\"totalReserves\",\"outputs\":[{\"internalType\":\"uint256\",\"name\":\"\",\"type\":\"uint256\"}],\"payable\":false,\"stateMutability\":\"view\",\"type\":\"function\"},{\"constant\":true,\"inputs\":[],\"name\":\"totalSupply\",\"outputs\":[{\"internalType\":\"uint256\",\"name\":\"\",\"type\":\"uint256\"}],\"payable\":false,\"stateMutability\":\"view\",\"type\":\"function\"},{\"constant\":false,\"inputs\":[{\"internalType\":\"address\",\"name\":\"dst\",\"type\":\"address\"},{\"internalType\":\"uint256\",\"name\":\"amount\",\"type\":\"uint256\"}],\"name\":\"transfer\",\"outputs\":[{\"internalType\":\"bool\",\"name\":\"\",\"type\":\"bool\"}],\"payable\":false,\"stateMutability\":\"nonpayable\",\"type\":\"function\"},{\"constant\":false,\"inputs\":[{\"internalType\":\"address\",\"name\":\"src\",\"type\":\"address\"},{\"internalType\":\"address\",\"name\":\"dst\",\"type\":\"address\"},{\"internalType\":\"uint256\",\"name\":\"amount\",\"type\":\"uint256\"}],\"name\":\"transferFrom\",\"outputs\":[{\"internalType\":\"bool\",\"name\":\"\",\"type\":\"bool\"}],\"payable\":false,\"stateMutability\":\"nonpayable\",\"type\":\"function\"},{\"constant\":true,\"inputs\":[],\"name\":\"underlying\",\"outputs\":[{\"internalType\":\"address\",\"name\":\"\",\"type\":\"address\"}],\"payable\":false,\"stateMutability\":\"view\",\"type\":\"function\"}],\"devdoc\":{\"author\":\"tropykus\",\"methods\":{\"_acceptAdmin()\":{\"details\":\"Admin function for pending admin to accept role and update admin\",\"return\":\"uint 0=success, otherwise a failure (see ErrorReporter.sol for details)\"},\"_addReserves(uint256)\":{\"params\":{\"addAmount\":\"The amount fo underlying token to add as reserves\"},\"return\":\"uint 0=success, otherwise a failure (see ErrorReporter.sol for details)\"},\"_reduceReserves(uint256)\":{\"params\":{\"reduceAmount\":\"Amount of reduction to reserves\"},\"return\":\"uint 0=success, otherwise a failure (see ErrorReporter.sol for details)\"},\"_setComptroller(address)\":{\"details\":\"Admin function to set a new comptroller\",\"return\":\"uint 0=success, otherwise a failure (see ErrorReporter.sol for details)\"},\"_setInterestRateModel(address)\":{\"details\":\"Admin function to accrue interest and update the interest rate model\",\"params\":{\"newInterestRateModel\":\"the new interest rate model to use\"},\"return\":\"uint 0=success, otherwise a failure (see ErrorReporter.sol for details)\"},\"_setPendingAdmin(address)\":{\"details\":\"Admin function to begin change of admin. The newPendingAdmin must call `_acceptAdmin` to finalize the transfer.\",\"params\":{\"newPendingAdmin\":\"New pending admin.\"},\"return\":\"uint 0=success, otherwise a failure (see ErrorReporter.sol for details)\"},\"_setReserveFactor(uint256)\":{\"details\":\"Admin function to accrue interest and set a new reserve factor\",\"return\":\"uint 0=success, otherwise a failure (see ErrorReporter.sol for details)\"},\"accrueInterest()\":{\"details\":\"This calculates interest accrued from the last checkpointed block  up to the current block and writes new checkpoint to storage.\"},\"allowance(address,address)\":{\"params\":{\"owner\":\"The address of the account which owns the tokens to be spent\",\"spender\":\"The address of the account which may transfer tokens\"},\"return\":\"The number of tokens allowed to be spent (-1 means infinite)\"},\"approve(address,uint256)\":{\"details\":\"This will overwrite the approval amount for `spender` and is subject to issues noted [here](https://eips.ethereum.org/EIPS/eip-20#approve)\",\"params\":{\"amount\":\"The number of tokens that are approved (-1 means infinite)\",\"spender\":\"The address of the account which may transfer tokens\"},\"return\":\"Whether or not the approval succeeded\"},\"balanceOf(address)\":{\"params\":{\"owner\":\"The address of the account to query\"},\"return\":\"The number of tokens owned by `owner`\"},\"balanceOfUnderlying(address)\":{\"details\":\"This also accrues interest in a transaction\",\"params\":{\"owner\":\"The address of the account to query\"},\"return\":\"The amount of underlying owned by `owner`\"},\"borrow(uint256)\":{\"params\":{\"borrowAmount\":\"The amount of the underlying asset to borrow\"},\"return\":\"uint 0=success, otherwise a failure (see ErrorReporter.sol for details)\"},\"borrowBalanceCurrent(address)\":{\"params\":{\"account\":\"The address whose balance should be calculated after updating borrowIndex\"},\"return\":\"The calculated balance\"},\"borrowBalanceStored(address)\":{\"params\":{\"account\":\"The address whose balance should be calculated\"},\"return\":\"The calculated balance\"},\"borrowRatePerBlock()\":{\"return\":\"The borrow interest rate per block, scaled by 1e18\"},\"constructor\":{\"params\":{\"admin_\":\"Address of the administrator of this token\",\"comptroller_\":\"The address of the Comptroller\",\"decimals_\":\"ERC-20 decimal precision of this token\",\"initialExchangeRateMantissa_\":\"The initial exchange rate, scaled by 1e18\",\"interestRateModel_\":\"The address of the interest rate model\",\"name_\":\"ERC-20 name of this token\",\"symbol_\":\"ERC-20 symbol of this token\",\"underlying_\":\"The address of the underlying asset\"}},\"exchangeRateCurrent()\":{\"return\":\"Calculated exchange rate scaled by 1e18\"},\"exchangeRateStored()\":{\"details\":\"This function does not accrue interest before calculating the exchange rate\",\"return\":\"Calculated exchange rate scaled by 1e18\"},\"getAccountSnapshot(address)\":{\"details\":\"This is used by comptroller to more efficiently perform liquidity checks.\",\"params\":{\"account\":\"Address of the account to snapshot\"},\"return\":\"(possible error, token balance, borrow balance, exchange rate mantissa)\"},\"getCash()\":{\"return\":\"The quantity of underlying asset owned by this contract\"},\"initialize(address,address,address,uint256,string,string,uint8)\":{\"params\":{\"comptroller_\":\"The address of the Comptroller\",\"decimals_\":\"ERC-20 decimal precision of this token\",\"initialExchangeRateMantissa_\":\"The initial exchange rate, scaled by 1e18\",\"interestRateModel_\":\"The address of the interest rate model\",\"name_\":\"ERC-20 name of this token\",\"symbol_\":\"ERC-20 symbol of this token\",\"underlying_\":\"The address of the underlying asset\"}},\"initialize(address,address,uint256,string,string,uint8)\":{\"params\":{\"comptroller_\":\"The address of the Comptroller\",\"decimals_\":\"EIP-20 decimal precision of this token\",\"initialExchangeRateMantissa_\":\"The initial exchange rate, scaled by 1e18\",\"interestRateModel_\":\"The address of the interest rate model\",\"name_\":\"EIP-20 name of this token\",\"symbol_\":\"EIP-20 symbol of this token\"}},\"liquidateBorrow(address,uint256,address)\":{\"params\":{\"borrower\":\"The borrower of this cToken to be liquidated\",\"cTokenCollateral\":\"The market in which to seize collateral from the borrower\",\"repayAmount\":\"The amount of the underlying borrowed asset to repay\"},\"return\":\"uint 0=success, otherwise a failure (see ErrorReporter.sol for details)\"},\"mint(uint256)\":{\"details\":\"Accrues interest whether or not the operation succeeds, unless reverted\",\"params\":{\"mintAmount\":\"The amount of the underlying asset to supply\"},\"return\":\"uint 0=success, otherwise a failure (see ErrorReporter.sol for details)\"},\"redeem(uint256)\":{\"details\":\"Accrues interest whether or not the operation succeeds, unless reverted\",\"params\":{\"redeemTokens\":\"The number of cTokens to redeem into underlying\"},\"return\":\"uint 0=success, otherwise a failure (see ErrorReporter.sol for details)\"},\"redeemUnderlying(uint256)\":{\"details\":\"Accrues interest whether or not the operation succeeds, unless reverted\",\"params\":{\"redeemAmount\":\"The amount of underlying to redeem\"},\"return\":\"uint 0=success, otherwise a failure (see ErrorReporter.sol for details)\"},\"repayBorrow(uint256)\":{\"params\":{\"repayAmount\":\"The amount to repay\"},\"return\":\"uint 0=success, otherwise a failure (see ErrorReporter.sol for details)\"},\"repayBorrowBehalf(address,uint256)\":{\"params\":{\"borrower\":\"the account with the debt being payed off\",\"repayAmount\":\"The amount to repay\"},\"return\":\"uint 0=success, otherwise a failure (see ErrorReporter.sol for details)\"},\"seize(address,address,uint256)\":{\"details\":\"Will fail unless called by another cToken during the process of liquidation. Its absolutely critical to use msg.sender as the borrowed cToken and not a parameter.\",\"params\":{\"borrower\":\"The account having collateral seized\",\"liquidator\":\"The account receiving seized collateral\",\"seizeTokens\":\"The number of cTokens to seize\"},\"return\":\"uint 0=success, otherwise a failure (see ErrorReporter.sol for details)\"},\"supplyRatePerBlock()\":{\"return\":\"The supply interest rate per block, scaled by 1e18\"},\"sweepToken(address)\":{\"params\":{\"token\":\"The address of the ERC-20 token to sweep\"}},\"totalBorrowsCurrent()\":{\"return\":\"The total borrows with interest\"},\"transfer(address,uint256)\":{\"params\":{\"amount\":\"The number of tokens to transfer\",\"dst\":\"The address of the destination account\"},\"return\":\"Whether or not the transfer succeeded\"},\"transferFrom(address,address,uint256)\":{\"params\":{\"amount\":\"The number of tokens to transfer\",\"dst\":\"The address of the destination account\",\"src\":\"The address of the source account\"},\"return\":\"Whether or not the transfer succeeded\"}},\"title\":\"tropykus CErc20Immutable Contract\"},\"userdoc\":{\"methods\":{\"_acceptAdmin()\":{\"notice\":\"Accepts transfer of admin rights. msg.sender must be pendingAdmin\"},\"_addReserves(uint256)\":{\"notice\":\"The sender adds to reserves.\"},\"_reduceReserves(uint256)\":{\"notice\":\"Accrues interest and reduces reserves by transferring to admin\"},\"_setComptroller(address)\":{\"notice\":\"Sets a new comptroller for the market\"},\"_setInterestRateModel(address)\":{\"notice\":\"accrues interest and updates the interest rate model using _setInterestRateModelFresh\"},\"_setPendingAdmin(address)\":{\"notice\":\"Begins transfer of admin rights. The newPendingAdmin must call `_acceptAdmin` to finalize the transfer.\"},\"_setReserveFactor(uint256)\":{\"notice\":\"accrues interest and sets a new reserve factor for the protocol using _setReserveFactorFresh\"},\"accrueInterest()\":{\"notice\":\"Applies accrued interest to total borrows and reserves\"},\"allowance(address,address)\":{\"notice\":\"Get the current allowance from `owner` for `spender`\"},\"approve(address,uint256)\":{\"notice\":\"Approve `spender` to transfer up to `amount` from `src`\"},\"balanceOf(address)\":{\"notice\":\"Get the token balance of the `owner`\"},\"balanceOfUnderlying(address)\":{\"notice\":\"Get the underlying balance of the `owner`\"},\"borrow(uint256)\":{\"notice\":\"Sender borrows assets from the protocol to their own address\"},\"borrowBalanceCurrent(address)\":{\"notice\":\"Accrue interest to updated borrowIndex and then calculate account's borrow balance using the updated borrowIndex\"},\"borrowBalanceStored(address)\":{\"notice\":\"Return the borrow balance of account based on stored data\"},\"borrowRatePerBlock()\":{\"notice\":\"Returns the current per-block borrow interest rate for this cToken\"},\"constructor\":\"Construct a new money market\",\"exchangeRateCurrent()\":{\"notice\":\"Accrue interest then return the up-to-date exchange rate\"},\"exchangeRateStored()\":{\"notice\":\"Calculates the exchange rate from the underlying to the CToken\"},\"getAccountSnapshot(address)\":{\"notice\":\"Get a snapshot of the account's balances, and the cached exchange rate\"},\"getCash()\":{\"notice\":\"Get cash balance of this cToken in the underlying asset\"},\"initialize(address,address,address,uint256,string,string,uint8)\":{\"notice\":\"Initialize the new money market\"},\"initialize(address,address,uint256,string,string,uint8)\":{\"notice\":\"Initialize the money market\"},\"liquidateBorrow(address,uint256,address)\":{\"notice\":\"The sender liquidates the borrowers collateral. The collateral seized is transferred to the liquidator.\"},\"mint(uint256)\":{\"notice\":\"Sender supplies assets into the market and receives cTokens in exchange\"},\"redeem(uint256)\":{\"notice\":\"Sender redeems cTokens in exchange for the underlying asset\"},\"redeemUnderlying(uint256)\":{\"notice\":\"Sender redeems cTokens in exchange for a specified amount of underlying asset\"},\"repayBorrow(uint256)\":{\"notice\":\"Sender repays their own borrow\"},\"repayBorrowBehalf(address,uint256)\":{\"notice\":\"Sender repays a borrow belonging to borrower\"},\"seize(address,address,uint256)\":{\"notice\":\"Transfers collateral tokens (this market) to the liquidator.\"},\"supplyRatePerBlock()\":{\"notice\":\"Returns the current per-block supply interest rate for this cToken\"},\"sweepToken(address)\":{\"notice\":\"A public function to sweep accidental ERC-20 transfers to this contract. Tokens are sent to admin (timelock)\"},\"totalBorrowsCurrent()\":{\"notice\":\"Returns the current total borrows plus accrued interest\"},\"transfer(address,uint256)\":{\"notice\":\"Transfer `amount` tokens from `msg.sender` to `dst`\"},\"transferFrom(address,address,uint256)\":{\"notice\":\"Transfer `amount` tokens from `src` to `dst`\"}},\"notice\":\"CTokens which wrap an EIP-20 underlying and are immutable\"}},\"settings\":{\"compilationTarget\":{\"contracts/CErc20Immutable.sol\":\"CErc20Immutable\"},\"evmVersion\":\"istanbul\",\"libraries\":{},\"metadata\":{\"useLiteralContent\":true},\"optimizer\":{\"enabled\":true,\"runs\":200},\"remappings\":[]},\"sources\":{\"contracts/CErc20.sol\":{\"content\":\"pragma solidity ^0.5.16;\\n\\nimport \\\"./CToken.sol\\\";\\nimport \\\"./CTokenInterfaces.sol\\\";\\n\\n/**\\n * @title tropykus CErc20 Contract\\n * @notice CTokens which wrap an EIP-20 underlying\\n * @author tropykus\\n */\\ncontract CErc20 is CToken, CErc20Interface {\\n    /**\\n     * @notice Initialize the new money market\\n     * @param underlying_ The address of the underlying asset\\n     * @param comptroller_ The address of the Comptroller\\n     * @param interestRateModel_ The address of the interest rate model\\n     * @param initialExchangeRateMantissa_ The initial exchange rate, scaled by 1e18\\n     * @param name_ ERC-20 name of this token\\n     * @param symbol_ ERC-20 symbol of this token\\n     * @param decimals_ ERC-20 decimal precision of this token\\n     */\\n    function initialize(address underlying_,\\n                        ComptrollerInterface comptroller_,\\n                        InterestRateModel interestRateModel_,\\n                        uint initialExchangeRateMantissa_,\\n                        string memory name_,\\n                        string memory symbol_,\\n                        uint8 decimals_) public {\\n        // CToken initialize does the bulk of the work\\n        super.initialize(comptroller_, interestRateModel_, initialExchangeRateMantissa_, name_, symbol_, decimals_);\\n\\n        // Set underlying and sanity check it\\n        underlying = underlying_;\\n        EIP20Interface(underlying).totalSupply();\\n    }\\n\\n    /*** User Interface ***/\\n\\n    /**\\n     * @notice Sender supplies assets into the market and receives cTokens in exchange\\n     * @dev Accrues interest whether or not the operation succeeds, unless reverted\\n     * @param mintAmount The amount of the underlying asset to supply\\n     * @return uint 0=success, otherwise a failure (see ErrorReporter.sol for details)\\n     */\\n    function mint(uint mintAmount) external returns (uint) {\\n        (uint err,) = mintInternal(mintAmount);\\n        return err;\\n    }\\n\\n    /**\\n     * @notice Sender redeems cTokens in exchange for the underlying asset\\n     * @dev Accrues interest whether or not the operation succeeds, unless reverted\\n     * @param redeemTokens The number of cTokens to redeem into underlying\\n     * @return uint 0=success, otherwise a failure (see ErrorReporter.sol for details)\\n     */\\n    function redeem(uint redeemTokens) external returns (uint) {\\n        return redeemInternal(redeemTokens);\\n    }\\n\\n    /**\\n     * @notice Sender redeems cTokens in exchange for a specified amount of underlying asset\\n     * @dev Accrues interest whether or not the operation succeeds, unless reverted\\n     * @param redeemAmount The amount of underlying to redeem\\n     * @return uint 0=success, otherwise a failure (see ErrorReporter.sol for details)\\n     */\\n    function redeemUnderlying(uint redeemAmount) external returns (uint) {\\n        return redeemUnderlyingInternal(redeemAmount);\\n    }\\n\\n    /**\\n      * @notice Sender borrows assets from the protocol to their own address\\n      * @param borrowAmount The amount of the underlying asset to borrow\\n      * @return uint 0=success, otherwise a failure (see ErrorReporter.sol for details)\\n      */\\n    function borrow(uint borrowAmount) external returns (uint) {\\n        return borrowInternal(borrowAmount);\\n    }\\n\\n    /**\\n     * @notice Sender repays their own borrow\\n     * @param repayAmount The amount to repay\\n     * @return uint 0=success, otherwise a failure (see ErrorReporter.sol for details)\\n     */\\n    function repayBorrow(uint repayAmount) external returns (uint) {\\n        (uint err,) = repayBorrowInternal(repayAmount);\\n        return err;\\n    }\\n\\n    /**\\n     * @notice Sender repays a borrow belonging to borrower\\n     * @param borrower the account with the debt being payed off\\n     * @param repayAmount The amount to repay\\n     * @return uint 0=success, otherwise a failure (see ErrorReporter.sol for details)\\n     */\\n    function repayBorrowBehalf(address borrower, uint repayAmount) external returns (uint) {\\n        (uint err,) = repayBorrowBehalfInternal(borrower, repayAmount);\\n        return err;\\n    }\\n\\n    /**\\n     * @notice The sender liquidates the borrowers collateral.\\n     *  The collateral seized is transferred to the liquidator.\\n     * @param borrower The borrower of this cToken to be liquidated\\n     * @param repayAmount The amount of the underlying borrowed asset to repay\\n     * @param cTokenCollateral The market in which to seize collateral from the borrower\\n     * @return uint 0=success, otherwise a failure (see ErrorReporter.sol for details)\\n     */\\n    function liquidateBorrow(address borrower, uint repayAmount, CTokenInterface cTokenCollateral) external returns (uint) {\\n        (uint err,) = liquidateBorrowInternal(borrower, repayAmount, cTokenCollateral);\\n        return err;\\n    }\\n\\n    /**\\n     * @notice A public function to sweep accidental ERC-20 transfers to this contract. Tokens are sent to admin (timelock)\\n     * @param token The address of the ERC-20 token to sweep\\n     */\\n    function sweepToken(EIP20NonStandardInterface token) external {\\n    \\trequire(address(token) != underlying, \\\"CErc20::sweepToken: can not sweep underlying token\\\");\\n    \\tuint256 balance = token.balanceOf(address(this));\\n    \\ttoken.transfer(admin, balance);\\n    }\\n\\n    /**\\n     * @notice The sender adds to reserves.\\n     * @param addAmount The amount fo underlying token to add as reserves\\n     * @return uint 0=success, otherwise a failure (see ErrorReporter.sol for details)\\n     */\\n    function _addReserves(uint addAmount) external returns (uint) {\\n        return _addReservesInternal(addAmount);\\n    }\\n\\n    /*** Safe Token ***/\\n\\n    /**\\n     * @notice Gets balance of this contract in terms of the underlying\\n     * @dev This excludes the value of the current message, if any\\n     * @return The quantity of underlying tokens owned by this contract\\n     */\\n    function getCashPrior() internal view returns (uint) {\\n        EIP20Interface token = EIP20Interface(underlying);\\n        return token.balanceOf(address(this));\\n    }\\n\\n    /**\\n     * @dev Similar to EIP20 transfer, except it handles a False result from `transferFrom` and reverts in that case.\\n     *      This will revert due to insufficient balance or insufficient allowance.\\n     *      This function returns the actual amount received,\\n     *      which may be less than `amount` if there is a fee attached to the transfer.\\n     *\\n     *      Note: This wrapper safely handles non-standard ERC-20 tokens that do not return a value.\\n     *            See here: https://medium.com/coinmonks/missing-return-value-bug-at-least-130-tokens-affected-d67bf08521ca\\n     */\\n    function doTransferIn(address from, uint amount) internal returns (uint) {\\n        EIP20NonStandardInterface token = EIP20NonStandardInterface(underlying);\\n        uint balanceBefore = EIP20Interface(underlying).balanceOf(address(this));\\n        token.transferFrom(from, address(this), amount);\\n\\n        bool success;\\n        assembly {\\n            switch returndatasize()\\n                case 0 {                       // This is a non-standard ERC-20\\n                    success := not(0)          // set success to true\\n                }\\n                case 32 {                      // This is a compliant ERC-20\\n                    returndatacopy(0, 0, 32)\\n                    success := mload(0)        // Set `success = returndata` of external call\\n                }\\n                default {                      // This is an excessively non-compliant ERC-20, revert.\\n                    revert(0, 0)\\n                }\\n        }\\n        require(success, \\\"TOKEN_TRANSFER_IN_FAILED\\\");\\n\\n        // Calculate the amount that was *actually* transferred\\n        uint balanceAfter = EIP20Interface(underlying).balanceOf(address(this));\\n        require(balanceAfter >= balanceBefore, \\\"TOKEN_TRANSFER_IN_OVERFLOW\\\");\\n        return balanceAfter - balanceBefore;   // underflow already checked above, just subtract\\n    }\\n\\n    /**\\n     * @dev Similar to EIP20 transfer, except it handles a False success from `transfer` and returns an explanatory\\n     *      error code rather than reverting. If caller has not called checked protocol's balance, this may revert due to\\n     *      insufficient cash held in this contract. If caller has checked protocol's balance prior to this call, and verified\\n     *      it is >= amount, this should not revert in normal conditions.\\n     *\\n     *      Note: This wrapper safely handles non-standard ERC-20 tokens that do not return a value.\\n     *            See here: https://medium.com/coinmonks/missing-return-value-bug-at-least-130-tokens-affected-d67bf08521ca\\n     */\\n    function doTransferOut(address payable to, uint amount) internal {\\n        EIP20NonStandardInterface token = EIP20NonStandardInterface(underlying);\\n        token.transfer(to, amount);\\n\\n        bool success;\\n        assembly {\\n            switch returndatasize()\\n                case 0 {                      // This is a non-standard ERC-20\\n                    success := not(0)          // set success to true\\n                }\\n                case 32 {                     // This is a complaint ERC-20\\n                    returndatacopy(0, 0, 32)\\n                    success := mload(0)        // Set `success = returndata` of external call\\n                }\\n                default {                     // This is an excessively non-compliant ERC-20, revert.\\n                    revert(0, 0)\\n                }\\n        }\\n        require(success, \\\"TOKEN_TRANSFER_OUT_FAILED\\\");\\n    }\\n}\\n\",\"keccak256\":\"0xd2daf4400e72469c8f779fbbc21d343b03c539f02d20690176c9e7113b6e3ed7\"},\"contracts/CErc20Immutable.sol\":{\"content\":\"pragma solidity ^0.5.16;\\n\\nimport \\\"./CErc20.sol\\\";\\n\\n/**\\n * @title tropykus CErc20Immutable Contract\\n * @notice CTokens which wrap an EIP-20 underlying and are immutable\\n * @author tropykus\\n */\\ncontract CErc20Immutable is CErc20 {\\n    /**\\n     * @notice Construct a new money market\\n     * @param underlying_ The address of the underlying asset\\n     * @param comptroller_ The address of the Comptroller\\n     * @param interestRateModel_ The address of the interest rate model\\n     * @param initialExchangeRateMantissa_ The initial exchange rate, scaled by 1e18\\n     * @param name_ ERC-20 name of this token\\n     * @param symbol_ ERC-20 symbol of this token\\n     * @param decimals_ ERC-20 decimal precision of this token\\n     * @param admin_ Address of the administrator of this token\\n     */\\n    constructor(address underlying_,\\n                ComptrollerInterface comptroller_,\\n                InterestRateModel interestRateModel_,\\n                uint initialExchangeRateMantissa_,\\n                string memory name_,\\n                string memory symbol_,\\n                uint8 decimals_,\\n                address payable admin_) public {\\n        // Creator of the contract is admin during initialization\\n        admin = msg.sender;\\n\\n        // Initialize the market\\n        initialize(underlying_, comptroller_, interestRateModel_, initialExchangeRateMantissa_, name_, symbol_, decimals_);\\n\\n        // Set the proper admin now that initialization is done\\n        admin = admin_;\\n    }\\n}\\n\",\"keccak256\":\"0x35ea96773cdc5aec05132733f0c2f3669f2eabdedd78825ccb8dc43541ed6183\"},\"contracts/CToken.sol\":{\"content\":\"pragma solidity ^0.5.16;\\n\\nimport \\\"./ComptrollerInterface.sol\\\";\\nimport \\\"./CTokenInterfaces.sol\\\";\\nimport \\\"./ErrorReporter.sol\\\";\\nimport \\\"./Exponential.sol\\\";\\nimport \\\"./EIP20Interface.sol\\\";\\nimport \\\"./InterestRateModel.sol\\\";\\n\\n/**\\n * @title tropykus CToken Contract\\n * @notice Abstract base for CTokens\\n * @author tropykus\\n */\\ncontract CToken is CTokenInterface, Exponential, TokenErrorReporter {\\n    /**\\n     * @notice Initialize the money market\\n     * @param comptroller_ The address of the Comptroller\\n     * @param interestRateModel_ The address of the interest rate model\\n     * @param initialExchangeRateMantissa_ The initial exchange rate, scaled by 1e18\\n     * @param name_ EIP-20 name of this token\\n     * @param symbol_ EIP-20 symbol of this token\\n     * @param decimals_ EIP-20 decimal precision of this token\\n     */\\n    function initialize(\\n        ComptrollerInterface comptroller_,\\n        InterestRateModel interestRateModel_,\\n        uint256 initialExchangeRateMantissa_,\\n        string memory name_,\\n        string memory symbol_,\\n        uint8 decimals_\\n    ) public {\\n        require(msg.sender == admin, \\\"only admin may initialize the market\\\");\\n        require(\\n            accrualBlockNumber == 0 && borrowIndex == 0,\\n            \\\"market may only be initialized once\\\"\\n        );\\n\\n        // Set initial exchange rate\\n        initialExchangeRateMantissa = initialExchangeRateMantissa_;\\n        require(\\n            initialExchangeRateMantissa > 0,\\n            \\\"initial exchange rate must be greater than zero.\\\"\\n        );\\n\\n        // Set the comptroller\\n        uint256 err = _setComptroller(comptroller_);\\n        require(err == uint256(Error.NO_ERROR), \\\"setting comptroller failed\\\");\\n\\n        // Initialize block number and borrow index (block number mocks depend on comptroller being set)\\n        accrualBlockNumber = getBlockNumber();\\n        borrowIndex = mantissaOne;\\n\\n        // Set the interest rate model (depends on block number / borrow index)\\n        err = _setInterestRateModelFresh(interestRateModel_);\\n        require(\\n            err == uint256(Error.NO_ERROR),\\n            \\\"setting interest rate model failed\\\"\\n        );\\n\\n        name = name_;\\n        symbol = symbol_;\\n        decimals = decimals_;\\n\\n        // The counter starts true to prevent changing it from zero to non-zero (i.e. smaller cost/refund)\\n        _notEntered = true;\\n    }\\n\\n    /**\\n     * @notice Transfer `tokens` tokens from `src` to `dst` by `spender`\\n     * @dev Called by both `transfer` and `transferFrom` internally\\n     * @param spender The address of the account performing the transfer\\n     * @param src The address of the source account\\n     * @param dst The address of the destination account\\n     * @param tokens The number of tokens to transfer\\n     * @return Whether or not the transfer succeeded\\n     */\\n    function transferTokens(\\n        address spender,\\n        address src,\\n        address dst,\\n        uint256 tokens\\n    ) internal returns (uint256) {\\n        /* Fail if transfer not allowed */\\n        uint256 allowed =\\n            comptroller.transferAllowed(address(this), src, dst, tokens);\\n        if (allowed != 0) {\\n            return\\n                failOpaque(\\n                    Error.COMPTROLLER_REJECTION,\\n                    FailureInfo.TRANSFER_COMPTROLLER_REJECTION,\\n                    allowed\\n                );\\n        }\\n\\n        /* Do not allow self-transfers */\\n        if (src == dst) {\\n            return fail(Error.BAD_INPUT, FailureInfo.TRANSFER_NOT_ALLOWED);\\n        }\\n\\n        /* Get the allowance, infinite for the account owner */\\n        uint256 startingAllowance = 0;\\n        if (spender == src) {\\n            startingAllowance = uint256(-1);\\n        } else {\\n            startingAllowance = transferAllowances[src][spender];\\n        }\\n\\n        /* Do the calculations, checking for {under,over}flow */\\n        MathError mathErr;\\n        uint256 allowanceNew;\\n        uint256 srcTokensNew;\\n        uint256 dstTokensNew;\\n\\n        (mathErr, allowanceNew) = subUInt(startingAllowance, tokens);\\n        if (mathErr != MathError.NO_ERROR) {\\n            return fail(Error.MATH_ERROR, FailureInfo.TRANSFER_NOT_ALLOWED);\\n        }\\n\\n        (mathErr, srcTokensNew) = subUInt(accountTokens[src].tokens, tokens);\\n        if (mathErr != MathError.NO_ERROR) {\\n            return fail(Error.MATH_ERROR, FailureInfo.TRANSFER_NOT_ENOUGH);\\n        }\\n\\n        (mathErr, dstTokensNew) = addUInt(accountTokens[dst].tokens, tokens);\\n        if (mathErr != MathError.NO_ERROR) {\\n            return fail(Error.MATH_ERROR, FailureInfo.TRANSFER_TOO_MUCH);\\n        }\\n\\n        /////////////////////////\\n        // EFFECTS & INTERACTIONS\\n        // (No safe failures beyond this point)\\n\\n        accountTokens[src].tokens = srcTokensNew;\\n        accountTokens[dst].tokens = dstTokensNew;\\n\\n        /* Eat some of the allowance (if necessary) */\\n        if (startingAllowance != uint256(-1)) {\\n            transferAllowances[src][spender] = allowanceNew;\\n        }\\n\\n        /* We emit a Transfer event */\\n        emit Transfer(src, dst, tokens);\\n\\n        // unused function\\n        // comptroller.transferVerify(address(this), src, dst, tokens);\\n\\n        return uint256(Error.NO_ERROR);\\n    }\\n\\n    /**\\n     * @notice Transfer `amount` tokens from `msg.sender` to `dst`\\n     * @param dst The address of the destination account\\n     * @param amount The number of tokens to transfer\\n     * @return Whether or not the transfer succeeded\\n     */\\n    function transfer(address dst, uint256 amount)\\n        external\\n        nonReentrant\\n        returns (bool)\\n    {\\n        return\\n            transferTokens(msg.sender, msg.sender, dst, amount) ==\\n            uint256(Error.NO_ERROR);\\n    }\\n\\n    /**\\n     * @notice Transfer `amount` tokens from `src` to `dst`\\n     * @param src The address of the source account\\n     * @param dst The address of the destination account\\n     * @param amount The number of tokens to transfer\\n     * @return Whether or not the transfer succeeded\\n     */\\n    function transferFrom(\\n        address src,\\n        address dst,\\n        uint256 amount\\n    ) external nonReentrant returns (bool) {\\n        return\\n            transferTokens(msg.sender, src, dst, amount) ==\\n            uint256(Error.NO_ERROR);\\n    }\\n\\n    /**\\n     * @notice Approve `spender` to transfer up to `amount` from `src`\\n     * @dev This will overwrite the approval amount for `spender`\\n     *  and is subject to issues noted [here](https://eips.ethereum.org/EIPS/eip-20#approve)\\n     * @param spender The address of the account which may transfer tokens\\n     * @param amount The number of tokens that are approved (-1 means infinite)\\n     * @return Whether or not the approval succeeded\\n     */\\n    function approve(address spender, uint256 amount) external returns (bool) {\\n        address src = msg.sender;\\n        transferAllowances[src][spender] = amount;\\n        emit Approval(src, spender, amount);\\n        return true;\\n    }\\n\\n    /**\\n     * @notice Get the current allowance from `owner` for `spender`\\n     * @param owner The address of the account which owns the tokens to be spent\\n     * @param spender The address of the account which may transfer tokens\\n     * @return The number of tokens allowed to be spent (-1 means infinite)\\n     */\\n    function allowance(address owner, address spender)\\n        external\\n        view\\n        returns (uint256)\\n    {\\n        return transferAllowances[owner][spender];\\n    }\\n\\n    /**\\n     * @notice Get the token balance of the `owner`\\n     * @param owner The address of the account to query\\n     * @return The number of tokens owned by `owner`\\n     */\\n    function balanceOf(address owner) external view returns (uint256) {\\n        return accountTokens[owner].tokens;\\n    }\\n\\n    /**\\n     * @notice Get the underlying balance of the `owner`\\n     * @dev This also accrues interest in a transaction\\n     * @param owner The address of the account to query\\n     * @return The amount of underlying owned by `owner`\\n     */\\n    function balanceOfUnderlying(address owner) external returns (uint256) {\\n        Exp memory exchangeRate = Exp({mantissa: exchangeRateCurrent()});\\n        (MathError mErr, uint256 balance) =\\n            mulScalarTruncate(exchangeRate, accountTokens[owner].tokens);\\n        require(mErr == MathError.NO_ERROR, \\\"balance could not be calculated\\\");\\n        return balance;\\n    }\\n\\n    /**\\n     * @notice Get a snapshot of the account's balances, and the cached exchange rate\\n     * @dev This is used by comptroller to more efficiently perform liquidity checks.\\n     * @param account Address of the account to snapshot\\n     * @return (possible error, token balance, borrow balance, exchange rate mantissa)\\n     */\\n    function getAccountSnapshot(address account)\\n        external\\n        view\\n        returns (\\n            uint256,\\n            uint256,\\n            uint256,\\n            uint256\\n        )\\n    {\\n        uint256 cTokenBalance = accountTokens[account].tokens;\\n        uint256 borrowBalance;\\n        uint256 exchangeRateMantissa;\\n\\n        MathError mErr;\\n\\n        (mErr, borrowBalance) = borrowBalanceStoredInternal(account);\\n        if (mErr != MathError.NO_ERROR) {\\n            return (uint256(Error.MATH_ERROR), 0, 0, 0);\\n        }\\n\\n        (mErr, exchangeRateMantissa) = exchangeRateStoredInternal();\\n        if (mErr != MathError.NO_ERROR) {\\n            return (uint256(Error.MATH_ERROR), 0, 0, 0);\\n        }\\n\\n        return (\\n            uint256(Error.NO_ERROR),\\n            cTokenBalance,\\n            borrowBalance,\\n            exchangeRateMantissa\\n        );\\n    }\\n\\n    /**\\n     * @dev Function to simply retrieve block number\\n     *  This exists mainly for inheriting test contracts to stub this result.\\n     */\\n    function getBlockNumber() internal view returns (uint256) {\\n        return block.number;\\n    }\\n\\n    /**\\n     * @notice Returns the current per-block borrow interest rate for this cToken\\n     * @return The borrow interest rate per block, scaled by 1e18\\n     */\\n    function borrowRatePerBlock() external view returns (uint256) {\\n        return\\n            interestRateModel.getBorrowRate(\\n                getCashPrior(),\\n                totalBorrows,\\n                totalReserves\\n            );\\n    }\\n\\n    /**\\n     * @notice Returns the current per-block supply interest rate for this cToken\\n     * @return The supply interest rate per block, scaled by 1e18\\n     */\\n    function supplyRatePerBlock() external view returns (uint256) {\\n        return\\n            interestRateModel.getSupplyRate(\\n                getCashPrior(),\\n                totalBorrows,\\n                totalReserves,\\n                reserveFactorMantissa\\n            );\\n    }\\n\\n    /**\\n     * @notice Returns the current total borrows plus accrued interest\\n     * @return The total borrows with interest\\n     */\\n    function totalBorrowsCurrent() external nonReentrant returns (uint256) {\\n        require(\\n            accrueInterest() == uint256(Error.NO_ERROR),\\n            \\\"accrue interest failed\\\"\\n        );\\n        return totalBorrows;\\n    }\\n\\n    /**\\n     * @notice Accrue interest to updated borrowIndex and then calculate account's borrow balance using the updated borrowIndex\\n     * @param account The address whose balance should be calculated after updating borrowIndex\\n     * @return The calculated balance\\n     */\\n    function borrowBalanceCurrent(address account)\\n        external\\n        nonReentrant\\n        returns (uint256)\\n    {\\n        require(\\n            accrueInterest() == uint256(Error.NO_ERROR),\\n            \\\"accrue interest failed\\\"\\n        );\\n        return borrowBalanceStored(account);\\n    }\\n\\n    /**\\n     * @notice Return the borrow balance of account based on stored data\\n     * @param account The address whose balance should be calculated\\n     * @return The calculated balance\\n     */\\n    function borrowBalanceStored(address account)\\n        public\\n        view\\n        returns (uint256)\\n    {\\n        (MathError err, uint256 result) = borrowBalanceStoredInternal(account);\\n        require(\\n            err == MathError.NO_ERROR,\\n            \\\"borrowBalanceStored: borrowBalanceStoredInternal failed\\\"\\n        );\\n        return result;\\n    }\\n\\n    /**\\n     * @notice Return the borrow balance of account based on stored data\\n     * @param account The address whose balance should be calculated\\n     * @return (error code, the calculated balance or 0 if error code is non-zero)\\n     */\\n    function borrowBalanceStoredInternal(address account)\\n        internal\\n        view\\n        returns (MathError, uint256)\\n    {\\n        /* Note: we do not assert that the market is up to date */\\n        MathError mathErr;\\n        uint256 principalTimesIndex;\\n        uint256 result;\\n\\n        /* Get borrowBalance and borrowIndex */\\n        BorrowSnapshot storage borrowSnapshot = accountBorrows[account];\\n\\n        /* If borrowBalance = 0 then borrowIndex is likely also 0.\\n         * Rather than failing the calculation with a division by 0, we immediately return 0 in this case.\\n         */\\n        if (borrowSnapshot.principal == 0) {\\n            return (MathError.NO_ERROR, 0);\\n        }\\n\\n        /* Calculate new borrow balance using the interest index:\\n         *  recentBorrowBalance = borrower.borrowBalance * market.borrowIndex / borrower.borrowIndex\\n         */\\n        (mathErr, principalTimesIndex) = mulUInt(\\n            borrowSnapshot.principal,\\n            borrowIndex\\n        );\\n        if (mathErr != MathError.NO_ERROR) {\\n            return (mathErr, 0);\\n        }\\n\\n        (mathErr, result) = divUInt(\\n            principalTimesIndex,\\n            borrowSnapshot.interestIndex\\n        );\\n        if (mathErr != MathError.NO_ERROR) {\\n            return (mathErr, 0);\\n        }\\n\\n        return (MathError.NO_ERROR, result);\\n    }\\n\\n    /**\\n     * @notice Accrue interest then return the up-to-date exchange rate\\n     * @return Calculated exchange rate scaled by 1e18\\n     */\\n    function exchangeRateCurrent() public nonReentrant returns (uint256) {\\n        require(\\n            accrueInterest() == uint256(Error.NO_ERROR),\\n            \\\"accrue interest failed\\\"\\n        );\\n        return exchangeRateStored();\\n    }\\n\\n    /**\\n     * @notice Calculates the exchange rate from the underlying to the CToken\\n     * @dev This function does not accrue interest before calculating the exchange rate\\n     * @return Calculated exchange rate scaled by 1e18\\n     */\\n    function exchangeRateStored() public view returns (uint256) {\\n        (MathError err, uint256 result) = exchangeRateStoredInternal();\\n        require(\\n            err == MathError.NO_ERROR,\\n            \\\"exchangeRateStored: exchangeRateStoredInternal failed\\\"\\n        );\\n        return result;\\n    }\\n\\n    /**\\n     * @notice Calculates the exchange rate from the underlying to the CToken\\n     * @dev This function does not accrue interest before calculating the exchange rate\\n     * @return (error code, calculated exchange rate scaled by 1e18)\\n     */\\n    function exchangeRateStoredInternal()\\n        internal\\n        view\\n        returns (MathError, uint256)\\n    {\\n        uint256 _totalSupply = totalSupply;\\n        if (_totalSupply == 0) {\\n            /*\\n             * If there are no tokens minted:\\n             *  exchangeRate = initialExchangeRate\\n             */\\n            return (MathError.NO_ERROR, initialExchangeRateMantissa);\\n        } else {\\n            /*\\n             * Otherwise:\\n             *  exchangeRate from the interest rate model;\\n             */\\n            uint256 totalCash = getCashPrior();\\n            return\\n                interestRateModel.getExchangeRate(\\n                    totalCash,\\n                    totalBorrows,\\n                    totalReserves,\\n                    totalSupply\\n                );\\n        }\\n    }\\n\\n    /**\\n     * @notice Get cash balance of this cToken in the underlying asset\\n     * @return The quantity of underlying asset owned by this contract\\n     */\\n    function getCash() external view returns (uint256) {\\n        return getCashPrior();\\n    }\\n\\n    /**\\n     * @notice Applies accrued interest to total borrows and reserves\\n     * @dev This calculates interest accrued from the last checkpointed block\\n     *   up to the current block and writes new checkpoint to storage.\\n     */\\n    function accrueInterest() public returns (uint256) {\\n        /* Remember the initial block number */\\n        uint256 currentBlockNumber = getBlockNumber();\\n        uint256 accrualBlockNumberPrior = accrualBlockNumber;\\n\\n        /* Short-circuit accumulating 0 interest */\\n        if (accrualBlockNumberPrior == currentBlockNumber) {\\n            return uint256(Error.NO_ERROR);\\n        }\\n\\n        /* Read the previous values out of storage */\\n        uint256 cashPrior = getCashPrior();\\n        uint256 borrowsPrior = totalBorrows;\\n        uint256 reservesPrior = totalReserves;\\n        uint256 borrowIndexPrior = borrowIndex;\\n\\n        /* Calculate the current borrow interest rate */\\n        uint256 borrowRateMantissa =\\n            interestRateModel.getBorrowRate(\\n                cashPrior,\\n                borrowsPrior,\\n                reservesPrior\\n            );\\n        require(\\n            borrowRateMantissa <= borrowRateMaxMantissa,\\n            \\\"borrow rate is absurdly high\\\"\\n        );\\n\\n        /* Calculate the number of blocks elapsed since the last accrual */\\n        (MathError mathErr, uint256 blockDelta) =\\n            subUInt(currentBlockNumber, accrualBlockNumberPrior);\\n        require(\\n            mathErr == MathError.NO_ERROR,\\n            \\\"could not calculate block delta\\\"\\n        );\\n\\n        /*\\n         * Calculate the interest accumulated into borrows and reserves and the new index:\\n         *  simpleInterestFactor = borrowRate * blockDelta\\n         *  interestAccumulated = simpleInterestFactor * totalBorrows\\n         *  totalBorrowsNew = interestAccumulated + totalBorrows\\n         *  totalReservesNew = interestAccumulated * reserveFactor + totalReserves\\n         *  borrowIndexNew = simpleInterestFactor * borrowIndex + borrowIndex\\n         */\\n\\n        Exp memory simpleInterestFactor;\\n        uint256 interestAccumulated;\\n        uint256 totalBorrowsNew;\\n        uint256 totalReservesNew;\\n        uint256 borrowIndexNew;\\n\\n        (mathErr, simpleInterestFactor) = mulScalar(\\n            Exp({mantissa: borrowRateMantissa}),\\n            blockDelta\\n        );\\n        if (mathErr != MathError.NO_ERROR) {\\n            return\\n                failOpaque(\\n                    Error.MATH_ERROR,\\n                    FailureInfo\\n                        .ACCRUE_INTEREST_SIMPLE_INTEREST_FACTOR_CALCULATION_FAILED,\\n                    uint256(mathErr)\\n                );\\n        }\\n\\n        (mathErr, interestAccumulated) = mulScalarTruncate(\\n            simpleInterestFactor,\\n            borrowsPrior\\n        );\\n        if (mathErr != MathError.NO_ERROR) {\\n            return\\n                failOpaque(\\n                    Error.MATH_ERROR,\\n                    FailureInfo\\n                        .ACCRUE_INTEREST_ACCUMULATED_INTEREST_CALCULATION_FAILED,\\n                    uint256(mathErr)\\n                );\\n        }\\n\\n        (mathErr, totalBorrowsNew) = addUInt(interestAccumulated, borrowsPrior);\\n        if (mathErr != MathError.NO_ERROR) {\\n            return\\n                failOpaque(\\n                    Error.MATH_ERROR,\\n                    FailureInfo\\n                        .ACCRUE_INTEREST_NEW_TOTAL_BORROWS_CALCULATION_FAILED,\\n                    uint256(mathErr)\\n                );\\n        }\\n\\n        (mathErr, totalReservesNew) = mulScalarTruncateAddUInt(\\n            Exp({mantissa: reserveFactorMantissa}),\\n            interestAccumulated,\\n            reservesPrior\\n        );\\n        if (mathErr != MathError.NO_ERROR) {\\n            return\\n                failOpaque(\\n                    Error.MATH_ERROR,\\n                    FailureInfo\\n                        .ACCRUE_INTEREST_NEW_TOTAL_RESERVES_CALCULATION_FAILED,\\n                    uint256(mathErr)\\n                );\\n        }\\n\\n        if (interestRateModel.isTropykusInterestRateModel()) {\\n            (mathErr, totalReservesNew) = newReserves(\\n                borrowRateMantissa,\\n                cashPrior,\\n                borrowsPrior,\\n                reservesPrior,\\n                interestAccumulated\\n            );\\n            if (mathErr != MathError.NO_ERROR) {\\n                return\\n                    failOpaque(\\n                        Error.MATH_ERROR,\\n                        FailureInfo\\n                            .ACCRUE_INTEREST_NEW_TOTAL_RESERVES_CALCULATION_FAILED,\\n                        uint256(mathErr)\\n                    );\\n            }\\n        }\\n\\n        (mathErr, borrowIndexNew) = mulScalarTruncateAddUInt(\\n            simpleInterestFactor,\\n            borrowIndexPrior,\\n            borrowIndexPrior\\n        );\\n        if (mathErr != MathError.NO_ERROR) {\\n            return\\n                failOpaque(\\n                    Error.MATH_ERROR,\\n                    FailureInfo\\n                        .ACCRUE_INTEREST_NEW_BORROW_INDEX_CALCULATION_FAILED,\\n                    uint256(mathErr)\\n                );\\n        }\\n\\n        /////////////////////////\\n        // EFFECTS & INTERACTIONS\\n        // (No safe failures beyond this point)\\n\\n        /* We write the previously calculated values into storage */\\n        accrualBlockNumber = currentBlockNumber;\\n        borrowIndex = borrowIndexNew;\\n        totalBorrows = totalBorrowsNew;\\n        totalReserves = totalReservesNew;\\n\\n        /* We emit an AccrueInterest event */\\n        emit AccrueInterest(\\n            cashPrior,\\n            interestAccumulated,\\n            borrowIndexNew,\\n            totalBorrowsNew\\n        );\\n\\n        return uint256(Error.NO_ERROR);\\n    }\\n\\n    function newReserves(\\n        uint256 borrowRateMantissa,\\n        uint256 cashPrior,\\n        uint256 borrowsPrior,\\n        uint256 reservesPrior,\\n        uint256 interestAccumulated\\n    ) internal view returns (MathError mathErr, uint256 totalReservesNew) {\\n        uint256 newReserveFactorMantissa;\\n        uint256 utilizationRate =\\n            interestRateModel.utilizationRate(\\n                cashPrior,\\n                borrowsPrior,\\n                reservesPrior\\n            );\\n        uint256 expectedSupplyRate =\\n            interestRateModel.getSupplyRate(\\n                cashPrior,\\n                borrowsPrior,\\n                reservesPrior,\\n                reserveFactorMantissa\\n            );\\n        if (\\n            interestRateModel.isAboveOptimal(\\n                cashPrior,\\n                borrowsPrior,\\n                reservesPrior\\n            )\\n        ) {\\n            (mathErr, newReserveFactorMantissa) = mulScalarTruncate(\\n                Exp({mantissa: utilizationRate}),\\n                borrowRateMantissa\\n            );\\n            if (mathErr != MathError.NO_ERROR) {\\n                return (mathErr, 0);\\n            }\\n            (mathErr, newReserveFactorMantissa) = subUInt(\\n                newReserveFactorMantissa,\\n                expectedSupplyRate\\n            );\\n            if (mathErr != MathError.NO_ERROR) {\\n                return (mathErr, 0);\\n            }\\n            (mathErr, totalReservesNew) = mulScalarTruncateAddUInt(\\n                Exp({mantissa: newReserveFactorMantissa}),\\n                interestAccumulated,\\n                reservesPrior\\n            );\\n            if (mathErr != MathError.NO_ERROR) {\\n                return (mathErr, 0);\\n            }\\n        } else {\\n            mathErr = MathError.NO_ERROR;\\n            totalReservesNew = reservesPrior;\\n        }\\n    }\\n\\n    /**\\n     * @notice Sender supplies assets into the market and receives cTokens in exchange\\n     * @dev Accrues interest whether or not the operation succeeds, unless reverted\\n     * @param mintAmount The amount of the underlying asset to supply\\n     * @return (uint, uint) An error code (0=success, otherwise a failure, see ErrorReporter.sol), and the actual mint amount.\\n     */\\n    function mintInternal(uint256 mintAmount)\\n        internal\\n        nonReentrant\\n        returns (uint256, uint256)\\n    {\\n        uint256 error = accrueInterest();\\n        if (error != uint256(Error.NO_ERROR)) {\\n            // accrueInterest emits logs on errors, but we still want to log the fact that an attempted borrow failed\\n            return (\\n                fail(Error(error), FailureInfo.MINT_ACCRUE_INTEREST_FAILED),\\n                0\\n            );\\n        }\\n        // mintFresh emits the actual Mint event if successful and logs on errors, so we don't need to\\n        return mintFresh(msg.sender, mintAmount);\\n    }\\n\\n    struct MintLocalVars {\\n        Error err;\\n        MathError mathErr;\\n        uint256 exchangeRateMantissa;\\n        uint256 mintTokens;\\n        uint256 totalSupplyNew;\\n        uint256 accountTokensNew;\\n        uint256 actualMintAmount;\\n    }\\n\\n    /**\\n     * @notice User supplies assets into the market and receives cTokens in exchange\\n     * @dev Assumes interest has already been accrued up to the current block\\n     * @param minter The address of the account which is supplying the assets\\n     * @param mintAmount The amount of the underlying asset to supply\\n     * @return (uint, uint) An error code (0=success, otherwise a failure, see ErrorReporter.sol), and the actual mint amount.\\n     */\\n    function mintFresh(address minter, uint256 mintAmount)\\n        internal\\n        returns (uint256, uint256)\\n    {\\n        /* Fail if mint not allowed */\\n        uint256 allowed =\\n            comptroller.mintAllowed(address(this), minter, mintAmount);\\n        if (allowed != 0) {\\n            return (\\n                failOpaque(\\n                    Error.COMPTROLLER_REJECTION,\\n                    FailureInfo.MINT_COMPTROLLER_REJECTION,\\n                    allowed\\n                ),\\n                0\\n            );\\n        }\\n\\n        /* Verify market's block number equals current block number */\\n        if (accrualBlockNumber != getBlockNumber()) {\\n            return (\\n                fail(Error.MARKET_NOT_FRESH, FailureInfo.MINT_FRESHNESS_CHECK),\\n                0\\n            );\\n        }\\n\\n        MintLocalVars memory vars;\\n\\n        (\\n            vars.mathErr,\\n            vars.exchangeRateMantissa\\n        ) = exchangeRateStoredInternal();\\n        if (vars.mathErr != MathError.NO_ERROR) {\\n            return (\\n                failOpaque(\\n                    Error.MATH_ERROR,\\n                    FailureInfo.MINT_EXCHANGE_RATE_READ_FAILED,\\n                    uint256(vars.mathErr)\\n                ),\\n                0\\n            );\\n        }\\n\\n        /////////////////////////\\n        // EFFECTS & INTERACTIONS\\n        // (No safe failures beyond this point)\\n\\n        /*\\n         *  We call `doTransferIn` for the minter and the mintAmount.\\n         *  Note: The cToken must handle variations between ERC-20 and ETH underlying.\\n         *  `doTransferIn` reverts if anything goes wrong, since we can't be sure if\\n         *  side-effects occurred. The function returns the amount actually transferred,\\n         *  in case of a fee. On success, the cToken holds an additional `actualMintAmount`\\n         *  of cash.\\n         */\\n        vars.actualMintAmount = doTransferIn(minter, mintAmount);\\n\\n        /*\\n         * We get the current exchange rate and calculate the number of cTokens to be minted:\\n         *  mintTokens = actualMintAmount / exchangeRate\\n         */\\n\\n        (vars.mathErr, vars.mintTokens) = divScalarByExpTruncate(\\n            vars.actualMintAmount,\\n            Exp({mantissa: vars.exchangeRateMantissa})\\n        );\\n        require(\\n            vars.mathErr == MathError.NO_ERROR,\\n            \\\"MINT_EXCHANGE_CALCULATION_FAILED\\\"\\n        );\\n\\n        /*\\n         * We calculate the new total supply of cTokens and minter token balance, checking for overflow:\\n         *  totalSupplyNew = totalSupply + mintTokens\\n         *  accountTokensNew = accountTokens[minter] + mintTokens\\n         */\\n        (vars.mathErr, vars.totalSupplyNew) = addUInt(\\n            totalSupply,\\n            vars.mintTokens\\n        );\\n        require(\\n            vars.mathErr == MathError.NO_ERROR,\\n            \\\"MINT_NEW_TOTAL_SUPPLY_CALCULATION_FAILED\\\"\\n        );\\n\\n        (vars.mathErr, vars.accountTokensNew) = addUInt(\\n            accountTokens[minter].tokens,\\n            vars.mintTokens\\n        );\\n        require(\\n            vars.mathErr == MathError.NO_ERROR,\\n            \\\"MINT_NEW_ACCOUNT_BALANCE_CALCULATION_FAILED\\\"\\n        );\\n\\n        uint256 currentSupplyRate =\\n            interestRateModel.getSupplyRate(\\n                getCashPrior(),\\n                totalBorrows,\\n                totalReserves,\\n                reserveFactorMantissa\\n            );\\n\\n        bool isTropykusInterestRateModel =\\n            interestRateModel.isTropykusInterestRateModel();\\n\\n        if (accountTokens[minter].tokens > 0) {\\n            Exp memory updatedUnderlying;\\n            if (isTropykusInterestRateModel) {\\n                Exp memory promisedSupplyRatePerBlock =\\n                    Exp({mantissa: accountTokens[minter].promisedSupplyRate});\\n                (, uint256 delta) =\\n                    subUInt(\\n                        accrualBlockNumber,\\n                        accountTokens[minter].suppliedAt\\n                    );\\n                (, Exp memory promisedSupplyRatePerBlockWithDelta) =\\n                    mulScalar(promisedSupplyRatePerBlock, delta);\\n                (, Exp memory interestFactor) =\\n                    addExp(\\n                        Exp({mantissa: 1e18}),\\n                        promisedSupplyRatePerBlockWithDelta\\n                    );\\n                uint256 currentUnderlyingAmount =\\n                    accountTokens[minter].underlyingAmount;\\n                MathError mErrorNewAmount;\\n                (mErrorNewAmount, updatedUnderlying) = mulExp(\\n                    Exp({mantissa: currentUnderlyingAmount}),\\n                    interestFactor\\n                );\\n                if (mErrorNewAmount != MathError.NO_ERROR) {\\n                    return (\\n                        failOpaque(\\n                            Error.MATH_ERROR,\\n                            FailureInfo.MINT_EXCHANGE_CALCULATION_FAILED,\\n                            uint256(mErrorNewAmount)\\n                        ),\\n                        0\\n                    );\\n                }\\n            } else {\\n                uint256 currentTokens = accountTokens[minter].tokens;\\n                MathError mErrorUpdatedUnderlying;\\n                (mErrorUpdatedUnderlying, updatedUnderlying) = mulExp(\\n                    Exp({mantissa: currentTokens}),\\n                    Exp({mantissa: vars.exchangeRateMantissa})\\n                );\\n                if (mErrorUpdatedUnderlying != MathError.NO_ERROR) {\\n                    return (\\n                        failOpaque(\\n                            Error.MATH_ERROR,\\n                            FailureInfo.MINT_EXCHANGE_CALCULATION_FAILED,\\n                            uint256(mErrorUpdatedUnderlying)\\n                        ),\\n                        0\\n                    );\\n                }\\n            }\\n            (, mintAmount) = addUInt(updatedUnderlying.mantissa, mintAmount);\\n        }\\n\\n        /* We write previously calculated values into storage */\\n        totalSupply = vars.totalSupplyNew;\\n        accountTokens[minter] = SupplySnapshot({\\n            tokens: vars.accountTokensNew,\\n            underlyingAmount: mintAmount,\\n            suppliedAt: accrualBlockNumber,\\n            promisedSupplyRate: currentSupplyRate\\n        });\\n\\n        /* We emit a Mint event, and a Transfer event */\\n        emit Mint(minter, vars.actualMintAmount, vars.mintTokens);\\n        emit Transfer(address(this), minter, vars.mintTokens);\\n\\n        /* We call the defense hook */\\n        // unused function\\n        // comptroller.mintVerify(address(this), minter, vars.actualMintAmount, vars.mintTokens);\\n\\n        return (uint256(Error.NO_ERROR), vars.actualMintAmount);\\n    }\\n\\n    /**\\n     * @notice Sender redeems cTokens in exchange for the underlying asset\\n     * @dev Accrues interest whether or not the operation succeeds, unless reverted\\n     * @param redeemTokens The number of cTokens to redeem into underlying\\n     * @return uint 0=success, otherwise a failure (see ErrorReporter.sol for details)\\n     */\\n    function redeemInternal(uint256 redeemTokens)\\n        internal\\n        nonReentrant\\n        returns (uint256)\\n    {\\n        uint256 error = accrueInterest();\\n        if (error != uint256(Error.NO_ERROR)) {\\n            // accrueInterest emits logs on errors, but we still want to log the fact that an attempted redeem failed\\n            return\\n                fail(Error(error), FailureInfo.REDEEM_ACCRUE_INTEREST_FAILED);\\n        }\\n        // redeemFresh emits redeem-specific logs on errors, so we don't need to\\n        return redeemFresh(msg.sender, redeemTokens, 0);\\n    }\\n\\n    /**\\n     * @notice Sender redeems cTokens in exchange for a specified amount of underlying asset\\n     * @dev Accrues interest whether or not the operation succeeds, unless reverted\\n     * @param redeemAmount The amount of underlying to receive from redeeming cTokens\\n     * @return uint 0=success, otherwise a failure (see ErrorReporter.sol for details)\\n     */\\n    function redeemUnderlyingInternal(uint256 redeemAmount)\\n        internal\\n        nonReentrant\\n        returns (uint256)\\n    {\\n        uint256 error = accrueInterest();\\n        if (error != uint256(Error.NO_ERROR)) {\\n            // accrueInterest emits logs on errors, but we still want to log the fact that an attempted redeem failed\\n            return\\n                fail(Error(error), FailureInfo.REDEEM_ACCRUE_INTEREST_FAILED);\\n        }\\n        // redeemFresh emits redeem-specific logs on errors, so we don't need to\\n        return redeemFresh(msg.sender, 0, redeemAmount);\\n    }\\n\\n    struct RedeemLocalVars {\\n        Error err;\\n        MathError mathErr;\\n        uint256 exchangeRateMantissa;\\n        uint256 redeemTokens;\\n        uint256 redeemAmount;\\n        uint256 totalSupplyNew;\\n        uint256 accountTokensNew;\\n        uint256 newSubsidyFund;\\n    }\\n\\n    /**\\n     * @notice User redeems cTokens in exchange for the underlying asset\\n     * @dev Assumes interest has already been accrued up to the current block\\n     * @param redeemer The address of the account which is redeeming the tokens\\n     * @param redeemTokensIn The number of cTokens to redeem into underlying (only one of redeemTokensIn or redeemAmountIn may be non-zero)\\n     * @param redeemAmountIn The number of underlying tokens to receive from redeeming cTokens (only one of redeemTokensIn or redeemAmountIn may be non-zero)\\n     * @return uint 0=success, otherwise a failure (see ErrorReporter.sol for details)\\n     */\\n    function redeemFresh(\\n        address payable redeemer,\\n        uint256 redeemTokensIn,\\n        uint256 redeemAmountIn\\n    ) internal returns (uint256) {\\n        require(\\n            redeemTokensIn == 0 || redeemAmountIn == 0,\\n            \\\"one of redeemTokensIn or redeemAmountIn must be zero\\\"\\n        );\\n\\n        RedeemLocalVars memory vars;\\n\\n        SupplySnapshot storage supplySnapshot = accountTokens[redeemer];\\n\\n        /* exchangeRate = invoke Exchange Rate Stored() */\\n        (\\n            vars.mathErr,\\n            vars.exchangeRateMantissa\\n        ) = exchangeRateStoredInternal();\\n        if (vars.mathErr != MathError.NO_ERROR) {\\n            return\\n                failOpaque(\\n                    Error.MATH_ERROR,\\n                    FailureInfo.REDEEM_EXCHANGE_RATE_READ_FAILED,\\n                    uint256(vars.mathErr)\\n                );\\n        }\\n\\n        uint256 interestEarned;\\n        uint256 subsidyFundPortion;\\n\\n        bool isTropykusInterestRateModel =\\n            interestRateModel.isTropykusInterestRateModel();\\n        if (isTropykusInterestRateModel) {\\n            uint256 promisedSupplyRate = supplySnapshot.promisedSupplyRate;\\n            Exp memory expectedSupplyRatePerBlock =\\n                Exp({mantissa: promisedSupplyRate});\\n            (, uint256 delta) =\\n                subUInt(accrualBlockNumber, supplySnapshot.suppliedAt);\\n            (, Exp memory expectedSupplyRatePerBlockWithDelta) =\\n                mulScalar(expectedSupplyRatePerBlock, delta);\\n            (, Exp memory interestFactor) =\\n                addExp(\\n                    Exp({mantissa: 1e18}),\\n                    expectedSupplyRatePerBlockWithDelta\\n                );\\n            uint256 currentUnderlying = supplySnapshot.underlyingAmount;\\n            Exp memory redeemerUnderlying = Exp({mantissa: currentUnderlying});\\n            (, Exp memory realAmount) =\\n                mulExp(interestFactor, redeemerUnderlying);\\n            supplySnapshot.underlyingAmount = realAmount.mantissa;\\n            (, interestEarned) = subUInt(\\n                realAmount.mantissa,\\n                currentUnderlying\\n            );\\n        }\\n        supplySnapshot.suppliedAt = accrualBlockNumber;\\n        supplySnapshot.promisedSupplyRate = interestRateModel.getSupplyRate(\\n            getCashPrior(),\\n            totalBorrows,\\n            totalReserves,\\n            reserveFactorMantissa\\n        );\\n\\n        if (\\n            isTropykusInterestRateModel &&\\n            !interestRateModel.isAboveOptimal(\\n                getCashPrior(),\\n                totalBorrows,\\n                totalReserves\\n            )\\n        ) {\\n            uint256 borrowRate =\\n                interestRateModel.getBorrowRate(\\n                    getCashPrior(),\\n                    totalBorrows,\\n                    totalReserves\\n                );\\n\\n            uint256 utilizationRate =\\n                interestRateModel.utilizationRate(\\n                    getCashPrior(),\\n                    totalBorrows,\\n                    totalReserves\\n                );\\n\\n            (, uint256 estimatedEarning) =\\n                mulScalarTruncate(Exp({mantissa: borrowRate}), utilizationRate);\\n\\n            (, subsidyFundPortion) = subUInt(\\n                supplySnapshot.promisedSupplyRate,\\n                estimatedEarning\\n            );\\n            (, Exp memory subsidyFactor) =\\n                getExp(subsidyFundPortion, supplySnapshot.promisedSupplyRate);\\n            (, subsidyFundPortion) = mulScalarTruncate(\\n                subsidyFactor,\\n                interestEarned\\n            );\\n        }\\n\\n        /* If redeemTokensIn > 0: */\\n        if (redeemTokensIn > 0) {\\n            vars.redeemTokens = redeemTokensIn;\\n            if (isTropykusInterestRateModel) {\\n                (, Exp memory num) =\\n                    mulExp(vars.redeemTokens, supplySnapshot.underlyingAmount);\\n                (, Exp memory realUnderlyingWithdrawAmount) =\\n                    divScalar(num, supplySnapshot.tokens);\\n                vars.redeemAmount = realUnderlyingWithdrawAmount.mantissa;\\n            } else {\\n                /*\\n                 * We calculate the exchange rate and the amount of underlying to be redeemed:\\n                 *  redeemTokens = redeemTokensIn\\n                 *  redeemAmount = redeemTokensIn x exchangeRateCurrent\\n                 */\\n                (vars.mathErr, vars.redeemAmount) = mulScalarTruncate(\\n                    Exp({mantissa: vars.exchangeRateMantissa}),\\n                    redeemTokensIn\\n                );\\n                if (vars.mathErr != MathError.NO_ERROR) {\\n                    return\\n                        failOpaque(\\n                            Error.MATH_ERROR,\\n                            FailureInfo\\n                                .REDEEM_EXCHANGE_TOKENS_CALCULATION_FAILED,\\n                            uint256(vars.mathErr)\\n                        );\\n                }\\n            }\\n        } else {\\n            vars.redeemAmount = redeemAmountIn;\\n\\n            if (isTropykusInterestRateModel) {\\n                (, Exp memory num) =\\n                    mulExp(vars.redeemAmount, supplySnapshot.tokens);\\n                (, Exp memory realTokensWithdrawAmount) =\\n                    divScalar(num, supplySnapshot.underlyingAmount);\\n                vars.redeemTokens = realTokensWithdrawAmount.mantissa;\\n            } else {\\n                /*\\n                 * We get the current exchange rate and calculate the amount to be redeemed:\\n                 *  redeemTokens = redeemAmountIn / exchangeRate\\n                 *  redeemAmount = redeemAmountIn\\n                 */\\n\\n                (vars.mathErr, vars.redeemTokens) = divScalarByExpTruncate(\\n                    redeemAmountIn,\\n                    Exp({mantissa: vars.exchangeRateMantissa})\\n                );\\n                if (vars.mathErr != MathError.NO_ERROR) {\\n                    return\\n                        failOpaque(\\n                            Error.MATH_ERROR,\\n                            FailureInfo\\n                                .REDEEM_EXCHANGE_AMOUNT_CALCULATION_FAILED,\\n                            uint256(vars.mathErr)\\n                        );\\n                }\\n            }\\n        }\\n\\n        /* Fail if redeem not allowed */\\n        uint256 allowed =\\n            comptroller.redeemAllowed(\\n                address(this),\\n                redeemer,\\n                vars.redeemTokens\\n            );\\n        if (allowed != 0) {\\n            return\\n                failOpaque(\\n                    Error.COMPTROLLER_REJECTION,\\n                    FailureInfo.REDEEM_COMPTROLLER_REJECTION,\\n                    allowed\\n                );\\n        }\\n\\n        /* Verify market's block number equals current block number */\\n        if (accrualBlockNumber != getBlockNumber()) {\\n            return\\n                fail(\\n                    Error.MARKET_NOT_FRESH,\\n                    FailureInfo.REDEEM_FRESHNESS_CHECK\\n                );\\n        }\\n\\n        /*\\n         * We calculate the new total supply and redeemer balance, checking for underflow:\\n         *  totalSupplyNew = totalSupply - redeemTokens\\n         *  accountTokensNew = accountTokens[redeemer] - redeemTokens\\n         */\\n        (vars.mathErr, vars.totalSupplyNew) = subUInt(\\n            totalSupply,\\n            vars.redeemTokens\\n        );\\n        if (vars.mathErr != MathError.NO_ERROR) {\\n            return\\n                failOpaque(\\n                    Error.MATH_ERROR,\\n                    FailureInfo.REDEEM_NEW_TOTAL_SUPPLY_CALCULATION_FAILED,\\n                    uint256(vars.mathErr)\\n                );\\n        }\\n\\n        (, vars.newSubsidyFund) = subUInt(\\n            subsidyFund,\\n            subsidyFundPortion\\n        );\\n\\n        (vars.mathErr, vars.accountTokensNew) = subUInt(\\n            supplySnapshot.tokens,\\n            vars.redeemTokens\\n        );\\n        if (vars.mathErr != MathError.NO_ERROR) {\\n            return\\n                failOpaque(\\n                    Error.MATH_ERROR,\\n                    FailureInfo.REDEEM_NEW_ACCOUNT_BALANCE_CALCULATION_FAILED,\\n                    uint256(vars.mathErr)\\n                );\\n        }\\n\\n        /* Fail gracefully if protocol has insufficient cash */\\n        if (getCashPrior() < vars.redeemAmount) {\\n            return\\n                fail(\\n                    Error.TOKEN_INSUFFICIENT_CASH,\\n                    FailureInfo.REDEEM_TRANSFER_OUT_NOT_POSSIBLE\\n                );\\n        }\\n\\n        /////////////////////////\\n        // EFFECTS & INTERACTIONS\\n        // (No safe failures beyond this point)\\n\\n        /*\\n         * We invoke doTransferOut for the redeemer and the redeemAmount.\\n         *  Note: The cToken must handle variations between ERC-20 and ETH underlying.\\n         *  On success, the cToken has redeemAmount less of cash.\\n         *  doTransferOut reverts if anything goes wrong, since we can't be sure if side effects occurred.\\n         */\\n        doTransferOut(redeemer, vars.redeemAmount);\\n\\n        /* We write previously calculated values into storage */\\n        totalSupply = vars.totalSupplyNew;\\n        subsidyFund = vars.newSubsidyFund;\\n        supplySnapshot.tokens = vars.accountTokensNew;\\n        supplySnapshot.suppliedAt = accrualBlockNumber;\\n\\n        /* We emit a Transfer event, and a Redeem event */\\n        emit Transfer(redeemer, address(this), vars.redeemTokens);\\n        emit Redeem(redeemer, vars.redeemAmount, vars.redeemTokens);\\n\\n        /* We call the defense hook */\\n        comptroller.redeemVerify(\\n            address(this),\\n            redeemer,\\n            vars.redeemAmount,\\n            vars.redeemTokens\\n        );\\n\\n        return uint256(Error.NO_ERROR);\\n    }\\n\\n    /**\\n     * @notice Sender borrows assets from the protocol to their own address\\n     * @param borrowAmount The amount of the underlying asset to borrow\\n     * @return uint 0=success, otherwise a failure (see ErrorReporter.sol for details)\\n     */\\n    function borrowInternal(uint256 borrowAmount)\\n        internal\\n        nonReentrant\\n        returns (uint256)\\n    {\\n        uint256 error = accrueInterest();\\n        if (error != uint256(Error.NO_ERROR)) {\\n            // accrueInterest emits logs on errors, but we still want to log the fact that an attempted borrow failed\\n            return\\n                fail(Error(error), FailureInfo.BORROW_ACCRUE_INTEREST_FAILED);\\n        }\\n        // borrowFresh emits borrow-specific logs on errors, so we don't need to\\n        return borrowFresh(msg.sender, borrowAmount);\\n    }\\n\\n    struct BorrowLocalVars {\\n        MathError mathErr;\\n        uint256 accountBorrows;\\n        uint256 accountBorrowsNew;\\n        uint256 totalBorrowsNew;\\n    }\\n\\n    /**\\n     * @notice Users borrow assets from the protocol to their own address\\n     * @param borrowAmount The amount of the underlying asset to borrow\\n     * @return uint 0=success, otherwise a failure (see ErrorReporter.sol for details)\\n     */\\n    function borrowFresh(address payable borrower, uint256 borrowAmount)\\n        internal\\n        returns (uint256)\\n    {\\n        /* Fail if borrow not allowed */\\n        uint256 allowed =\\n            comptroller.borrowAllowed(address(this), borrower, borrowAmount);\\n        if (allowed != 0) {\\n            return\\n                failOpaque(\\n                    Error.COMPTROLLER_REJECTION,\\n                    FailureInfo.BORROW_COMPTROLLER_REJECTION,\\n                    allowed\\n                );\\n        }\\n\\n        /* Verify market's block number equals current block number */\\n        if (accrualBlockNumber != getBlockNumber()) {\\n            return\\n                fail(\\n                    Error.MARKET_NOT_FRESH,\\n                    FailureInfo.BORROW_FRESHNESS_CHECK\\n                );\\n        }\\n\\n        /* Fail gracefully if protocol has insufficient underlying cash */\\n        if (getCashPrior() < borrowAmount) {\\n            return\\n                fail(\\n                    Error.TOKEN_INSUFFICIENT_CASH,\\n                    FailureInfo.BORROW_CASH_NOT_AVAILABLE\\n                );\\n        }\\n\\n        BorrowLocalVars memory vars;\\n\\n        /*\\n         * We calculate the new borrower and total borrow balances, failing on overflow:\\n         *  accountBorrowsNew = accountBorrows + borrowAmount\\n         *  totalBorrowsNew = totalBorrows + borrowAmount\\n         */\\n        (vars.mathErr, vars.accountBorrows) = borrowBalanceStoredInternal(\\n            borrower\\n        );\\n        if (vars.mathErr != MathError.NO_ERROR) {\\n            return\\n                failOpaque(\\n                    Error.MATH_ERROR,\\n                    FailureInfo.BORROW_ACCUMULATED_BALANCE_CALCULATION_FAILED,\\n                    uint256(vars.mathErr)\\n                );\\n        }\\n\\n        (vars.mathErr, vars.accountBorrowsNew) = addUInt(\\n            vars.accountBorrows,\\n            borrowAmount\\n        );\\n        if (vars.mathErr != MathError.NO_ERROR) {\\n            return\\n                failOpaque(\\n                    Error.MATH_ERROR,\\n                    FailureInfo\\n                        .BORROW_NEW_ACCOUNT_BORROW_BALANCE_CALCULATION_FAILED,\\n                    uint256(vars.mathErr)\\n                );\\n        }\\n\\n        (vars.mathErr, vars.totalBorrowsNew) = addUInt(\\n            totalBorrows,\\n            borrowAmount\\n        );\\n        if (vars.mathErr != MathError.NO_ERROR) {\\n            return\\n                failOpaque(\\n                    Error.MATH_ERROR,\\n                    FailureInfo.BORROW_NEW_TOTAL_BALANCE_CALCULATION_FAILED,\\n                    uint256(vars.mathErr)\\n                );\\n        }\\n\\n        /////////////////////////\\n        // EFFECTS & INTERACTIONS\\n        // (No safe failures beyond this point)\\n\\n        /*\\n         * We invoke doTransferOut for the borrower and the borrowAmount.\\n         *  Note: The cToken must handle variations between ERC-20 and ETH underlying.\\n         *  On success, the cToken borrowAmount less of cash.\\n         *  doTransferOut reverts if anything goes wrong, since we can't be sure if side effects occurred.\\n         */\\n        doTransferOut(borrower, borrowAmount);\\n\\n        /* We write the previously calculated values into storage */\\n        accountBorrows[borrower].principal = vars.accountBorrowsNew;\\n        accountBorrows[borrower].interestIndex = borrowIndex;\\n        totalBorrows = vars.totalBorrowsNew;\\n\\n        /* We emit a Borrow event */\\n        emit Borrow(\\n            borrower,\\n            borrowAmount,\\n            vars.accountBorrowsNew,\\n            vars.totalBorrowsNew\\n        );\\n\\n        /* We call the defense hook */\\n        // unused function\\n        // comptroller.borrowVerify(address(this), borrower, borrowAmount);\\n\\n        return uint256(Error.NO_ERROR);\\n    }\\n\\n    /**\\n     * @notice Sender repays their own borrow\\n     * @param repayAmount The amount to repay\\n     * @return (uint, uint) An error code (0=success, otherwise a failure, see ErrorReporter.sol), and the actual repayment amount.\\n     */\\n    function repayBorrowInternal(uint256 repayAmount)\\n        internal\\n        nonReentrant\\n        returns (uint256, uint256)\\n    {\\n        uint256 error = accrueInterest();\\n        if (error != uint256(Error.NO_ERROR)) {\\n            // accrueInterest emits logs on errors, but we still want to log the fact that an attempted borrow failed\\n            return (\\n                fail(\\n                    Error(error),\\n                    FailureInfo.REPAY_BORROW_ACCRUE_INTEREST_FAILED\\n                ),\\n                0\\n            );\\n        }\\n        // repayBorrowFresh emits repay-borrow-specific logs on errors, so we don't need to\\n        return repayBorrowFresh(msg.sender, msg.sender, repayAmount);\\n    }\\n\\n    /**\\n     * @notice Sender repays a borrow belonging to borrower\\n     * @param borrower the account with the debt being payed off\\n     * @param repayAmount The amount to repay\\n     * @return (uint, uint) An error code (0=success, otherwise a failure, see ErrorReporter.sol), and the actual repayment amount.\\n     */\\n    function repayBorrowBehalfInternal(address borrower, uint256 repayAmount)\\n        internal\\n        nonReentrant\\n        returns (uint256, uint256)\\n    {\\n        uint256 error = accrueInterest();\\n        if (error != uint256(Error.NO_ERROR)) {\\n            // accrueInterest emits logs on errors, but we still want to log the fact that an attempted borrow failed\\n            return (\\n                fail(\\n                    Error(error),\\n                    FailureInfo.REPAY_BEHALF_ACCRUE_INTEREST_FAILED\\n                ),\\n                0\\n            );\\n        }\\n        // repayBorrowFresh emits repay-borrow-specific logs on errors, so we don't need to\\n        return repayBorrowFresh(msg.sender, borrower, repayAmount);\\n    }\\n\\n    struct RepayBorrowLocalVars {\\n        Error err;\\n        MathError mathErr;\\n        uint256 repayAmount;\\n        uint256 borrowerIndex;\\n        uint256 accountBorrows;\\n        uint256 accountBorrowsNew;\\n        uint256 totalBorrowsNew;\\n        uint256 actualRepayAmount;\\n    }\\n\\n    /**\\n     * @notice Borrows are repaid by another user (possibly the borrower).\\n     * @param payer the account paying off the borrow\\n     * @param borrower the account with the debt being payed off\\n     * @param repayAmount the amount of undelrying tokens being returned\\n     * @return (uint, uint) An error code (0=success, otherwise a failure, see ErrorReporter.sol), and the actual repayment amount.\\n     */\\n    function repayBorrowFresh(\\n        address payer,\\n        address borrower,\\n        uint256 repayAmount\\n    ) internal returns (uint256, uint256) {\\n        /* Fail if repayBorrow not allowed */\\n        uint256 allowed =\\n            comptroller.repayBorrowAllowed(\\n                address(this),\\n                payer,\\n                borrower,\\n                repayAmount\\n            );\\n        if (allowed != 0) {\\n            return (\\n                failOpaque(\\n                    Error.COMPTROLLER_REJECTION,\\n                    FailureInfo.REPAY_BORROW_COMPTROLLER_REJECTION,\\n                    allowed\\n                ),\\n                0\\n            );\\n        }\\n\\n        /* Verify market's block number equals current block number */\\n        if (accrualBlockNumber != getBlockNumber()) {\\n            return (\\n                fail(\\n                    Error.MARKET_NOT_FRESH,\\n                    FailureInfo.REPAY_BORROW_FRESHNESS_CHECK\\n                ),\\n                0\\n            );\\n        }\\n\\n        RepayBorrowLocalVars memory vars;\\n\\n        /* We remember the original borrowerIndex for verification purposes */\\n        vars.borrowerIndex = accountBorrows[borrower].interestIndex;\\n\\n        /* We fetch the amount the borrower owes, with accumulated interest */\\n        (vars.mathErr, vars.accountBorrows) = borrowBalanceStoredInternal(\\n            borrower\\n        );\\n        if (vars.mathErr != MathError.NO_ERROR) {\\n            return (\\n                failOpaque(\\n                    Error.MATH_ERROR,\\n                    FailureInfo\\n                        .REPAY_BORROW_ACCUMULATED_BALANCE_CALCULATION_FAILED,\\n                    uint256(vars.mathErr)\\n                ),\\n                0\\n            );\\n        }\\n\\n        /* If repayAmount == -1, repayAmount = accountBorrows */\\n        if (repayAmount == uint256(-1)) {\\n            vars.repayAmount = vars.accountBorrows;\\n        } else {\\n            vars.repayAmount = repayAmount;\\n        }\\n\\n        /////////////////////////\\n        // EFFECTS & INTERACTIONS\\n        // (No safe failures beyond this point)\\n\\n        /*\\n         * We call doTransferIn for the payer and the repayAmount\\n         *  Note: The cToken must handle variations between ERC-20 and ETH underlying.\\n         *  On success, the cToken holds an additional repayAmount of cash.\\n         *  doTransferIn reverts if anything goes wrong, since we can't be sure if side effects occurred.\\n         *   it returns the amount actually transferred, in case of a fee.\\n         */\\n        vars.actualRepayAmount = doTransferIn(payer, vars.repayAmount);\\n\\n        /*\\n         * We calculate the new borrower and total borrow balances, failing on underflow:\\n         *  accountBorrowsNew = accountBorrows - actualRepayAmount\\n         *  totalBorrowsNew = totalBorrows - actualRepayAmount\\n         */\\n        (vars.mathErr, vars.accountBorrowsNew) = subUInt(\\n            vars.accountBorrows,\\n            vars.actualRepayAmount\\n        );\\n        require(\\n            vars.mathErr == MathError.NO_ERROR,\\n            \\\"REPAY_BORROW_NEW_ACCOUNT_BORROW_BALANCE_CALCULATION_FAILED\\\"\\n        );\\n\\n        (vars.mathErr, vars.totalBorrowsNew) = subUInt(\\n            totalBorrows,\\n            vars.actualRepayAmount\\n        );\\n        require(\\n            vars.mathErr == MathError.NO_ERROR,\\n            \\\"REPAY_BORROW_NEW_TOTAL_BALANCE_CALCULATION_FAILED\\\"\\n        );\\n\\n        /* We write the previously calculated values into storage */\\n        accountBorrows[borrower].principal = vars.accountBorrowsNew;\\n        accountBorrows[borrower].interestIndex = borrowIndex;\\n        totalBorrows = vars.totalBorrowsNew;\\n\\n        /* We emit a RepayBorrow event */\\n        emit RepayBorrow(\\n            payer,\\n            borrower,\\n            vars.actualRepayAmount,\\n            vars.accountBorrowsNew,\\n            vars.totalBorrowsNew\\n        );\\n\\n        /* We call the defense hook */\\n        // unused function\\n        // comptroller.repayBorrowVerify(address(this), payer, borrower, vars.actualRepayAmount, vars.borrowerIndex);\\n\\n        return (uint256(Error.NO_ERROR), vars.actualRepayAmount);\\n    }\\n\\n    /**\\n     * @notice The sender liquidates the borrowers collateral.\\n     *  The collateral seized is transferred to the liquidator.\\n     * @param borrower The borrower of this cToken to be liquidated\\n     * @param cTokenCollateral The market in which to seize collateral from the borrower\\n     * @param repayAmount The amount of the underlying borrowed asset to repay\\n     * @return (uint, uint) An error code (0=success, otherwise a failure, see ErrorReporter.sol), and the actual repayment amount.\\n     */\\n    function liquidateBorrowInternal(\\n        address borrower,\\n        uint256 repayAmount,\\n        CTokenInterface cTokenCollateral\\n    ) internal nonReentrant returns (uint256, uint256) {\\n        uint256 error = accrueInterest();\\n        if (error != uint256(Error.NO_ERROR)) {\\n            // accrueInterest emits logs on errors, but we still want to log the fact that an attempted liquidation failed\\n            return (\\n                fail(\\n                    Error(error),\\n                    FailureInfo.LIQUIDATE_ACCRUE_BORROW_INTEREST_FAILED\\n                ),\\n                0\\n            );\\n        }\\n\\n        error = cTokenCollateral.accrueInterest();\\n        if (error != uint256(Error.NO_ERROR)) {\\n            // accrueInterest emits logs on errors, but we still want to log the fact that an attempted liquidation failed\\n            return (\\n                fail(\\n                    Error(error),\\n                    FailureInfo.LIQUIDATE_ACCRUE_COLLATERAL_INTEREST_FAILED\\n                ),\\n                0\\n            );\\n        }\\n\\n        // liquidateBorrowFresh emits borrow-specific logs on errors, so we don't need to\\n        return\\n            liquidateBorrowFresh(\\n                msg.sender,\\n                borrower,\\n                repayAmount,\\n                cTokenCollateral\\n            );\\n    }\\n\\n    /**\\n     * @notice The liquidator liquidates the borrowers collateral.\\n     *  The collateral seized is transferred to the liquidator.\\n     * @param borrower The borrower of this cToken to be liquidated\\n     * @param liquidator The address repaying the borrow and seizing collateral\\n     * @param cTokenCollateral The market in which to seize collateral from the borrower\\n     * @param repayAmount The amount of the underlying borrowed asset to repay\\n     * @return (uint, uint) An error code (0=success, otherwise a failure, see ErrorReporter.sol), and the actual repayment amount.\\n     */\\n    function liquidateBorrowFresh(\\n        address liquidator,\\n        address borrower,\\n        uint256 repayAmount,\\n        CTokenInterface cTokenCollateral\\n    ) internal returns (uint256, uint256) {\\n        /* Fail if liquidate not allowed */\\n        uint256 allowed =\\n            comptroller.liquidateBorrowAllowed(\\n                address(this),\\n                address(cTokenCollateral),\\n                liquidator,\\n                borrower,\\n                repayAmount\\n            );\\n        if (allowed != 0) {\\n            return (\\n                failOpaque(\\n                    Error.COMPTROLLER_REJECTION,\\n                    FailureInfo.LIQUIDATE_COMPTROLLER_REJECTION,\\n                    allowed\\n                ),\\n                0\\n            );\\n        }\\n\\n        /* Verify market's block number equals current block number */\\n        if (accrualBlockNumber != getBlockNumber()) {\\n            return (\\n                fail(\\n                    Error.MARKET_NOT_FRESH,\\n                    FailureInfo.LIQUIDATE_FRESHNESS_CHECK\\n                ),\\n                0\\n            );\\n        }\\n\\n        /* Verify cTokenCollateral market's block number equals current block number */\\n        if (cTokenCollateral.accrualBlockNumber() != getBlockNumber()) {\\n            return (\\n                fail(\\n                    Error.MARKET_NOT_FRESH,\\n                    FailureInfo.LIQUIDATE_COLLATERAL_FRESHNESS_CHECK\\n                ),\\n                0\\n            );\\n        }\\n\\n        /* Fail if borrower = liquidator */\\n        if (borrower == liquidator) {\\n            return (\\n                fail(\\n                    Error.INVALID_ACCOUNT_PAIR,\\n                    FailureInfo.LIQUIDATE_LIQUIDATOR_IS_BORROWER\\n                ),\\n                0\\n            );\\n        }\\n\\n        /* Fail if repayAmount = 0 */\\n        if (repayAmount == 0) {\\n            return (\\n                fail(\\n                    Error.INVALID_CLOSE_AMOUNT_REQUESTED,\\n                    FailureInfo.LIQUIDATE_CLOSE_AMOUNT_IS_ZERO\\n                ),\\n                0\\n            );\\n        }\\n\\n        /* Fail if repayAmount = -1 */\\n        if (repayAmount == uint256(-1)) {\\n            return (\\n                fail(\\n                    Error.INVALID_CLOSE_AMOUNT_REQUESTED,\\n                    FailureInfo.LIQUIDATE_CLOSE_AMOUNT_IS_UINT_MAX\\n                ),\\n                0\\n            );\\n        }\\n\\n        /* Fail if repayBorrow fails */\\n        (uint256 repayBorrowError, uint256 actualRepayAmount) =\\n            repayBorrowFresh(liquidator, borrower, repayAmount);\\n        if (repayBorrowError != uint256(Error.NO_ERROR)) {\\n            return (\\n                fail(\\n                    Error(repayBorrowError),\\n                    FailureInfo.LIQUIDATE_REPAY_BORROW_FRESH_FAILED\\n                ),\\n                0\\n            );\\n        }\\n\\n        /////////////////////////\\n        // EFFECTS & INTERACTIONS\\n        // (No safe failures beyond this point)\\n\\n        /* We calculate the number of collateral tokens that will be seized */\\n        (uint256 amountSeizeError, uint256 seizeTokens) =\\n            comptroller.liquidateCalculateSeizeTokens(\\n                address(this),\\n                address(cTokenCollateral),\\n                actualRepayAmount\\n            );\\n        require(\\n            amountSeizeError == uint256(Error.NO_ERROR),\\n            \\\"LIQUIDATE_COMPTROLLER_CALCULATE_AMOUNT_SEIZE_FAILED\\\"\\n        );\\n\\n        /* Revert if borrower collateral token balance < seizeTokens */\\n        require(\\n            cTokenCollateral.balanceOf(borrower) >= seizeTokens,\\n            \\\"LIQUIDATE_SEIZE_TOO_MUCH\\\"\\n        );\\n\\n        // If this is also the collateral, run seizeInternal to avoid re-entrancy, otherwise make an external call\\n        uint256 seizeError;\\n        if (address(cTokenCollateral) == address(this)) {\\n            seizeError = seizeInternal(\\n                address(this),\\n                liquidator,\\n                borrower,\\n                seizeTokens\\n            );\\n        } else {\\n            seizeError = cTokenCollateral.seize(\\n                liquidator,\\n                borrower,\\n                seizeTokens\\n            );\\n        }\\n\\n        /* Revert if seize tokens fails (since we cannot be sure of side effects) */\\n        require(seizeError == uint256(Error.NO_ERROR), \\\"token seizure failed\\\");\\n\\n        /* We emit a LiquidateBorrow event */\\n        emit LiquidateBorrow(\\n            liquidator,\\n            borrower,\\n            actualRepayAmount,\\n            address(cTokenCollateral),\\n            seizeTokens\\n        );\\n\\n        /* We call the defense hook */\\n        // unused function\\n        // comptroller.liquidateBorrowVerify(address(this), address(cTokenCollateral), liquidator, borrower, actualRepayAmount, seizeTokens);\\n\\n        return (uint256(Error.NO_ERROR), actualRepayAmount);\\n    }\\n\\n    /**\\n     * @notice Transfers collateral tokens (this market) to the liquidator.\\n     * @dev Will fail unless called by another cToken during the process of liquidation.\\n     *  Its absolutely critical to use msg.sender as the borrowed cToken and not a parameter.\\n     * @param liquidator The account receiving seized collateral\\n     * @param borrower The account having collateral seized\\n     * @param seizeTokens The number of cTokens to seize\\n     * @return uint 0=success, otherwise a failure (see ErrorReporter.sol for details)\\n     */\\n    function seize(\\n        address liquidator,\\n        address borrower,\\n        uint256 seizeTokens\\n    ) external nonReentrant returns (uint256) {\\n        return seizeInternal(msg.sender, liquidator, borrower, seizeTokens);\\n    }\\n\\n    /**\\n     * @notice Transfers collateral tokens (this market) to the liquidator.\\n     * @dev Called only during an in-kind liquidation, or by liquidateBorrow during the liquidation of another CToken.\\n     *  Its absolutely critical to use msg.sender as the seizer cToken and not a parameter.\\n     * @param seizerToken The contract seizing the collateral (i.e. borrowed cToken)\\n     * @param liquidator The account receiving seized collateral\\n     * @param borrower The account having collateral seized\\n     * @param seizeTokens The number of cTokens to seize\\n     * @return uint 0=success, otherwise a failure (see ErrorReporter.sol for details)\\n     */\\n    function seizeInternal(\\n        address seizerToken,\\n        address liquidator,\\n        address borrower,\\n        uint256 seizeTokens\\n    ) internal returns (uint256) {\\n        /* Fail if seize not allowed */\\n        uint256 allowed =\\n            comptroller.seizeAllowed(\\n                address(this),\\n                seizerToken,\\n                liquidator,\\n                borrower,\\n                seizeTokens\\n            );\\n        if (allowed != 0) {\\n            return\\n                failOpaque(\\n                    Error.COMPTROLLER_REJECTION,\\n                    FailureInfo.LIQUIDATE_SEIZE_COMPTROLLER_REJECTION,\\n                    allowed\\n                );\\n        }\\n\\n        /* Fail if borrower = liquidator */\\n        if (borrower == liquidator) {\\n            return\\n                fail(\\n                    Error.INVALID_ACCOUNT_PAIR,\\n                    FailureInfo.LIQUIDATE_SEIZE_LIQUIDATOR_IS_BORROWER\\n                );\\n        }\\n\\n        MathError mathErr;\\n        uint256 borrowerTokensNew;\\n        uint256 liquidatorTokensNew;\\n\\n        /*\\n         * We calculate the new borrower and liquidator token balances, failing on underflow/overflow:\\n         *  borrowerTokensNew = accountTokens[borrower] - seizeTokens\\n         *  liquidatorTokensNew = accountTokens[liquidator] + seizeTokens\\n         */\\n        (mathErr, borrowerTokensNew) = subUInt(\\n            accountTokens[borrower].tokens,\\n            seizeTokens\\n        );\\n        if (mathErr != MathError.NO_ERROR) {\\n            return\\n                failOpaque(\\n                    Error.MATH_ERROR,\\n                    FailureInfo.LIQUIDATE_SEIZE_BALANCE_DECREMENT_FAILED,\\n                    uint256(mathErr)\\n                );\\n        }\\n\\n        (mathErr, liquidatorTokensNew) = addUInt(\\n            accountTokens[liquidator].tokens,\\n            seizeTokens\\n        );\\n        if (mathErr != MathError.NO_ERROR) {\\n            return\\n                failOpaque(\\n                    Error.MATH_ERROR,\\n                    FailureInfo.LIQUIDATE_SEIZE_BALANCE_INCREMENT_FAILED,\\n                    uint256(mathErr)\\n                );\\n        }\\n\\n        /////////////////////////\\n        // EFFECTS & INTERACTIONS\\n        // (No safe failures beyond this point)\\n\\n        /* We write the previously calculated values into storage */\\n        accountTokens[borrower].tokens = borrowerTokensNew;\\n        accountTokens[liquidator].tokens = liquidatorTokensNew;\\n\\n        /* Emit a Transfer event */\\n        emit Transfer(borrower, liquidator, seizeTokens);\\n\\n        /* We call the defense hook */\\n        // unused function\\n        // comptroller.seizeVerify(address(this), seizerToken, liquidator, borrower, seizeTokens);\\n\\n        return uint256(Error.NO_ERROR);\\n    }\\n\\n    /*** Admin Functions ***/\\n\\n    /**\\n     * @notice Begins transfer of admin rights. The newPendingAdmin must call `_acceptAdmin` to finalize the transfer.\\n     * @dev Admin function to begin change of admin. The newPendingAdmin must call `_acceptAdmin` to finalize the transfer.\\n     * @param newPendingAdmin New pending admin.\\n     * @return uint 0=success, otherwise a failure (see ErrorReporter.sol for details)\\n     */\\n    function _setPendingAdmin(address payable newPendingAdmin)\\n        external\\n        returns (uint256)\\n    {\\n        // Check caller = admin\\n        if (msg.sender != admin) {\\n            return\\n                fail(\\n                    Error.UNAUTHORIZED,\\n                    FailureInfo.SET_PENDING_ADMIN_OWNER_CHECK\\n                );\\n        }\\n\\n        // Save current value, if any, for inclusion in log\\n        address oldPendingAdmin = pendingAdmin;\\n\\n        // Store pendingAdmin with value newPendingAdmin\\n        pendingAdmin = newPendingAdmin;\\n\\n        // Emit NewPendingAdmin(oldPendingAdmin, newPendingAdmin)\\n        emit NewPendingAdmin(oldPendingAdmin, newPendingAdmin);\\n\\n        return uint256(Error.NO_ERROR);\\n    }\\n\\n    /**\\n     * @notice Accepts transfer of admin rights. msg.sender must be pendingAdmin\\n     * @dev Admin function for pending admin to accept role and update admin\\n     * @return uint 0=success, otherwise a failure (see ErrorReporter.sol for details)\\n     */\\n    function _acceptAdmin() external returns (uint256) {\\n        // Check caller is pendingAdmin and pendingAdmin \\u2260 address(0)\\n        if (msg.sender != pendingAdmin || msg.sender == address(0)) {\\n            return\\n                fail(\\n                    Error.UNAUTHORIZED,\\n                    FailureInfo.ACCEPT_ADMIN_PENDING_ADMIN_CHECK\\n                );\\n        }\\n\\n        // Save current values for inclusion in log\\n        address oldAdmin = admin;\\n        address oldPendingAdmin = pendingAdmin;\\n\\n        // Store admin with value pendingAdmin\\n        admin = pendingAdmin;\\n\\n        // Clear the pending value\\n        pendingAdmin = address(0);\\n\\n        emit NewAdmin(oldAdmin, admin);\\n        emit NewPendingAdmin(oldPendingAdmin, pendingAdmin);\\n\\n        return uint256(Error.NO_ERROR);\\n    }\\n\\n    /**\\n     * @notice Sets a new comptroller for the market\\n     * @dev Admin function to set a new comptroller\\n     * @return uint 0=success, otherwise a failure (see ErrorReporter.sol for details)\\n     */\\n    function _setComptroller(ComptrollerInterface newComptroller)\\n        public\\n        returns (uint256)\\n    {\\n        // Check caller is admin\\n        if (msg.sender != admin) {\\n            return\\n                fail(\\n                    Error.UNAUTHORIZED,\\n                    FailureInfo.SET_COMPTROLLER_OWNER_CHECK\\n                );\\n        }\\n\\n        ComptrollerInterface oldComptroller = comptroller;\\n        // Ensure invoke comptroller.isComptroller() returns true\\n        require(newComptroller.isComptroller(), \\\"marker method returned false\\\");\\n\\n        // Set market's comptroller to newComptroller\\n        comptroller = newComptroller;\\n\\n        // Emit NewComptroller(oldComptroller, newComptroller)\\n        emit NewComptroller(oldComptroller, newComptroller);\\n\\n        return uint256(Error.NO_ERROR);\\n    }\\n\\n    /**\\n     * @notice accrues interest and sets a new reserve factor for the protocol using _setReserveFactorFresh\\n     * @dev Admin function to accrue interest and set a new reserve factor\\n     * @return uint 0=success, otherwise a failure (see ErrorReporter.sol for details)\\n     */\\n    function _setReserveFactor(uint256 newReserveFactorMantissa)\\n        external\\n        nonReentrant\\n        returns (uint256)\\n    {\\n        uint256 error = accrueInterest();\\n        if (error != uint256(Error.NO_ERROR)) {\\n            // accrueInterest emits logs on errors, but on top of that we want to log the fact that an attempted reserve factor change failed.\\n            return\\n                fail(\\n                    Error(error),\\n                    FailureInfo.SET_RESERVE_FACTOR_ACCRUE_INTEREST_FAILED\\n                );\\n        }\\n        // _setReserveFactorFresh emits reserve-factor-specific logs on errors, so we don't need to.\\n        return _setReserveFactorFresh(newReserveFactorMantissa);\\n    }\\n\\n    /**\\n     * @notice Sets a new reserve factor for the protocol (*requires fresh interest accrual)\\n     * @dev Admin function to set a new reserve factor\\n     * @return uint 0=success, otherwise a failure (see ErrorReporter.sol for details)\\n     */\\n    function _setReserveFactorFresh(uint256 newReserveFactorMantissa)\\n        internal\\n        returns (uint256)\\n    {\\n        // Check caller is admin\\n        if (msg.sender != admin) {\\n            return\\n                fail(\\n                    Error.UNAUTHORIZED,\\n                    FailureInfo.SET_RESERVE_FACTOR_ADMIN_CHECK\\n                );\\n        }\\n\\n        // Verify market's block number equals current block number\\n        if (accrualBlockNumber != getBlockNumber()) {\\n            return\\n                fail(\\n                    Error.MARKET_NOT_FRESH,\\n                    FailureInfo.SET_RESERVE_FACTOR_FRESH_CHECK\\n                );\\n        }\\n\\n        // Check newReserveFactor \\u2264 maxReserveFactor\\n        if (newReserveFactorMantissa > reserveFactorMaxMantissa) {\\n            return\\n                fail(\\n                    Error.BAD_INPUT,\\n                    FailureInfo.SET_RESERVE_FACTOR_BOUNDS_CHECK\\n                );\\n        }\\n\\n        uint256 oldReserveFactorMantissa = reserveFactorMantissa;\\n        reserveFactorMantissa = newReserveFactorMantissa;\\n\\n        emit NewReserveFactor(\\n            oldReserveFactorMantissa,\\n            newReserveFactorMantissa\\n        );\\n\\n        return uint256(Error.NO_ERROR);\\n    }\\n\\n    /**\\n     * @notice Accrues interest and reduces reserves by transferring from msg.sender\\n     * @param addAmount Amount of addition to reserves\\n     * @return uint 0=success, otherwise a failure (see ErrorReporter.sol for details)\\n     */\\n    function _addReservesInternal(uint256 addAmount)\\n        internal\\n        nonReentrant\\n        returns (uint256)\\n    {\\n        uint256 error = accrueInterest();\\n        if (error != uint256(Error.NO_ERROR)) {\\n            // accrueInterest emits logs on errors, but on top of that we want to log the fact that an attempted reduce reserves failed.\\n            return\\n                fail(\\n                    Error(error),\\n                    FailureInfo.ADD_RESERVES_ACCRUE_INTEREST_FAILED\\n                );\\n        }\\n\\n        // _addReservesFresh emits reserve-addition-specific logs on errors, so we don't need to.\\n        (error, ) = _addReservesFresh(addAmount);\\n        return error;\\n    }\\n\\n    /**\\n     * @notice Add reserves by transferring from caller\\n     * @dev Requires fresh interest accrual\\n     * @param addAmount Amount of addition to reserves\\n     * @return (uint, uint) An error code (0=success, otherwise a failure (see ErrorReporter.sol for details)) and the actual amount added, net token fees\\n     */\\n    function _addReservesFresh(uint256 addAmount)\\n        internal\\n        returns (uint256, uint256)\\n    {\\n        // totalReserves + actualAddAmount\\n        uint256 totalReservesNew;\\n        uint256 actualAddAmount;\\n\\n        // We fail gracefully unless market's block number equals current block number\\n        if (accrualBlockNumber != getBlockNumber()) {\\n            return (\\n                fail(\\n                    Error.MARKET_NOT_FRESH,\\n                    FailureInfo.ADD_RESERVES_FRESH_CHECK\\n                ),\\n                actualAddAmount\\n            );\\n        }\\n\\n        /////////////////////////\\n        // EFFECTS & INTERACTIONS\\n        // (No safe failures beyond this point)\\n\\n        /*\\n         * We call doTransferIn for the caller and the addAmount\\n         *  Note: The cToken must handle variations between ERC-20 and ETH underlying.\\n         *  On success, the cToken holds an additional addAmount of cash.\\n         *  doTransferIn reverts if anything goes wrong, since we can't be sure if side effects occurred.\\n         *  it returns the amount actually transferred, in case of a fee.\\n         */\\n\\n        actualAddAmount = doTransferIn(msg.sender, addAmount);\\n\\n        totalReservesNew = totalReserves + actualAddAmount;\\n\\n        /* Revert on overflow */\\n        require(\\n            totalReservesNew >= totalReserves,\\n            \\\"add reserves unexpected overflow\\\"\\n        );\\n\\n        // Store reserves[n+1] = reserves[n] + actualAddAmount\\n        totalReserves = totalReservesNew;\\n\\n        /* Emit NewReserves(admin, actualAddAmount, reserves[n+1]) */\\n        emit ReservesAdded(msg.sender, actualAddAmount, totalReservesNew);\\n\\n        /* Return (NO_ERROR, actualAddAmount) */\\n        return (uint256(Error.NO_ERROR), actualAddAmount);\\n    }\\n\\n    function _addSubsidyInternal(uint256 addAmount)\\n        internal\\n        nonReentrant\\n        returns (uint256)\\n    {\\n        uint256 error = accrueInterest();\\n        if (error != uint256(Error.NO_ERROR)) {\\n            // accrueInterest emits logs on errors, but on top of that we want to log the fact that an attempted reduce reserves failed.\\n            return fail(Error(error), FailureInfo.ADD_SUBSIDY_FUND_FAILED);\\n        }\\n\\n        (error, ) = _addSubsidyFresh(addAmount);\\n        return error;\\n    }\\n\\n    /**\\n     * @notice Add reserves by transferring from caller\\n     * @dev Requires fresh interest accrual\\n     * @param addAmount Amount of addition to reserves\\n     * @return (uint, uint) An error code (0=success, otherwise a failure (see ErrorReporter.sol for details)) and the actual amount added, net token fees\\n     */\\n    function _addSubsidyFresh(uint256 addAmount)\\n        internal\\n        returns (uint256, uint256)\\n    {\\n        // subsidyFund + actualAddAmount\\n        uint256 subsidyFundNew;\\n        uint256 actualAddAmount;\\n\\n        // We fail gracefully unless market's block number equals current block number\\n        if (accrualBlockNumber != getBlockNumber()) {\\n            return (\\n                fail(\\n                    Error.MARKET_NOT_FRESH,\\n                    FailureInfo.ADD_SUBSIDY_FUND_FRESH_CHECK\\n                ),\\n                actualAddAmount\\n            );\\n        }\\n\\n        /////////////////////////\\n        // EFFECTS & INTERACTIONS\\n        // (No safe failures beyond this point)\\n\\n        /*\\n         * We call doTransferIn for the caller and the addAmount\\n         *  Note: The cToken must handle variations between ERC-20 and ETH underlying.\\n         *  On success, the cToken holds an additional addAmount of cash.\\n         *  doTransferIn reverts if anything goes wrong, since we can't be sure if side effects occurred.\\n         *  it returns the amount actually transferred, in case of a fee.\\n         */\\n\\n        actualAddAmount = doTransferIn(msg.sender, addAmount);\\n\\n        subsidyFundNew = subsidyFund + actualAddAmount;\\n\\n        /* Revert on overflow */\\n        require(\\n            subsidyFundNew >= subsidyFund,\\n            \\\"add reserves unexpected overflow\\\"\\n        );\\n\\n        // Store reserves[n+1] = reserves[n] + actualAddAmount\\n        subsidyFund = subsidyFundNew;\\n\\n        /* Emit NewReserves(admin, actualAddAmount, reserves[n+1]) */\\n        emit SubsidyAdded(msg.sender, actualAddAmount, subsidyFundNew);\\n\\n        /* Return (NO_ERROR, actualAddAmount) */\\n        return (uint256(Error.NO_ERROR), actualAddAmount);\\n    }\\n\\n    /**\\n     * @notice Accrues interest and reduces reserves by transferring to admin\\n     * @param reduceAmount Amount of reduction to reserves\\n     * @return uint 0=success, otherwise a failure (see ErrorReporter.sol for details)\\n     */\\n    function _reduceReserves(uint256 reduceAmount)\\n        external\\n        nonReentrant\\n        returns (uint256)\\n    {\\n        uint256 error = accrueInterest();\\n        if (error != uint256(Error.NO_ERROR)) {\\n            // accrueInterest emits logs on errors, but on top of that we want to log the fact that an attempted reduce reserves failed.\\n            return\\n                fail(\\n                    Error(error),\\n                    FailureInfo.REDUCE_RESERVES_ACCRUE_INTEREST_FAILED\\n                );\\n        }\\n        // _reduceReservesFresh emits reserve-reduction-specific logs on errors, so we don't need to.\\n        return _reduceReservesFresh(reduceAmount);\\n    }\\n\\n    /**\\n     * @notice Reduces reserves by transferring to admin\\n     * @dev Requires fresh interest accrual\\n     * @param reduceAmount Amount of reduction to reserves\\n     * @return uint 0=success, otherwise a failure (see ErrorReporter.sol for details)\\n     */\\n    function _reduceReservesFresh(uint256 reduceAmount)\\n        internal\\n        returns (uint256)\\n    {\\n        // totalReserves - reduceAmount\\n        uint256 totalReservesNew;\\n\\n        // Check caller is admin\\n        if (msg.sender != admin) {\\n            return\\n                fail(\\n                    Error.UNAUTHORIZED,\\n                    FailureInfo.REDUCE_RESERVES_ADMIN_CHECK\\n                );\\n        }\\n\\n        // We fail gracefully unless market's block number equals current block number\\n        if (accrualBlockNumber != getBlockNumber()) {\\n            return\\n                fail(\\n                    Error.MARKET_NOT_FRESH,\\n                    FailureInfo.REDUCE_RESERVES_FRESH_CHECK\\n                );\\n        }\\n\\n        // Fail gracefully if protocol has insufficient underlying cash\\n        if (getCashPrior() < reduceAmount) {\\n            return\\n                fail(\\n                    Error.TOKEN_INSUFFICIENT_CASH,\\n                    FailureInfo.REDUCE_RESERVES_CASH_NOT_AVAILABLE\\n                );\\n        }\\n\\n        // Check reduceAmount \\u2264 reserves[n] (totalReserves)\\n        if (reduceAmount > totalReserves) {\\n            return\\n                fail(Error.BAD_INPUT, FailureInfo.REDUCE_RESERVES_VALIDATION);\\n        }\\n\\n        /////////////////////////\\n        // EFFECTS & INTERACTIONS\\n        // (No safe failures beyond this point)\\n\\n        totalReservesNew = totalReserves - reduceAmount;\\n        // We checked reduceAmount <= totalReserves above, so this should never revert.\\n        require(\\n            totalReservesNew <= totalReserves,\\n            \\\"reduce reserves unexpected underflow\\\"\\n        );\\n\\n        // Store reserves[n+1] = reserves[n] - reduceAmount\\n        totalReserves = totalReservesNew;\\n\\n        // doTransferOut reverts if anything goes wrong, since we can't be sure if side effects occurred.\\n        doTransferOut(admin, reduceAmount);\\n\\n        emit ReservesReduced(admin, reduceAmount, totalReservesNew);\\n\\n        return uint256(Error.NO_ERROR);\\n    }\\n\\n    /**\\n     * @notice accrues interest and updates the interest rate model using _setInterestRateModelFresh\\n     * @dev Admin function to accrue interest and update the interest rate model\\n     * @param newInterestRateModel the new interest rate model to use\\n     * @return uint 0=success, otherwise a failure (see ErrorReporter.sol for details)\\n     */\\n    function _setInterestRateModel(InterestRateModel newInterestRateModel)\\n        public\\n        returns (uint256)\\n    {\\n        uint256 error = accrueInterest();\\n        if (error != uint256(Error.NO_ERROR)) {\\n            // accrueInterest emits logs on errors, but on top of that we want to log the fact that an attempted change of interest rate model failed\\n            return\\n                fail(\\n                    Error(error),\\n                    FailureInfo.SET_INTEREST_RATE_MODEL_ACCRUE_INTEREST_FAILED\\n                );\\n        }\\n        // _setInterestRateModelFresh emits interest-rate-model-update-specific logs on errors, so we don't need to.\\n        return _setInterestRateModelFresh(newInterestRateModel);\\n    }\\n\\n    /**\\n     * @notice updates the interest rate model (*requires fresh interest accrual)\\n     * @dev Admin function to update the interest rate model\\n     * @param newInterestRateModel the new interest rate model to use\\n     * @return uint 0=success, otherwise a failure (see ErrorReporter.sol for details)\\n     */\\n    function _setInterestRateModelFresh(InterestRateModel newInterestRateModel)\\n        internal\\n        returns (uint256)\\n    {\\n        // Used to store old model for use in the event that is emitted on success\\n        InterestRateModel oldInterestRateModel;\\n\\n        // Check caller is admin\\n        if (msg.sender != admin) {\\n            return\\n                fail(\\n                    Error.UNAUTHORIZED,\\n                    FailureInfo.SET_INTEREST_RATE_MODEL_OWNER_CHECK\\n                );\\n        }\\n\\n        // We fail gracefully unless market's block number equals current block number\\n        if (accrualBlockNumber != getBlockNumber()) {\\n            return\\n                fail(\\n                    Error.MARKET_NOT_FRESH,\\n                    FailureInfo.SET_INTEREST_RATE_MODEL_FRESH_CHECK\\n                );\\n        }\\n\\n        // Track the market's current interest rate model\\n        oldInterestRateModel = interestRateModel;\\n\\n        // Ensure invoke newInterestRateModel.isInterestRateModel() returns true\\n        require(\\n            newInterestRateModel.isInterestRateModel(),\\n            \\\"marker method returned false\\\"\\n        );\\n\\n        // Set the interest rate model to newInterestRateModel\\n        interestRateModel = newInterestRateModel;\\n\\n        // Emit NewMarketInterestRateModel(oldInterestRateModel, newInterestRateModel)\\n        emit NewMarketInterestRateModel(\\n            oldInterestRateModel,\\n            newInterestRateModel\\n        );\\n\\n        return uint256(Error.NO_ERROR);\\n    }\\n\\n    /*** Safe Token ***/\\n\\n    /**\\n     * @notice Gets balance of this contract in terms of the underlying\\n     * @dev This excludes the value of the current message, if any\\n     * @return The quantity of underlying owned by this contract\\n     */\\n    function getCashPrior() internal view returns (uint256);\\n\\n    /**\\n     * @dev Performs a transfer in, reverting upon failure. Returns the amount actually transferred to the protocol, in case of a fee.\\n     *  This may revert due to insufficient balance or insufficient allowance.\\n     */\\n    function doTransferIn(address from, uint256 amount)\\n        internal\\n        returns (uint256);\\n\\n    /**\\n     * @dev Performs a transfer out, ideally returning an explanatory error code upon failure tather than reverting.\\n     *  If caller has not called checked protocol's balance, may revert due to insufficient cash held in the contract.\\n     *  If caller has checked protocol's balance, and verified it is >= amount, this should not revert in normal conditions.\\n     */\\n    function doTransferOut(address payable to, uint256 amount) internal;\\n\\n    /*** Reentrancy Guard ***/\\n\\n    /**\\n     * @dev Prevents a contract from calling itself, directly or indirectly.\\n     */\\n    modifier nonReentrant() {\\n        require(_notEntered, \\\"re-entered\\\");\\n        _notEntered = false;\\n        _;\\n        _notEntered = true; // get a gas-refund post-Istanbul\\n    }\\n}\\n\",\"keccak256\":\"0x26a054de3c1878055ae919eb5fa221a6de107d62294084b5a3870f35c3394e52\"},\"contracts/CTokenInterfaces.sol\":{\"content\":\"pragma solidity ^0.5.16;\\n\\nimport \\\"./ComptrollerInterface.sol\\\";\\nimport \\\"./InterestRateModel.sol\\\";\\nimport \\\"./EIP20NonStandardInterface.sol\\\";\\n\\ncontract CTokenStorage {\\n    /**\\n     * @dev Guard variable for re-entrancy checks\\n     */\\n    bool internal _notEntered;\\n\\n    /**\\n     * @notice EIP-20 token name for this token\\n     */\\n    string public name;\\n\\n    /**\\n     * @notice EIP-20 token symbol for this token\\n     */\\n    string public symbol;\\n\\n    /**\\n     * @notice EIP-20 token decimals for this token\\n     */\\n    uint8 public decimals;\\n\\n    /**\\n     * @notice Maximum borrow rate that can ever be applied (.0005% / block)\\n     */\\n\\n    uint256 internal constant borrowRateMaxMantissa = 0.0005e16;\\n\\n    /**\\n     * @notice Maximum fraction of interest that can be set aside for reserves\\n     */\\n    uint256 internal constant reserveFactorMaxMantissa = 1e18;\\n\\n    /**\\n     * @notice Administrator for this contract\\n     */\\n    address payable public admin;\\n\\n    /**\\n     * @notice Pending administrator for this contract\\n     */\\n    address payable public pendingAdmin;\\n\\n    /**\\n     * @notice Contract which oversees inter-cToken operations\\n     */\\n    ComptrollerInterface public comptroller;\\n\\n    /**\\n     * @notice Model which tells what the current interest rate should be\\n     */\\n    InterestRateModel public interestRateModel;\\n\\n    /**\\n     * @notice Initial exchange rate used when minting the first CTokens (used when totalSupply = 0)\\n     */\\n    uint256 public initialExchangeRateMantissa;\\n\\n    /**\\n     * @notice Fraction of interest currently set aside for reserves\\n     */\\n    uint256 public reserveFactorMantissa;\\n\\n    /**\\n     * @notice Block number that interest was last accrued at\\n     */\\n    uint256 public accrualBlockNumber;\\n\\n    /**\\n     * @notice Accumulator of the total earned interest rate since the opening of the market\\n     */\\n    uint256 public borrowIndex;\\n\\n    /**\\n     * @notice Total amount of outstanding borrows of the underlying in this market\\n     */\\n    uint256 public totalBorrows;\\n\\n    /**\\n     * @notice Total amount of reserves of the underlying held in this market\\n     */\\n    uint256 public totalReserves;\\n\\n    /**\\n     * @notice Total number of tokens in circulation\\n     */\\n    uint256 public totalSupply;\\n\\n    uint256 public subsidyFund;\\n\\n    struct SupplySnapshot {\\n        uint256 tokens;\\n        uint256 underlyingAmount;\\n        uint256 suppliedAt;\\n        uint256 promisedSupplyRate;\\n    }\\n\\n    /**\\n     * @notice Official record of token balances for each account\\n     */\\n    mapping(address => SupplySnapshot) internal accountTokens;\\n\\n    /**\\n     * @notice Approved token transfer amounts on behalf of others\\n     */\\n    mapping(address => mapping(address => uint256)) internal transferAllowances;\\n\\n    /**\\n     * @notice Container for borrow balance information\\n     * @member principal Total balance (with accrued interest), after applying the most recent balance-changing action\\n     * @member interestIndex Global borrowIndex as of the most recent balance-changing action\\n     */\\n    struct BorrowSnapshot {\\n        uint256 principal;\\n        uint256 interestIndex;\\n    }\\n\\n    /**\\n     * @notice Mapping of account addresses to outstanding borrow balances\\n     */\\n    mapping(address => BorrowSnapshot) internal accountBorrows;\\n}\\n\\ncontract CTokenInterface is CTokenStorage {\\n    /**\\n     * @notice Indicator that this is a CToken contract (for inspection)\\n     */\\n    bool public constant isCToken = true;\\n\\n    /*** Market Events ***/\\n\\n    /**\\n     * @notice Event emitted when interest is accrued\\n     */\\n    event AccrueInterest(\\n        uint256 cashPrior,\\n        uint256 interestAccumulated,\\n        uint256 borrowIndex,\\n        uint256 totalBorrows\\n    );\\n\\n    /**\\n     * @notice Event emitted when tokens are minted\\n     */\\n    event Mint(address indexed minter, uint256 mintAmount, uint256 mintTokens);\\n\\n    /**\\n     * @notice Event emitted when tokens are redeemed\\n     */\\n    event Redeem(\\n        address indexed redeemer,\\n        uint256 redeemAmount,\\n        uint256 redeemTokens\\n    );\\n\\n    /**\\n     * @notice Event emitted when underlying is borrowed\\n     */\\n    event Borrow(\\n        address indexed borrower,\\n        uint256 borrowAmount,\\n        uint256 accountBorrows,\\n        uint256 totalBorrows\\n    );\\n\\n    /**\\n     * @notice Event emitted when a borrow is repaid\\n     */\\n    event RepayBorrow(\\n        address indexed payer,\\n        address indexed borrower,\\n        uint256 repayAmount,\\n        uint256 accountBorrows,\\n        uint256 totalBorrows\\n    );\\n\\n    /**\\n     * @notice Event emitted when a borrow is liquidated\\n     */\\n    event LiquidateBorrow(\\n        address indexed liquidator,\\n        address indexed borrower,\\n        uint256 repayAmount,\\n        address indexed cTokenCollateral,\\n        uint256 seizeTokens\\n    );\\n\\n    /*** Admin Events ***/\\n\\n    /**\\n     * @notice Event emitted when pendingAdmin is changed\\n     */\\n    event NewPendingAdmin(address oldPendingAdmin, address newPendingAdmin);\\n\\n    /**\\n     * @notice Event emitted when pendingAdmin is accepted, which means admin is updated\\n     */\\n    event NewAdmin(address oldAdmin, address newAdmin);\\n\\n    /**\\n     * @notice Event emitted when comptroller is changed\\n     */\\n    event NewComptroller(\\n        ComptrollerInterface oldComptroller,\\n        ComptrollerInterface newComptroller\\n    );\\n\\n    /**\\n     * @notice Event emitted when interestRateModel is changed\\n     */\\n    event NewMarketInterestRateModel(\\n        InterestRateModel oldInterestRateModel,\\n        InterestRateModel newInterestRateModel\\n    );\\n\\n    /**\\n     * @notice Event emitted when the reserve factor is changed\\n     */\\n    event NewReserveFactor(\\n        uint256 oldReserveFactorMantissa,\\n        uint256 newReserveFactorMantissa\\n    );\\n\\n    /**\\n     * @notice Event emitted when the reserves are added\\n     */\\n    event ReservesAdded(\\n        address benefactor,\\n        uint256 addAmount,\\n        uint256 newTotalReserves\\n    );\\n\\n    event SubsidyAdded(\\n        address benefactor,\\n        uint256 addAmount,\\n        uint256 newSubsidyFund\\n    );\\n\\n    /**\\n     * @notice Event emitted when the reserves are reduced\\n     */\\n    event ReservesReduced(\\n        address admin,\\n        uint256 reduceAmount,\\n        uint256 newTotalReserves\\n    );\\n\\n    /**\\n     * @notice EIP20 Transfer event\\n     */\\n    event Transfer(address indexed from, address indexed to, uint256 amount);\\n\\n    /**\\n     * @notice EIP20 Approval event\\n     */\\n    event Approval(\\n        address indexed owner,\\n        address indexed spender,\\n        uint256 amount\\n    );\\n\\n    /**\\n     * @notice Failure event\\n     */\\n    event Failure(uint256 error, uint256 info, uint256 detail);\\n\\n    /*** User Interface ***/\\n\\n    function transfer(address dst, uint256 amount) external returns (bool);\\n\\n    function transferFrom(\\n        address src,\\n        address dst,\\n        uint256 amount\\n    ) external returns (bool);\\n\\n    function approve(address spender, uint256 amount) external returns (bool);\\n\\n    function allowance(address owner, address spender)\\n        external\\n        view\\n        returns (uint256);\\n\\n    function balanceOf(address owner) external view returns (uint256);\\n\\n    function balanceOfUnderlying(address owner) external returns (uint256);\\n\\n    function getAccountSnapshot(address account)\\n        external\\n        view\\n        returns (\\n            uint256,\\n            uint256,\\n            uint256,\\n            uint256\\n        );\\n\\n    function borrowRatePerBlock() external view returns (uint256);\\n\\n    function supplyRatePerBlock() external view returns (uint256);\\n\\n    function totalBorrowsCurrent() external returns (uint256);\\n\\n    function borrowBalanceCurrent(address account) external returns (uint256);\\n\\n    function borrowBalanceStored(address account) public view returns (uint256);\\n\\n    function exchangeRateCurrent() public returns (uint256);\\n\\n    function exchangeRateStored() public view returns (uint256);\\n\\n    function getCash() external view returns (uint256);\\n\\n    function accrueInterest() public returns (uint256);\\n\\n    function seize(\\n        address liquidator,\\n        address borrower,\\n        uint256 seizeTokens\\n    ) external returns (uint256);\\n\\n    /*** Admin Functions ***/\\n\\n    function _setPendingAdmin(address payable newPendingAdmin)\\n        external\\n        returns (uint256);\\n\\n    function _acceptAdmin() external returns (uint256);\\n\\n    function _setComptroller(ComptrollerInterface newComptroller)\\n        public\\n        returns (uint256);\\n\\n    function _setReserveFactor(uint256 newReserveFactorMantissa)\\n        external\\n        returns (uint256);\\n\\n    function _reduceReserves(uint256 reduceAmount) external returns (uint256);\\n\\n    function _setInterestRateModel(InterestRateModel newInterestRateModel)\\n        public\\n        returns (uint256);\\n}\\n\\ncontract CErc20Storage {\\n    /**\\n     * @notice Underlying asset for this CToken\\n     */\\n    address public underlying;\\n}\\n\\ncontract CErc20Interface is CErc20Storage {\\n    /*** User Interface ***/\\n\\n    function mint(uint256 mintAmount) external returns (uint256);\\n\\n    function redeem(uint256 redeemTokens) external returns (uint256);\\n\\n    function redeemUnderlying(uint256 redeemAmount) external returns (uint256);\\n\\n    function borrow(uint256 borrowAmount) external returns (uint256);\\n\\n    function repayBorrow(uint256 repayAmount) external returns (uint256);\\n\\n    function repayBorrowBehalf(address borrower, uint256 repayAmount)\\n        external\\n        returns (uint256);\\n\\n    function liquidateBorrow(\\n        address borrower,\\n        uint256 repayAmount,\\n        CTokenInterface cTokenCollateral\\n    ) external returns (uint256);\\n\\n    function sweepToken(EIP20NonStandardInterface token) external;\\n\\n    /*** Admin Functions ***/\\n\\n    function _addReserves(uint256 addAmount) external returns (uint256);\\n}\\n\\ncontract CDelegationStorage {\\n    /**\\n     * @notice Implementation address for this contract\\n     */\\n    address public implementation;\\n}\\n\\ncontract CDelegatorInterface is CDelegationStorage {\\n    /**\\n     * @notice Emitted when implementation is changed\\n     */\\n    event NewImplementation(\\n        address oldImplementation,\\n        address newImplementation\\n    );\\n\\n    /**\\n     * @notice Called by the admin to update the implementation of the delegator\\n     * @param implementation_ The address of the new implementation for delegation\\n     * @param allowResign Flag to indicate whether to call _resignImplementation on the old implementation\\n     * @param becomeImplementationData The encoded bytes data to be passed to _becomeImplementation\\n     */\\n    function _setImplementation(\\n        address implementation_,\\n        bool allowResign,\\n        bytes memory becomeImplementationData\\n    ) public;\\n}\\n\\ncontract CDelegateInterface is CDelegationStorage {\\n    /**\\n     * @notice Called by the delegator on a delegate to initialize it for duty\\n     * @dev Should revert if any issues arise which make it unfit for delegation\\n     * @param data The encoded bytes data for any initialization\\n     */\\n    function _becomeImplementation(bytes memory data) public;\\n\\n    /**\\n     * @notice Called by the delegator on a delegate to forfeit its responsibility\\n     */\\n    function _resignImplementation() public;\\n}\\n\",\"keccak256\":\"0x926a8acc520caa0c669ced4189206910e808632f388f959b647ec94d425ed846\"},\"contracts/CarefulMath.sol\":{\"content\":\"pragma solidity ^0.5.16;\\n\\n/**\\n  * @title Careful Math\\n  * @author tropykus\\n  * @notice Derived from OpenZeppelin's SafeMath library\\n  *         https://github.com/OpenZeppelin/openzeppelin-solidity/blob/master/contracts/math/SafeMath.sol\\n  */\\ncontract CarefulMath {\\n\\n    /**\\n     * @dev Possible error codes that we can return\\n     */\\n    enum MathError {\\n        NO_ERROR,\\n        DIVISION_BY_ZERO,\\n        INTEGER_OVERFLOW,\\n        INTEGER_UNDERFLOW\\n    }\\n\\n    /**\\n    * @dev Multiplies two numbers, returns an error on overflow.\\n    */\\n    function mulUInt(uint a, uint b) internal pure returns (MathError, uint) {\\n        if (a == 0) {\\n            return (MathError.NO_ERROR, 0);\\n        }\\n\\n        uint c = a * b;\\n\\n        if (c / a != b) {\\n            return (MathError.INTEGER_OVERFLOW, 0);\\n        } else {\\n            return (MathError.NO_ERROR, c);\\n        }\\n    }\\n\\n    /**\\n    * @dev Integer division of two numbers, truncating the quotient.\\n    */\\n    function divUInt(uint a, uint b) internal pure returns (MathError, uint) {\\n        if (b == 0) {\\n            return (MathError.DIVISION_BY_ZERO, 0);\\n        }\\n\\n        return (MathError.NO_ERROR, a / b);\\n    }\\n\\n    /**\\n    * @dev Subtracts two numbers, returns an error on overflow (i.e. if subtrahend is greater than minuend).\\n    */\\n    function subUInt(uint a, uint b) internal pure returns (MathError, uint) {\\n        if (b <= a) {\\n            return (MathError.NO_ERROR, a - b);\\n        } else {\\n            return (MathError.INTEGER_UNDERFLOW, 0);\\n        }\\n    }\\n\\n    /**\\n    * @dev Adds two numbers, returns an error on overflow.\\n    */\\n    function addUInt(uint a, uint b) internal pure returns (MathError, uint) {\\n        uint c = a + b;\\n\\n        if (c >= a) {\\n            return (MathError.NO_ERROR, c);\\n        } else {\\n            return (MathError.INTEGER_OVERFLOW, 0);\\n        }\\n    }\\n\\n    /**\\n    * @dev add a and b and then subtract c\\n    */\\n    function addThenSubUInt(uint a, uint b, uint c) internal pure returns (MathError, uint) {\\n        (MathError err0, uint sum) = addUInt(a, b);\\n\\n        if (err0 != MathError.NO_ERROR) {\\n            return (err0, 0);\\n        }\\n\\n        return subUInt(sum, c);\\n    }\\n}\\n\",\"keccak256\":\"0x72abe3183019b02e47fd83709e43708a501c6333f956d6d5b0ef26b0b820f41f\"},\"contracts/ComptrollerInterface.sol\":{\"content\":\"pragma solidity ^0.5.16;\\n\\ncontract ComptrollerInterface {\\n    /// @notice Indicator that this is a Comptroller contract (for inspection)\\n    bool public constant isComptroller = true;\\n\\n    /*** Assets You Are In ***/\\n\\n    function enterMarkets(address[] calldata cTokens) external returns (uint[] memory);\\n    function exitMarket(address cToken) external returns (uint);\\n\\n    /*** Policy Hooks ***/\\n\\n    function mintAllowed(address cToken, address minter, uint mintAmount) external returns (uint);\\n    function mintVerify(address cToken, address minter, uint mintAmount, uint mintTokens) external;\\n\\n    function redeemAllowed(address cToken, address redeemer, uint redeemTokens) external returns (uint);\\n    function redeemVerify(address cToken, address redeemer, uint redeemAmount, uint redeemTokens) external;\\n\\n    function borrowAllowed(address cToken, address borrower, uint borrowAmount) external returns (uint);\\n    function borrowVerify(address cToken, address borrower, uint borrowAmount) external;\\n\\n    function repayBorrowAllowed(\\n        address cToken,\\n        address payer,\\n        address borrower,\\n        uint repayAmount) external returns (uint);\\n    function repayBorrowVerify(\\n        address cToken,\\n        address payer,\\n        address borrower,\\n        uint repayAmount,\\n        uint borrowerIndex) external;\\n\\n    function liquidateBorrowAllowed(\\n        address cTokenBorrowed,\\n        address cTokenCollateral,\\n        address liquidator,\\n        address borrower,\\n        uint repayAmount) external returns (uint);\\n    function liquidateBorrowVerify(\\n        address cTokenBorrowed,\\n        address cTokenCollateral,\\n        address liquidator,\\n        address borrower,\\n        uint repayAmount,\\n        uint seizeTokens) external;\\n\\n    function seizeAllowed(\\n        address cTokenCollateral,\\n        address cTokenBorrowed,\\n        address liquidator,\\n        address borrower,\\n        uint seizeTokens) external returns (uint);\\n    function seizeVerify(\\n        address cTokenCollateral,\\n        address cTokenBorrowed,\\n        address liquidator,\\n        address borrower,\\n        uint seizeTokens) external;\\n\\n    function transferAllowed(address cToken, address src, address dst, uint transferTokens) external returns (uint);\\n    function transferVerify(address cToken, address src, address dst, uint transferTokens) external;\\n\\n    /*** Liquidity/Liquidation Calculations ***/\\n\\n    function liquidateCalculateSeizeTokens(\\n        address cTokenBorrowed,\\n        address cTokenCollateral,\\n        uint repayAmount) external view returns (uint, uint);\\n}\\n\",\"keccak256\":\"0xede7670d2dd7b25d0187aecd2c28b7b5ca7d7c1bdac144fbedecf5d4bdd92a6b\"},\"contracts/EIP20Interface.sol\":{\"content\":\"pragma solidity ^0.5.16;\\n\\n/**\\n * @title ERC 20 Token Standard Interface\\n *  https://eips.ethereum.org/EIPS/eip-20\\n */\\ninterface EIP20Interface {\\n    function name() external view returns (string memory);\\n    function symbol() external view returns (string memory);\\n    function decimals() external view returns (uint8);\\n\\n    /**\\n      * @notice Get the total number of tokens in circulation\\n      * @return The supply of tokens\\n      */\\n    function totalSupply() external view returns (uint256);\\n\\n    /**\\n     * @notice Gets the balance of the specified address\\n     * @param owner The address from which the balance will be retrieved\\n     * @return The balance\\n     */\\n    function balanceOf(address owner) external view returns (uint256 balance);\\n\\n    /**\\n      * @notice Transfer `amount` tokens from `msg.sender` to `dst`\\n      * @param dst The address of the destination account\\n      * @param amount The number of tokens to transfer\\n      * @return Whether or not the transfer succeeded\\n      */\\n    function transfer(address dst, uint256 amount) external returns (bool success);\\n\\n    /**\\n      * @notice Transfer `amount` tokens from `src` to `dst`\\n      * @param src The address of the source account\\n      * @param dst The address of the destination account\\n      * @param amount The number of tokens to transfer\\n      * @return Whether or not the transfer succeeded\\n      */\\n    function transferFrom(address src, address dst, uint256 amount) external returns (bool success);\\n\\n    /**\\n      * @notice Approve `spender` to transfer up to `amount` from `src`\\n      * @dev This will overwrite the approval amount for `spender`\\n      *  and is subject to issues noted [here](https://eips.ethereum.org/EIPS/eip-20#approve)\\n      * @param spender The address of the account which may transfer tokens\\n      * @param amount The number of tokens that are approved (-1 means infinite)\\n      * @return Whether or not the approval succeeded\\n      */\\n    function approve(address spender, uint256 amount) external returns (bool success);\\n\\n    /**\\n      * @notice Get the current allowance from `owner` for `spender`\\n      * @param owner The address of the account which owns the tokens to be spent\\n      * @param spender The address of the account which may transfer tokens\\n      * @return The number of tokens allowed to be spent (-1 means infinite)\\n      */\\n    function allowance(address owner, address spender) external view returns (uint256 remaining);\\n\\n    event Transfer(address indexed from, address indexed to, uint256 amount);\\n    event Approval(address indexed owner, address indexed spender, uint256 amount);\\n}\\n\",\"keccak256\":\"0xfd8ed2eac6d0b4d9ee6b32628ba68bae17544b66f190a5f7ce0c6ad024579dc8\"},\"contracts/EIP20NonStandardInterface.sol\":{\"content\":\"pragma solidity ^0.5.16;\\n\\n/**\\n * @title EIP20NonStandardInterface\\n * @dev Version of ERC20 with no return values for `transfer` and `transferFrom`\\n *  See https://medium.com/coinmonks/missing-return-value-bug-at-least-130-tokens-affected-d67bf08521ca\\n */\\ninterface EIP20NonStandardInterface {\\n\\n    /**\\n     * @notice Get the total number of tokens in circulation\\n     * @return The supply of tokens\\n     */\\n    function totalSupply() external view returns (uint256);\\n\\n    /**\\n     * @notice Gets the balance of the specified address\\n     * @param owner The address from which the balance will be retrieved\\n     * @return The balance\\n     */\\n    function balanceOf(address owner) external view returns (uint256 balance);\\n\\n    ///\\n    /// !!!!!!!!!!!!!!\\n    /// !!! NOTICE !!! `transfer` does not return a value, in violation of the ERC-20 specification\\n    /// !!!!!!!!!!!!!!\\n    ///\\n\\n    /**\\n      * @notice Transfer `amount` tokens from `msg.sender` to `dst`\\n      * @param dst The address of the destination account\\n      * @param amount The number of tokens to transfer\\n      */\\n    function transfer(address dst, uint256 amount) external;\\n\\n    ///\\n    /// !!!!!!!!!!!!!!\\n    /// !!! NOTICE !!! `transferFrom` does not return a value, in violation of the ERC-20 specification\\n    /// !!!!!!!!!!!!!!\\n    ///\\n\\n    /**\\n      * @notice Transfer `amount` tokens from `src` to `dst`\\n      * @param src The address of the source account\\n      * @param dst The address of the destination account\\n      * @param amount The number of tokens to transfer\\n      */\\n    function transferFrom(address src, address dst, uint256 amount) external;\\n\\n    /**\\n      * @notice Approve `spender` to transfer up to `amount` from `src`\\n      * @dev This will overwrite the approval amount for `spender`\\n      *  and is subject to issues noted [here](https://eips.ethereum.org/EIPS/eip-20#approve)\\n      * @param spender The address of the account which may transfer tokens\\n      * @param amount The number of tokens that are approved\\n      * @return Whether or not the approval succeeded\\n      */\\n    function approve(address spender, uint256 amount) external returns (bool success);\\n\\n    /**\\n      * @notice Get the current allowance from `owner` for `spender`\\n      * @param owner The address of the account which owns the tokens to be spent\\n      * @param spender The address of the account which may transfer tokens\\n      * @return The number of tokens allowed to be spent\\n      */\\n    function allowance(address owner, address spender) external view returns (uint256 remaining);\\n\\n    event Transfer(address indexed from, address indexed to, uint256 amount);\\n    event Approval(address indexed owner, address indexed spender, uint256 amount);\\n}\\n\",\"keccak256\":\"0x9719f12e4b80b51147ac195553a198cf8b0c516e7e4d04fc324a23ed15cbafb2\"},\"contracts/ErrorReporter.sol\":{\"content\":\"pragma solidity ^0.5.16;\\n\\ncontract ComptrollerErrorReporter {\\n    enum Error {\\n        NO_ERROR,\\n        UNAUTHORIZED,\\n        COMPTROLLER_MISMATCH,\\n        INSUFFICIENT_SHORTFALL,\\n        INSUFFICIENT_LIQUIDITY,\\n        INVALID_CLOSE_FACTOR,\\n        INVALID_COLLATERAL_FACTOR,\\n        INVALID_LIQUIDATION_INCENTIVE,\\n        MARKET_NOT_ENTERED, // no longer possible\\n        MARKET_NOT_LISTED,\\n        MARKET_ALREADY_LISTED,\\n        MATH_ERROR,\\n        NONZERO_BORROW_BALANCE,\\n        PRICE_ERROR,\\n        REJECTION,\\n        SNAPSHOT_ERROR,\\n        TOO_MANY_ASSETS,\\n        TOO_MUCH_REPAY\\n    }\\n\\n    enum FailureInfo {\\n        ACCEPT_ADMIN_PENDING_ADMIN_CHECK,\\n        ACCEPT_PENDING_IMPLEMENTATION_ADDRESS_CHECK,\\n        EXIT_MARKET_BALANCE_OWED,\\n        EXIT_MARKET_REJECTION,\\n        SET_CLOSE_FACTOR_OWNER_CHECK,\\n        SET_CLOSE_FACTOR_VALIDATION,\\n        SET_COLLATERAL_FACTOR_OWNER_CHECK,\\n        SET_COLLATERAL_FACTOR_NO_EXISTS,\\n        SET_COLLATERAL_FACTOR_VALIDATION,\\n        SET_COLLATERAL_FACTOR_WITHOUT_PRICE,\\n        SET_IMPLEMENTATION_OWNER_CHECK,\\n        SET_LIQUIDATION_INCENTIVE_OWNER_CHECK,\\n        SET_LIQUIDATION_INCENTIVE_VALIDATION,\\n        SET_MAX_ASSETS_OWNER_CHECK,\\n        SET_PENDING_ADMIN_OWNER_CHECK,\\n        SET_PENDING_IMPLEMENTATION_OWNER_CHECK,\\n        SET_PRICE_ORACLE_OWNER_CHECK,\\n        SUPPORT_MARKET_EXISTS,\\n        SUPPORT_MARKET_OWNER_CHECK,\\n        SET_PAUSE_GUARDIAN_OWNER_CHECK\\n    }\\n\\n    /**\\n      * @dev `error` corresponds to enum Error; `info` corresponds to enum FailureInfo, and `detail` is an arbitrary\\n      * contract-specific code that enables us to report opaque error codes from upgradeable contracts.\\n      **/\\n    event Failure(uint error, uint info, uint detail);\\n\\n    /**\\n      * @dev use this when reporting a known error from the money market or a non-upgradeable collaborator\\n      */\\n    function fail(Error err, FailureInfo info) internal returns (uint) {\\n        emit Failure(uint(err), uint(info), 0);\\n\\n        return uint(err);\\n    }\\n\\n    /**\\n      * @dev use this when reporting an opaque error from an upgradeable collaborator contract\\n      */\\n    function failOpaque(Error err, FailureInfo info, uint opaqueError) internal returns (uint) {\\n        emit Failure(uint(err), uint(info), opaqueError);\\n\\n        return uint(err);\\n    }\\n}\\n\\ncontract TokenErrorReporter {\\n    enum Error {\\n        NO_ERROR,\\n        UNAUTHORIZED,\\n        BAD_INPUT,\\n        COMPTROLLER_REJECTION,\\n        COMPTROLLER_CALCULATION_ERROR,\\n        INTEREST_RATE_MODEL_ERROR,\\n        INVALID_ACCOUNT_PAIR,\\n        INVALID_CLOSE_AMOUNT_REQUESTED,\\n        INVALID_COLLATERAL_FACTOR,\\n        MATH_ERROR,\\n        MARKET_NOT_FRESH,\\n        MARKET_NOT_LISTED,\\n        TOKEN_INSUFFICIENT_ALLOWANCE,\\n        TOKEN_INSUFFICIENT_BALANCE,\\n        TOKEN_INSUFFICIENT_CASH,\\n        TOKEN_TRANSFER_IN_FAILED,\\n        TOKEN_TRANSFER_OUT_FAILED\\n    }\\n\\n    /*\\n     * Note: FailureInfo (but not Error) is kept in alphabetical order\\n     *       This is because FailureInfo grows significantly faster, and\\n     *       the order of Error has some meaning, while the order of FailureInfo\\n     *       is entirely arbitrary.\\n     */\\n    enum FailureInfo {\\n        ACCEPT_ADMIN_PENDING_ADMIN_CHECK,\\n        ACCRUE_INTEREST_ACCUMULATED_INTEREST_CALCULATION_FAILED,\\n        ACCRUE_INTEREST_BORROW_RATE_CALCULATION_FAILED,\\n        ACCRUE_INTEREST_NEW_BORROW_INDEX_CALCULATION_FAILED,\\n        ACCRUE_INTEREST_NEW_TOTAL_BORROWS_CALCULATION_FAILED,\\n        ACCRUE_INTEREST_NEW_TOTAL_RESERVES_CALCULATION_FAILED,\\n        ACCRUE_INTEREST_SIMPLE_INTEREST_FACTOR_CALCULATION_FAILED,\\n        BORROW_ACCUMULATED_BALANCE_CALCULATION_FAILED,\\n        BORROW_ACCRUE_INTEREST_FAILED,\\n        BORROW_CASH_NOT_AVAILABLE,\\n        BORROW_FRESHNESS_CHECK,\\n        BORROW_NEW_TOTAL_BALANCE_CALCULATION_FAILED,\\n        BORROW_NEW_ACCOUNT_BORROW_BALANCE_CALCULATION_FAILED,\\n        BORROW_MARKET_NOT_LISTED,\\n        BORROW_COMPTROLLER_REJECTION,\\n        LIQUIDATE_ACCRUE_BORROW_INTEREST_FAILED,\\n        LIQUIDATE_ACCRUE_COLLATERAL_INTEREST_FAILED,\\n        LIQUIDATE_COLLATERAL_FRESHNESS_CHECK,\\n        LIQUIDATE_COMPTROLLER_REJECTION,\\n        LIQUIDATE_COMPTROLLER_CALCULATE_AMOUNT_SEIZE_FAILED,\\n        LIQUIDATE_CLOSE_AMOUNT_IS_UINT_MAX,\\n        LIQUIDATE_CLOSE_AMOUNT_IS_ZERO,\\n        LIQUIDATE_FRESHNESS_CHECK,\\n        LIQUIDATE_LIQUIDATOR_IS_BORROWER,\\n        LIQUIDATE_REPAY_BORROW_FRESH_FAILED,\\n        LIQUIDATE_SEIZE_BALANCE_INCREMENT_FAILED,\\n        LIQUIDATE_SEIZE_BALANCE_DECREMENT_FAILED,\\n        LIQUIDATE_SEIZE_COMPTROLLER_REJECTION,\\n        LIQUIDATE_SEIZE_LIQUIDATOR_IS_BORROWER,\\n        LIQUIDATE_SEIZE_TOO_MUCH,\\n        MINT_ACCRUE_INTEREST_FAILED,\\n        MINT_COMPTROLLER_REJECTION,\\n        MINT_EXCHANGE_CALCULATION_FAILED,\\n        MINT_EXCHANGE_RATE_READ_FAILED,\\n        MINT_FRESHNESS_CHECK,\\n        MINT_NEW_ACCOUNT_BALANCE_CALCULATION_FAILED,\\n        MINT_NEW_TOTAL_SUPPLY_CALCULATION_FAILED,\\n        MINT_TRANSFER_IN_FAILED,\\n        MINT_TRANSFER_IN_NOT_POSSIBLE,\\n        REDEEM_ACCRUE_INTEREST_FAILED,\\n        REDEEM_COMPTROLLER_REJECTION,\\n        REDEEM_EXCHANGE_TOKENS_CALCULATION_FAILED,\\n        REDEEM_EXCHANGE_AMOUNT_CALCULATION_FAILED,\\n        REDEEM_EXCHANGE_RATE_READ_FAILED,\\n        REDEEM_FRESHNESS_CHECK,\\n        REDEEM_NEW_ACCOUNT_BALANCE_CALCULATION_FAILED,\\n        REDEEM_NEW_TOTAL_SUPPLY_CALCULATION_FAILED,\\n        REDEEM_TRANSFER_OUT_NOT_POSSIBLE,\\n        REDUCE_RESERVES_ACCRUE_INTEREST_FAILED,\\n        REDUCE_RESERVES_ADMIN_CHECK,\\n        REDUCE_RESERVES_CASH_NOT_AVAILABLE,\\n        REDUCE_RESERVES_FRESH_CHECK,\\n        REDUCE_RESERVES_VALIDATION,\\n        REPAY_BEHALF_ACCRUE_INTEREST_FAILED,\\n        REPAY_BORROW_ACCRUE_INTEREST_FAILED,\\n        REPAY_BORROW_ACCUMULATED_BALANCE_CALCULATION_FAILED,\\n        REPAY_BORROW_COMPTROLLER_REJECTION,\\n        REPAY_BORROW_FRESHNESS_CHECK,\\n        REPAY_BORROW_NEW_ACCOUNT_BORROW_BALANCE_CALCULATION_FAILED,\\n        REPAY_BORROW_NEW_TOTAL_BALANCE_CALCULATION_FAILED,\\n        REPAY_BORROW_TRANSFER_IN_NOT_POSSIBLE,\\n        SET_COLLATERAL_FACTOR_OWNER_CHECK,\\n        SET_COLLATERAL_FACTOR_VALIDATION,\\n        SET_COMPTROLLER_OWNER_CHECK,\\n        SET_INTEREST_RATE_MODEL_ACCRUE_INTEREST_FAILED,\\n        SET_INTEREST_RATE_MODEL_FRESH_CHECK,\\n        SET_INTEREST_RATE_MODEL_OWNER_CHECK,\\n        SET_MAX_ASSETS_OWNER_CHECK,\\n        SET_ORACLE_MARKET_NOT_LISTED,\\n        SET_PENDING_ADMIN_OWNER_CHECK,\\n        SET_RESERVE_FACTOR_ACCRUE_INTEREST_FAILED,\\n        SET_RESERVE_FACTOR_ADMIN_CHECK,\\n        SET_RESERVE_FACTOR_FRESH_CHECK,\\n        SET_RESERVE_FACTOR_BOUNDS_CHECK,\\n        TRANSFER_COMPTROLLER_REJECTION,\\n        TRANSFER_NOT_ALLOWED,\\n        TRANSFER_NOT_ENOUGH,\\n        TRANSFER_TOO_MUCH,\\n        ADD_RESERVES_ACCRUE_INTEREST_FAILED,\\n        ADD_RESERVES_FRESH_CHECK,\\n        ADD_RESERVES_TRANSFER_IN_NOT_POSSIBLE,\\n        ADD_SUBSIDY_FUND_FAILED,\\n        ADD_SUBSIDY_FUND_FRESH_CHECK\\n    }\\n\\n    /**\\n      * @dev `error` corresponds to enum Error; `info` corresponds to enum FailureInfo, and `detail` is an arbitrary\\n      * contract-specific code that enables us to report opaque error codes from upgradeable contracts.\\n      **/\\n    event Failure(uint error, uint info, uint detail);\\n\\n    /**\\n      * @dev use this when reporting a known error from the money market or a non-upgradeable collaborator\\n      */\\n    function fail(Error err, FailureInfo info) internal returns (uint) {\\n        emit Failure(uint(err), uint(info), 0);\\n\\n        return uint(err);\\n    }\\n\\n    /**\\n      * @dev use this when reporting an opaque error from an upgradeable collaborator contract\\n      */\\n    function failOpaque(Error err, FailureInfo info, uint opaqueError) internal returns (uint) {\\n        emit Failure(uint(err), uint(info), opaqueError);\\n\\n        return uint(err);\\n    }\\n}\",\"keccak256\":\"0x7d48151d141aed1ebab77e8c1cca9ada0702ca43f743851029a8b862582bee8f\"},\"contracts/Exponential.sol\":{\"content\":\"pragma solidity ^0.5.16;\\n\\nimport \\\"./CarefulMath.sol\\\";\\nimport \\\"./ExponentialNoError.sol\\\";\\n\\n/**\\n * @title Exponential module for storing fixed-precision decimals\\n * @author tropykus\\n * @dev Legacy contract for compatibility reasons with existing contracts that still use MathError\\n * @notice Exp is a struct which stores decimals with a fixed precision of 18 decimal places.\\n *         Thus, if we wanted to store the 5.1, mantissa would store 5.1e18. That is:\\n *         `Exp({mantissa: 5100000000000000000})`.\\n */\\ncontract Exponential is CarefulMath, ExponentialNoError {\\n    /**\\n     * @dev Creates an exponential from numerator and denominator values.\\n     *      Note: Returns an error if (`num` * 10e18) > MAX_INT,\\n     *            or if `denom` is zero.\\n     */\\n    function getExp(uint num, uint denom) internal pure  returns (MathError, Exp memory) {\\n        (MathError err0, uint scaledNumerator) = mulUInt(num, expScale);\\n        if (err0 != MathError.NO_ERROR) {\\n            return (err0, Exp({mantissa: 0}));\\n        }\\n\\n        (MathError err1, uint rational) = divUInt(scaledNumerator, denom);\\n        if (err1 != MathError.NO_ERROR) {\\n            return (err1, Exp({mantissa: 0}));\\n        }\\n\\n        return (MathError.NO_ERROR, Exp({mantissa: rational}));\\n    }\\n\\n    /**\\n     * @dev Adds two exponentials, returning a new exponential.\\n     */\\n    function addExp(Exp memory a, Exp memory b) internal pure returns (MathError, Exp memory) {\\n        (MathError error, uint result) = addUInt(a.mantissa, b.mantissa);\\n\\n        return (error, Exp({mantissa: result}));\\n    }\\n\\n    /**\\n     * @dev Subtracts two exponentials, returning a new exponential.\\n     */\\n    function subExp(Exp memory a, Exp memory b) internal pure returns (MathError, Exp memory) {\\n        (MathError error, uint result) = subUInt(a.mantissa, b.mantissa);\\n\\n        return (error, Exp({mantissa: result}));\\n    }\\n\\n    /**\\n     * @dev Multiply an Exp by a scalar, returning a new Exp.\\n     */\\n    function mulScalar(Exp memory a, uint scalar) internal pure returns (MathError, Exp memory) {\\n        (MathError err0, uint scaledMantissa) = mulUInt(a.mantissa, scalar);\\n        if (err0 != MathError.NO_ERROR) {\\n            return (err0, Exp({mantissa: 0}));\\n        }\\n\\n        return (MathError.NO_ERROR, Exp({mantissa: scaledMantissa}));\\n    }\\n\\n    /**\\n     * @dev Multiply an Exp by a scalar, then truncate to return an unsigned integer.\\n     */\\n    function mulScalarTruncate(Exp memory a, uint scalar) internal pure returns (MathError, uint) {\\n        (MathError err, Exp memory product) = mulScalar(a, scalar);\\n        if (err != MathError.NO_ERROR) {\\n            return (err, 0);\\n        }\\n\\n        return (MathError.NO_ERROR, truncate(product));\\n    }\\n\\n    /**\\n     * @dev Multiply an Exp by a scalar, truncate, then add an to an unsigned integer, returning an unsigned integer.\\n     */\\n    function mulScalarTruncateAddUInt(Exp memory a, uint scalar, uint addend) internal pure returns (MathError, uint) {\\n        (MathError err, Exp memory product) = mulScalar(a, scalar);\\n        if (err != MathError.NO_ERROR) {\\n            return (err, 0);\\n        }\\n\\n        return addUInt(truncate(product), addend);\\n    }\\n\\n    /**\\n     * @dev Divide an Exp by a scalar, returning a new Exp.\\n     */\\n    function divScalar(Exp memory a, uint scalar) internal pure returns (MathError, Exp memory) {\\n        (MathError err0, uint descaledMantissa) = divUInt(a.mantissa, scalar);\\n        if (err0 != MathError.NO_ERROR) {\\n            return (err0, Exp({mantissa: 0}));\\n        }\\n\\n        return (MathError.NO_ERROR, Exp({mantissa: descaledMantissa}));\\n    }\\n\\n    /**\\n     * @dev Divide a scalar by an Exp, returning a new Exp.\\n     */\\n    function divScalarByExp(uint scalar, Exp memory divisor) internal pure returns (MathError, Exp memory) {\\n        /*\\n          We are doing this as:\\n          getExp(mulUInt(expScale, scalar), divisor.mantissa)\\n\\n          How it works:\\n          Exp = a / b;\\n          Scalar = s;\\n          `s / (a / b)` = `b * s / a` and since for an Exp `a = mantissa, b = expScale`\\n        */\\n        (MathError err0, uint numerator) = mulUInt(expScale, scalar);\\n        if (err0 != MathError.NO_ERROR) {\\n            return (err0, Exp({mantissa: 0}));\\n        }\\n        return getExp(numerator, divisor.mantissa);\\n    }\\n\\n    /**\\n     * @dev Divide a scalar by an Exp, then truncate to return an unsigned integer.\\n     */\\n    function divScalarByExpTruncate(uint scalar, Exp memory divisor) internal pure returns (MathError, uint) {\\n        (MathError err, Exp memory fraction) = divScalarByExp(scalar, divisor);\\n        if (err != MathError.NO_ERROR) {\\n            return (err, 0);\\n        }\\n\\n        return (MathError.NO_ERROR, truncate(fraction));\\n    }\\n\\n    /**\\n     * @dev Multiplies two exponentials, returning a new exponential.\\n     */\\n    function mulExp(Exp memory a, Exp memory b) internal pure returns (MathError, Exp memory) {\\n\\n        (MathError err0, uint doubleScaledProduct) = mulUInt(a.mantissa, b.mantissa);\\n        if (err0 != MathError.NO_ERROR) {\\n            return (err0, Exp({mantissa: 0}));\\n        }\\n\\n        // We add half the scale before dividing so that we get rounding instead of truncation.\\n        //  See \\\"Listing 6\\\" and text above it at https://accu.org/index.php/journals/1717\\n        // Without this change, a result like 6.6...e-19 will be truncated to 0 instead of being rounded to 1e-18.\\n        (MathError err1, uint doubleScaledProductWithHalfScale) = addUInt(halfExpScale, doubleScaledProduct);\\n        if (err1 != MathError.NO_ERROR) {\\n            return (err1, Exp({mantissa: 0}));\\n        }\\n\\n        (MathError err2, uint product) = divUInt(doubleScaledProductWithHalfScale, expScale);\\n        // The only error `div` can return is MathError.DIVISION_BY_ZERO but we control `expScale` and it is not zero.\\n        assert(err2 == MathError.NO_ERROR);\\n\\n        return (MathError.NO_ERROR, Exp({mantissa: product}));\\n    }\\n\\n    /**\\n     * @dev Multiplies two exponentials given their mantissas, returning a new exponential.\\n     */\\n    function mulExp(uint a, uint b) internal pure returns (MathError, Exp memory) {\\n        return mulExp(Exp({mantissa: a}), Exp({mantissa: b}));\\n    }\\n\\n    /**\\n     * @dev Multiplies three exponentials, returning a new exponential.\\n     */\\n    function mulExp3(Exp memory a, Exp memory b, Exp memory c) internal pure returns (MathError, Exp memory) {\\n        (MathError err, Exp memory ab) = mulExp(a, b);\\n        if (err != MathError.NO_ERROR) {\\n            return (err, ab);\\n        }\\n        return mulExp(ab, c);\\n    }\\n\\n    /**\\n     * @dev Divides two exponentials, returning a new exponential.\\n     *     (a/scale) / (b/scale) = (a/scale) * (scale/b) = a/b,\\n     *  which we can scale as an Exp by calling getExp(a.mantissa, b.mantissa)\\n     */\\n    function divExp(Exp memory a, Exp memory b) internal pure returns (MathError, Exp memory) {\\n        return getExp(a.mantissa, b.mantissa);\\n    }\\n}\\n\",\"keccak256\":\"0xc8cbd4ab3dab06985f45d7cc7717462120052e51bc01cfdf70ec4383bdedb6a5\"},\"contracts/ExponentialNoError.sol\":{\"content\":\"pragma solidity ^0.5.16;\\n\\n/**\\n * @title Exponential module for storing fixed-precision decimals\\n * @author tropykus\\n * @notice Exp is a struct which stores decimals with a fixed precision of 18 decimal places.\\n *         Thus, if we wanted to store the 5.1, mantissa would store 5.1e18. That is:\\n *         `Exp({mantissa: 5100000000000000000})`.\\n */\\ncontract ExponentialNoError {\\n    uint constant expScale = 1e18;\\n    uint constant doubleScale = 1e36;\\n    uint constant halfExpScale = expScale/2;\\n    uint constant mantissaOne = expScale;\\n\\n    struct Exp {\\n        uint mantissa;\\n    }\\n\\n    struct Double {\\n        uint mantissa;\\n    }\\n\\n    /**\\n     * @dev Truncates the given exp to a whole number value.\\n     *      For example, truncate(Exp{mantissa: 15 * expScale}) = 15\\n     */\\n    function truncate(Exp memory exp) pure internal returns (uint) {\\n        // Note: We are not using careful math here as we're performing a division that cannot fail\\n        return exp.mantissa / expScale;\\n    }\\n\\n    /**\\n     * @dev Multiply an Exp by a scalar, then truncate to return an unsigned integer.\\n     */\\n    function mul_ScalarTruncate(Exp memory a, uint scalar) pure internal returns (uint) {\\n        Exp memory product = mul_(a, scalar);\\n        return truncate(product);\\n    }\\n\\n    /**\\n     * @dev Multiply an Exp by a scalar, truncate, then add an to an unsigned integer, returning an unsigned integer.\\n     */\\n    function mul_ScalarTruncateAddUInt(Exp memory a, uint scalar, uint addend) pure internal returns (uint) {\\n        Exp memory product = mul_(a, scalar);\\n        return add_(truncate(product), addend);\\n    }\\n\\n    /**\\n     * @dev Checks if first Exp is less than second Exp.\\n     */\\n    function lessThanExp(Exp memory left, Exp memory right) pure internal returns (bool) {\\n        return left.mantissa < right.mantissa;\\n    }\\n\\n    /**\\n     * @dev Checks if left Exp <= right Exp.\\n     */\\n    function lessThanOrEqualExp(Exp memory left, Exp memory right) pure internal returns (bool) {\\n        return left.mantissa <= right.mantissa;\\n    }\\n\\n    /**\\n     * @dev Checks if left Exp > right Exp.\\n     */\\n    function greaterThanExp(Exp memory left, Exp memory right) pure internal returns (bool) {\\n        return left.mantissa > right.mantissa;\\n    }\\n\\n    /**\\n     * @dev returns true if Exp is exactly zero\\n     */\\n    function isZeroExp(Exp memory value) pure internal returns (bool) {\\n        return value.mantissa == 0;\\n    }\\n\\n    function safe224(uint n, string memory errorMessage) pure internal returns (uint224) {\\n        require(n < 2**224, errorMessage);\\n        return uint224(n);\\n    }\\n\\n    function safe32(uint n, string memory errorMessage) pure internal returns (uint32) {\\n        require(n < 2**32, errorMessage);\\n        return uint32(n);\\n    }\\n\\n    function add_(Exp memory a, Exp memory b) pure internal returns (Exp memory) {\\n        return Exp({mantissa: add_(a.mantissa, b.mantissa)});\\n    }\\n\\n    function add_(Double memory a, Double memory b) pure internal returns (Double memory) {\\n        return Double({mantissa: add_(a.mantissa, b.mantissa)});\\n    }\\n\\n    function add_(uint a, uint b) pure internal returns (uint) {\\n        return add_(a, b, \\\"addition overflow\\\");\\n    }\\n\\n    function add_(uint a, uint b, string memory errorMessage) pure internal returns (uint) {\\n        uint c = a + b;\\n        require(c >= a, errorMessage);\\n        return c;\\n    }\\n\\n    function sub_(Exp memory a, Exp memory b) pure internal returns (Exp memory) {\\n        return Exp({mantissa: sub_(a.mantissa, b.mantissa)});\\n    }\\n\\n    function sub_(Double memory a, Double memory b) pure internal returns (Double memory) {\\n        return Double({mantissa: sub_(a.mantissa, b.mantissa)});\\n    }\\n\\n    function sub_(uint a, uint b) pure internal returns (uint) {\\n        return sub_(a, b, \\\"subtraction underflow\\\");\\n    }\\n\\n    function sub_(uint a, uint b, string memory errorMessage) pure internal returns (uint) {\\n        require(b <= a, errorMessage);\\n        return a - b;\\n    }\\n\\n    function mul_(Exp memory a, Exp memory b) pure internal returns (Exp memory) {\\n        return Exp({mantissa: mul_(a.mantissa, b.mantissa) / expScale});\\n    }\\n\\n    function mul_(Exp memory a, uint b) pure internal returns (Exp memory) {\\n        return Exp({mantissa: mul_(a.mantissa, b)});\\n    }\\n\\n    function mul_(uint a, Exp memory b) pure internal returns (uint) {\\n        return mul_(a, b.mantissa) / expScale;\\n    }\\n\\n    function mul_(Double memory a, Double memory b) pure internal returns (Double memory) {\\n        return Double({mantissa: mul_(a.mantissa, b.mantissa) / doubleScale});\\n    }\\n\\n    function mul_(Double memory a, uint b) pure internal returns (Double memory) {\\n        return Double({mantissa: mul_(a.mantissa, b)});\\n    }\\n\\n    function mul_(uint a, Double memory b) pure internal returns (uint) {\\n        return mul_(a, b.mantissa) / doubleScale;\\n    }\\n\\n    function mul_(uint a, uint b) pure internal returns (uint) {\\n        return mul_(a, b, \\\"multiplication overflow\\\");\\n    }\\n\\n    function mul_(uint a, uint b, string memory errorMessage) pure internal returns (uint) {\\n        if (a == 0 || b == 0) {\\n            return 0;\\n        }\\n        uint c = a * b;\\n        require(c / a == b, errorMessage);\\n        return c;\\n    }\\n\\n    function div_(Exp memory a, Exp memory b) pure internal returns (Exp memory) {\\n        return Exp({mantissa: div_(mul_(a.mantissa, expScale), b.mantissa)});\\n    }\\n\\n    function div_(Exp memory a, uint b) pure internal returns (Exp memory) {\\n        return Exp({mantissa: div_(a.mantissa, b)});\\n    }\\n\\n    function div_(uint a, Exp memory b) pure internal returns (uint) {\\n        return div_(mul_(a, expScale), b.mantissa);\\n    }\\n\\n    function div_(Double memory a, Double memory b) pure internal returns (Double memory) {\\n        return Double({mantissa: div_(mul_(a.mantissa, doubleScale), b.mantissa)});\\n    }\\n\\n    function div_(Double memory a, uint b) pure internal returns (Double memory) {\\n        return Double({mantissa: div_(a.mantissa, b)});\\n    }\\n\\n    function div_(uint a, Double memory b) pure internal returns (uint) {\\n        return div_(mul_(a, doubleScale), b.mantissa);\\n    }\\n\\n    function div_(uint a, uint b) pure internal returns (uint) {\\n        return div_(a, b, \\\"divide by zero\\\");\\n    }\\n\\n    function div_(uint a, uint b, string memory errorMessage) pure internal returns (uint) {\\n        require(b > 0, errorMessage);\\n        return a / b;\\n    }\\n\\n    function fraction(uint a, uint b) pure internal returns (Double memory) {\\n        return Double({mantissa: div_(mul_(a, doubleScale), b)});\\n    }\\n}\\n\",\"keccak256\":\"0xfcc6f830a2e11cffb4298a2a00bccf1abc1173f3a773db0d79f5c200918fa01b\"},\"contracts/InterestRateModel.sol\":{\"content\":\"pragma solidity ^0.5.16;\\n\\nimport \\\"./Exponential.sol\\\";\\nimport \\\"./SafeMath.sol\\\";\\n\\n/**\\n * @title tropykus InterestRateModel Interface\\n * @author tropykus\\n */\\ncontract InterestRateModel is Exponential {\\n    using SafeMath for uint256;\\n\\n    /// @notice Indicator that this is an InterestRateModel contract (for inspection)\\n    bool public constant isInterestRateModel = true;\\n\\n    bool public constant isTropykusInterestRateModel = false;\\n\\n    /**\\n     * @notice The approximate number of blocks per year that is assumed by the interest rate model\\n     */\\n    uint256 public constant blocksPerYear = 1051200;\\n\\n    /**\\n     * @notice Calculates the utilization rate of the market: `borrows / (cash + borrows - reserves)`\\n     * @param cash The amount of cash in the market\\n     * @param borrows The amount of borrows in the market\\n     * @param reserves The amount of reserves in the market (currently unused)\\n     * @return The utilization rate as a mantissa between [0, 1e18]\\n     */\\n    function utilizationRate(\\n        uint256 cash,\\n        uint256 borrows,\\n        uint256 reserves\\n    ) public pure returns (uint256) {\\n        // Utilization rate is 0 when there are no borrows\\n        if (borrows == 0) {\\n            return 0;\\n        }\\n\\n        return borrows.mul(1e18).div(cash.add(borrows).sub(reserves));\\n    }\\n\\n    /**_totalCash\\n     * @notice Calculates the current borrow interest rate per block\\n     * @param cash The total amount of cash the market has\\n     * @param borrows The total amount of borrows the market has outstanding\\n     * @param reserves The total amnount of reserves the market has\\n     * @return The borrow rate per block (as a percentage, and scaled by 1e18)\\n     */\\n    function getBorrowRate(\\n        uint256 cash,\\n        uint256 borrows,\\n        uint256 reserves\\n    ) external view returns (uint256);\\n\\n    /**\\n     * @notice Calculates the current supply interest rate per block\\n     * @param cash The total amount of cash the market has\\n     * @param borrows The total amount of borrows the market has outstanding\\n     * @param reserves The total amnount of reserves the market has\\n     * @param reserveFactorMantissa The current reserve factor the market has\\n     * @return The supply rate per block (as a percentage, and scaled by 1e18)\\n     */\\n    function getSupplyRate(\\n        uint256 cash,\\n        uint256 borrows,\\n        uint256 reserves,\\n        uint256 reserveFactorMantissa\\n    ) external view returns (uint256);\\n\\n    function getExchangeRate(\\n        uint256 _totalCash,\\n        uint256 _totalBorrows,\\n        uint256 _totalReserves,\\n        uint256 _totalSupply\\n    ) public pure returns (MathError, uint256) {\\n        /*\\n         * exchangeRate = (totalCash + totalBorrows - totalReserves) / totalSupply\\n         */\\n        Exp memory exchangeRate;\\n        MathError mathErr;\\n        uint256 cashPlusBorrowsMinusReserves;\\n        (mathErr, cashPlusBorrowsMinusReserves) = addThenSubUInt(\\n            _totalCash,\\n            _totalBorrows,\\n            _totalReserves\\n        );\\n        if (mathErr != MathError.NO_ERROR) {\\n            return (mathErr, 0);\\n        }\\n        (mathErr, exchangeRate) = getExp(\\n            cashPlusBorrowsMinusReserves,\\n            _totalSupply\\n        );\\n        if (mathErr != MathError.NO_ERROR) {\\n            return (mathErr, 0);\\n        }\\n\\n        return (MathError.NO_ERROR, exchangeRate.mantissa);\\n    }\\n\\n    function isAboveOptimal(\\n        uint256 cash,\\n        uint256 borrows,\\n        uint256 reserves\\n    ) public view returns (bool) {\\n        cash;\\n        borrows;\\n        reserves;\\n        return false;\\n    }\\n}\\n\",\"keccak256\":\"0x4f43daa6c3b4be794ba54842d05636c17097fc46f8c8020a99b0ccaafee1e1f7\"},\"contracts/SafeMath.sol\":{\"content\":\"pragma solidity ^0.5.16;\\n\\n// From https://github.com/OpenZeppelin/openzeppelin-contracts/blob/master/contracts/math/Math.sol\\n// Subject to the MIT license.\\n\\n/**\\n * @dev Wrappers over Solidity's arithmetic operations with added overflow\\n * checks.\\n *\\n * Arithmetic operations in Solidity wrap on overflow. This can easily result\\n * in bugs, because programmers usually assume that an overflow raises an\\n * error, which is the standard behavior in high level programming languages.\\n * `SafeMath` restores this intuition by reverting the transaction when an\\n * operation overflows.\\n *\\n * Using this library instead of the unchecked operations eliminates an entire\\n * class of bugs, so it's recommended to use it always.\\n */\\nlibrary SafeMath {\\n    /**\\n     * @dev Returns the addition of two unsigned integers, reverting on overflow.\\n     *\\n     * Counterpart to Solidity's `+` operator.\\n     *\\n     * Requirements:\\n     * - Addition cannot overflow.\\n     */\\n    function add(uint256 a, uint256 b) internal pure returns (uint256) {\\n        uint256 c = a + b;\\n        require(c >= a, \\\"SafeMath: addition overflow\\\");\\n\\n        return c;\\n    }\\n\\n    /**\\n     * @dev Returns the addition of two unsigned integers, reverting with custom message on overflow.\\n     *\\n     * Counterpart to Solidity's `+` operator.\\n     *\\n     * Requirements:\\n     * - Addition cannot overflow.\\n     */\\n    function add(uint256 a, uint256 b, string memory errorMessage) internal pure returns (uint256) {\\n        uint256 c = a + b;\\n        require(c >= a, errorMessage);\\n\\n        return c;\\n    }\\n\\n    /**\\n     * @dev Returns the subtraction of two unsigned integers, reverting on underflow (when the result is negative).\\n     *\\n     * Counterpart to Solidity's `-` operator.\\n     *\\n     * Requirements:\\n     * - Subtraction cannot underflow.\\n     */\\n    function sub(uint256 a, uint256 b) internal pure returns (uint256) {\\n        return sub(a, b, \\\"SafeMath: subtraction underflow\\\");\\n    }\\n\\n    /**\\n     * @dev Returns the subtraction of two unsigned integers, reverting with custom message on underflow (when the result is negative).\\n     *\\n     * Counterpart to Solidity's `-` operator.\\n     *\\n     * Requirements:\\n     * - Subtraction cannot underflow.\\n     */\\n    function sub(uint256 a, uint256 b, string memory errorMessage) internal pure returns (uint256) {\\n        require(b <= a, errorMessage);\\n        uint256 c = a - b;\\n\\n        return c;\\n    }\\n\\n    /**\\n     * @dev Returns the multiplication of two unsigned integers, reverting on overflow.\\n     *\\n     * Counterpart to Solidity's `*` operator.\\n     *\\n     * Requirements:\\n     * - Multiplication cannot overflow.\\n     */\\n    function mul(uint256 a, uint256 b) internal pure returns (uint256) {\\n        // Gas optimization: this is cheaper than requiring 'a' not being zero, but the\\n        // benefit is lost if 'b' is also tested.\\n        // See: https://github.com/OpenZeppelin/openzeppelin-contracts/pull/522\\n        if (a == 0) {\\n            return 0;\\n        }\\n\\n        uint256 c = a * b;\\n        require(c / a == b, \\\"SafeMath: multiplication overflow\\\");\\n\\n        return c;\\n    }\\n\\n    /**\\n     * @dev Returns the multiplication of two unsigned integers, reverting on overflow.\\n     *\\n     * Counterpart to Solidity's `*` operator.\\n     *\\n     * Requirements:\\n     * - Multiplication cannot overflow.\\n     */\\n    function mul(uint256 a, uint256 b, string memory errorMessage) internal pure returns (uint256) {\\n        // Gas optimization: this is cheaper than requiring 'a' not being zero, but the\\n        // benefit is lost if 'b' is also tested.\\n        // See: https://github.com/OpenZeppelin/openzeppelin-contracts/pull/522\\n        if (a == 0) {\\n            return 0;\\n        }\\n\\n        uint256 c = a * b;\\n        require(c / a == b, errorMessage);\\n\\n        return c;\\n    }\\n\\n    /**\\n     * @dev Returns the integer division of two unsigned integers.\\n     * Reverts on division by zero. The result is rounded towards zero.\\n     *\\n     * Counterpart to Solidity's `/` operator. Note: this function uses a\\n     * `revert` opcode (which leaves remaining gas untouched) while Solidity\\n     * uses an invalid opcode to revert (consuming all remaining gas).\\n     *\\n     * Requirements:\\n     * - The divisor cannot be zero.\\n     */\\n    function div(uint256 a, uint256 b) internal pure returns (uint256) {\\n        return div(a, b, \\\"SafeMath: division by zero\\\");\\n    }\\n\\n    /**\\n     * @dev Returns the integer division of two unsigned integers.\\n     * Reverts with custom message on division by zero. The result is rounded towards zero.\\n     *\\n     * Counterpart to Solidity's `/` operator. Note: this function uses a\\n     * `revert` opcode (which leaves remaining gas untouched) while Solidity\\n     * uses an invalid opcode to revert (consuming all remaining gas).\\n     *\\n     * Requirements:\\n     * - The divisor cannot be zero.\\n     */\\n    function div(uint256 a, uint256 b, string memory errorMessage) internal pure returns (uint256) {\\n        // Solidity only automatically asserts when dividing by 0\\n        require(b > 0, errorMessage);\\n        uint256 c = a / b;\\n        // assert(a == b * c + a % b); // There is no case in which this doesn't hold\\n\\n        return c;\\n    }\\n\\n    /**\\n     * @dev Returns the remainder of dividing two unsigned integers. (unsigned integer modulo),\\n     * Reverts when dividing by zero.\\n     *\\n     * Counterpart to Solidity's `%` operator. This function uses a `revert`\\n     * opcode (which leaves remaining gas untouched) while Solidity uses an\\n     * invalid opcode to revert (consuming all remaining gas).\\n     *\\n     * Requirements:\\n     * - The divisor cannot be zero.\\n     */\\n    function mod(uint256 a, uint256 b) internal pure returns (uint256) {\\n        return mod(a, b, \\\"SafeMath: modulo by zero\\\");\\n    }\\n\\n    /**\\n     * @dev Returns the remainder of dividing two unsigned integers. (unsigned integer modulo),\\n     * Reverts with custom message when dividing by zero.\\n     *\\n     * Counterpart to Solidity's `%` operator. This function uses a `revert`\\n     * opcode (which leaves remaining gas untouched) while Solidity uses an\\n     * invalid opcode to revert (consuming all remaining gas).\\n     *\\n     * Requirements:\\n     * - The divisor cannot be zero.\\n     */\\n    function mod(uint256 a, uint256 b, string memory errorMessage) internal pure returns (uint256) {\\n        require(b != 0, errorMessage);\\n        return a % b;\\n    }\\n}\\n\",\"keccak256\":\"0x6653e37ff57a02b7b7f20199bb0fd5685756ced19a67f53328b42c9d2167ffd2\"}},\"version\":1}",
  "bytecode": "0x60806040523480156200001157600080fd5b50604051620064043803806200640483398181016040526101008110156200003857600080fd5b81516020830151604080850151606086015160808701805193519597949692959194919392820192846401000000008211156200007457600080fd5b9083019060208201858111156200008a57600080fd5b8251640100000000811182820188101715620000a557600080fd5b82525081516020918201929091019080838360005b83811015620000d4578181015183820152602001620000ba565b50505050905090810190601f168015620001025780820380516001836020036101000a031916815260200191505b50604052602001805160405193929190846401000000008211156200012657600080fd5b9083019060208201858111156200013c57600080fd5b82516401000000008111828201881017156200015757600080fd5b82525081516020918201929091019080838360005b83811015620001865781810151838201526020016200016c565b50505050905090810190601f168015620001b45780820380516001836020036101000a031916815260200191505b506040908152602082015191015160038054610100600160a81b03191633610100021790559092509050620001ef8888888888888862000223565b600380546001600160a01b0390921661010002610100600160a81b0319909216919091179055506200090d95505050505050565b6200023e868686868686620002d260201b620014301760201c565b601280546001600160a01b0319166001600160a01b038981169190911791829055604080516318160ddd60e01b8152905192909116916318160ddd91600480820192602092909190829003018186803b1580156200029b57600080fd5b505afa158015620002b0573d6000803e3d6000fd5b505050506040513d6020811015620002c757600080fd5b505050505050505050565b60035461010090046001600160a01b03163314620003225760405162461bcd60e51b81526004018080602001828103825260248152602001806200636b6024913960400191505060405180910390fd5b600954158015620003335750600a54155b620003705760405162461bcd60e51b81526004018080602001828103825260238152602001806200638f6023913960400191505060405180910390fd5b600784905583620003b35760405162461bcd60e51b8152600401808060200182810382526030815260200180620063b26030913960400191505060405180910390fd5b6000620003c9876001600160e01b03620004e816565b905080156200041f576040805162461bcd60e51b815260206004820152601a60248201527f73657474696e6720636f6d7074726f6c6c6572206661696c6564000000000000604482015290519081900360640190fd5b620004326001600160e01b036200065016565b600955670de0b6b3a7640000600a5562000455866001600160e01b036200065516565b90508015620004965760405162461bcd60e51b8152600401808060200182810382526022815260200180620063e26022913960400191505060405180910390fd5b8351620004ab9060019060208701906200086b565b508251620004c19060029060208601906200086b565b50506003805460ff90921660ff199283161790556000805490911660011790555050505050565b60035460009061010090046001600160a01b0316331462000522576200051a6001603f6001600160e01b03620007fb16565b90506200064b565b60055460408051623f1ee960e11b815290516001600160a01b0392831692851691627e3dd2916004808301926020929190829003018186803b1580156200056857600080fd5b505afa1580156200057d573d6000803e3d6000fd5b505050506040513d60208110156200059457600080fd5b5051620005e8576040805162461bcd60e51b815260206004820152601c60248201527f6d61726b6572206d6574686f642072657475726e65642066616c736500000000604482015290519081900360640190fd5b600580546001600160a01b0319166001600160a01b03858116918217909255604080519284168352602083019190915280517f7ac369dbd14fa5ea3f473ed67cc9d598964a77501540ba6751eb0b3decf5870d9281900390910190a160005b9150505b919050565b435b90565b600354600090819061010090046001600160a01b03163314620006925762000689600160426001600160e01b03620007fb16565b9150506200064b565b620006a56001600160e01b036200065016565b60095414620006c55762000689600a60416001600160e01b03620007fb16565b600660009054906101000a90046001600160a01b03169050826001600160a01b0316632191f92a6040518163ffffffff1660e01b815260040160206040518083038186803b1580156200071757600080fd5b505afa1580156200072c573d6000803e3d6000fd5b505050506040513d60208110156200074357600080fd5b505162000797576040805162461bcd60e51b815260206004820152601c60248201527f6d61726b6572206d6574686f642072657475726e65642066616c736500000000604482015290519081900360640190fd5b600680546001600160a01b0319166001600160a01b03858116918217909255604080519284168352602083019190915280517fedffc32e068c7c95dfd4bdfd5c4d939a084d6b11c4199eac8436ed234d72f9269281900390910190a1600062000647565b60007f45b96fe442630264581b197e84bbada861235052c5a1aadfff9ea4e40a969aa08360108111156200082b57fe5b8360528111156200083857fe5b604080519283526020830191909152600082820152519081900360600190a18260108111156200086457fe5b9392505050565b828054600181600116156101000203166002900490600052602060002090601f016020900481019282601f10620008ae57805160ff1916838001178555620008de565b82800160010185558215620008de579182015b82811115620008de578251825591602001919060010190620008c1565b50620008ec929150620008f0565b5090565b6200065291905b80821115620008ec5760008155600101620008f7565b615a4e806200091d6000396000f3fe608060405234801561001057600080fd5b50600436106102f15760003560e01c806373acee981161019d578063bd6d894d116100e9578063f2b3abbd116100a2578063f851a4401161007c578063f851a44014610ab4578063f8f9da2814610abc578063fca7820b14610ac4578063fe9c44ae14610ae1576102f1565b8063f2b3abbd14610a50578063f3fdb15a14610a76578063f5e3c46214610a7e576102f1565b8063bd6d894d1461098c578063c37f68e214610994578063c5ebeaec146109e0578063db006a75146109fd578063dd62ed3e14610a1a578063e9c714f214610a48576102f1565b8063a0712d6811610156578063aa5af0fd11610130578063aa5af0fd14610920578063ae9d70b014610928578063b2a02ff114610930578063b71d1a0c14610966576102f1565b8063a0712d68146108cf578063a6afed95146108ec578063a9059cbb146108f4576102f1565b806373acee9814610726578063852a12e31461072e5780638f840ddd1461074b57806395d89b411461075357806395dd91931461075b57806399d8c1b414610781576102f1565b8063267822471161025c57806347bd371811610215578063675d972c116101ef578063675d972c146106e85780636c540baf146106f05780636f307dc3146106f857806370a0823114610700576102f1565b806347bd3718146106bb5780635fe3b567146106c3578063601a0bf1146106cb576102f1565b80632678224714610608578063313ce5671461062c5780633af9e6691461064a5780633b1d21a2146106705780633e941010146106785780634576b5db14610695576102f1565b8063182df0f5116102ae578063182df0f5146104185780631a31d465146104205780631be19560146105785780631df0ba9d1461059e57806323b872dd146105a65780632608f818146105dc576102f1565b806306fdde03146102f6578063095ea7b3146103735780630e752702146103b3578063173b9904146103e257806317bfdfbc146103ea57806318160ddd14610410575b600080fd5b6102fe610ae9565b6040805160208082528351818301528351919283929083019185019080838360005b83811015610338578181015183820152602001610320565b50505050905090810190601f1680156103655780820380516001836020036101000a031916815260200191505b509250505060405180910390f35b61039f6004803603604081101561038957600080fd5b506001600160a01b038135169060200135610b76565b604080519115158252519081900360200190f35b6103d0600480360360208110156103c957600080fd5b5035610be3565b60408051918252519081900360200190f35b6103d0610bf9565b6103d06004803603602081101561040057600080fd5b50356001600160a01b0316610bff565b6103d0610cbf565b6103d0610cc5565b610576600480360360e081101561043657600080fd5b6001600160a01b03823581169260208101358216926040820135909216916060820135919081019060a081016080820135600160201b81111561047857600080fd5b82018360208201111561048a57600080fd5b803590602001918460018302840111600160201b831117156104ab57600080fd5b91908080601f0160208091040260200160405190810160405280939291908181526020018383808284376000920191909152509295949360208101935035915050600160201b8111156104fd57600080fd5b82018360208201111561050f57600080fd5b803590602001918460018302840111600160201b8311171561053057600080fd5b91908080601f0160208091040260200160405190810160405280939291908181526020018383808284376000920191909152509295505050903560ff169150610d289050565b005b6105766004803603602081101561058e57600080fd5b50356001600160a01b0316610dc7565b6103d0610f03565b61039f600480360360608110156105bc57600080fd5b506001600160a01b03813581169160208101359091169060400135610f09565b6103d0600480360360408110156105f257600080fd5b506001600160a01b038135169060200135610f7b565b610610610f91565b604080516001600160a01b039092168252519081900360200190f35b610634610fa0565b6040805160ff9092168252519081900360200190f35b6103d06004803603602081101561066057600080fd5b50356001600160a01b0316610fa9565b6103d061105f565b6103d06004803603602081101561068e57600080fd5b503561106e565b6103d0600480360360208110156106ab57600080fd5b50356001600160a01b0316611079565b6103d06111ce565b6106106111d4565b6103d0600480360360208110156106e157600080fd5b50356111e3565b6103d061127e565b6103d0611284565b61061061128a565b6103d06004803603602081101561071657600080fd5b50356001600160a01b0316611299565b6103d06112b4565b6103d06004803603602081101561074457600080fd5b503561136a565b6103d0611375565b6102fe61137b565b6103d06004803603602081101561077157600080fd5b50356001600160a01b03166113d3565b610576600480360360c081101561079757600080fd5b6001600160a01b03823581169260208101359091169160408201359190810190608081016060820135600160201b8111156107d157600080fd5b8201836020820111156107e357600080fd5b803590602001918460018302840111600160201b8311171561080457600080fd5b91908080601f0160208091040260200160405190810160405280939291908181526020018383808284376000920191909152509295949360208101935035915050600160201b81111561085657600080fd5b82018360208201111561086857600080fd5b803590602001918460018302840111600160201b8311171561088957600080fd5b91908080601f0160208091040260200160405190810160405280939291908181526020018383808284376000920191909152509295505050903560ff1691506114309050565b6103d0600480360360208110156108e557600080fd5b5035611617565b6103d0611623565b61039f6004803603604081101561090a57600080fd5b506001600160a01b038135169060200135611a32565b6103d0611aa3565b6103d0611aa9565b6103d06004803603606081101561094657600080fd5b506001600160a01b03813581169160208101359091169060400135611b48565b6103d06004803603602081101561097c57600080fd5b50356001600160a01b0316611bb9565b6103d0611c45565b6109ba600480360360208110156109aa57600080fd5b50356001600160a01b0316611d01565b604080519485526020850193909352838301919091526060830152519081900360800190f35b6103d0600480360360208110156109f657600080fd5b5035611d96565b6103d060048036036020811015610a1357600080fd5b5035611da1565b6103d060048036036040811015610a3057600080fd5b506001600160a01b0381358116916020013516611dac565b6103d0611dd7565b6103d060048036036020811015610a6657600080fd5b50356001600160a01b0316611eda565b610610611f14565b6103d060048036036060811015610a9457600080fd5b506001600160a01b03813581169160208101359160409091013516611f23565b610610611f3b565b6103d0611f4f565b6103d060048036036020811015610ada57600080fd5b5035611fb3565b61039f612031565b60018054604080516020600284861615610100026000190190941693909304601f81018490048402820184019092528181529291830182828015610b6e5780601f10610b4357610100808354040283529160200191610b6e565b820191906000526020600020905b815481529060010190602001808311610b5157829003601f168201915b505050505081565b3360008181526010602090815260408083206001600160a01b03871680855290835281842086905581518681529151939493909284927f8c5be1e5ebec7d5bd14f71427d1e84f3dd0314c0f7b2291e5b200ac8c7c3b925929081900390910190a360019150505b92915050565b600080610bef83612036565b509150505b919050565b60085481565b6000805460ff16610c44576040805162461bcd60e51b815260206004820152600a6024820152691c994b595b9d195c995960b21b604482015290519081900360640190fd5b6000805460ff19168155610c56611623565b14610ca1576040805162461bcd60e51b81526020600482015260166024820152751858d8dc9d59481a5b9d195c995cdd0819985a5b195960521b604482015290519081900360640190fd5b610caa826113d3565b90505b6000805460ff19166001179055919050565b600d5481565b6000806000610cd26120df565b90925090506000826003811115610ce557fe5b14610d215760405162461bcd60e51b81526004018080602001828103825260358152602001806159656035913960400191505060405180910390fd5b9150505b90565b610d36868686868686611430565b601280546001600160a01b0319166001600160a01b038981169190911791829055604080516318160ddd60e01b8152905192909116916318160ddd91600480820192602092909190829003018186803b158015610d9257600080fd5b505afa158015610da6573d6000803e3d6000fd5b505050506040513d6020811015610dbc57600080fd5b505050505050505050565b6012546001600160a01b0382811691161415610e145760405162461bcd60e51b81526004018080602001828103825260328152602001806157c16032913960400191505060405180910390fd5b604080516370a0823160e01b815230600482015290516000916001600160a01b038416916370a0823191602480820192602092909190829003018186803b158015610e5e57600080fd5b505afa158015610e72573d6000803e3d6000fd5b505050506040513d6020811015610e8857600080fd5b50516003546040805163a9059cbb60e01b81526101009092046001600160a01b03908116600484015260248301849052905192935084169163a9059cbb9160448082019260009290919082900301818387803b158015610ee757600080fd5b505af1158015610efb573d6000803e3d6000fd5b505050505050565b600e5481565b6000805460ff16610f4e576040805162461bcd60e51b815260206004820152600a6024820152691c994b595b9d195c995960b21b604482015290519081900360640190fd5b6000805460ff19168155610f64338686866121b2565b1490506000805460ff191660011790559392505050565b600080610f88848461243e565b50949350505050565b6004546001600160a01b031681565b60035460ff1681565b6000610fb3615621565b6040518060200160405280610fc6611c45565b90526001600160a01b0384166000908152600f6020526040812054919250908190610ff29084906124e9565b9092509050600082600381111561100557fe5b14611057576040805162461bcd60e51b815260206004820152601f60248201527f62616c616e636520636f756c64206e6f742062652063616c63756c6174656400604482015290519081900360640190fd5b949350505050565b600061106961253d565b905090565b6000610bdd826125bd565b60035460009061010090046001600160a01b031633146110a65761109f6001603f612651565b9050610bf4565b60055460408051623f1ee960e11b815290516001600160a01b0392831692851691627e3dd2916004808301926020929190829003018186803b1580156110eb57600080fd5b505afa1580156110ff573d6000803e3d6000fd5b505050506040513d602081101561111557600080fd5b5051611168576040805162461bcd60e51b815260206004820152601c60248201527f6d61726b6572206d6574686f642072657475726e65642066616c736500000000604482015290519081900360640190fd5b600580546001600160a01b0319166001600160a01b03858116918217909255604080519284168352602083019190915280517f7ac369dbd14fa5ea3f473ed67cc9d598964a77501540ba6751eb0b3decf5870d9281900390910190a160005b9392505050565b600b5481565b6005546001600160a01b031681565b6000805460ff16611228576040805162461bcd60e51b815260206004820152600a6024820152691c994b595b9d195c995960b21b604482015290519081900360640190fd5b6000805460ff1916815561123a611623565b905080156112605761125881601081111561125157fe5b6030612651565b915050610cad565b611269836126b7565b9150506000805460ff19166001179055919050565b60075481565b60095481565b6012546001600160a01b031681565b6001600160a01b03166000908152600f602052604090205490565b6000805460ff166112f9576040805162461bcd60e51b815260206004820152600a6024820152691c994b595b9d195c995960b21b604482015290519081900360640190fd5b6000805460ff1916815561130b611623565b14611356576040805162461bcd60e51b81526020600482015260166024820152751858d8dc9d59481a5b9d195c995cdd0819985a5b195960521b604482015290519081900360640190fd5b50600b546000805460ff1916600117905590565b6000610bdd826127ea565b600c5481565b6002805460408051602060018416156101000260001901909316849004601f81018490048402820184019092528181529291830182828015610b6e5780601f10610b4357610100808354040283529160200191610b6e565b60008060006113e18461286b565b909250905060008260038111156113f457fe5b146111c75760405162461bcd60e51b81526004018080602001828103825260378152602001806158706037913960400191505060405180910390fd5b60035461010090046001600160a01b0316331461147e5760405162461bcd60e51b815260040180806020018281038252602481526020018061577a6024913960400191505060405180910390fd5b60095415801561148e5750600a54155b6114c95760405162461bcd60e51b815260040180806020018281038252602381526020018061579e6023913960400191505060405180910390fd5b60078490558361150a5760405162461bcd60e51b81526004018080602001828103825260308152602001806157f36030913960400191505060405180910390fd5b600061151587611079565b9050801561156a576040805162461bcd60e51b815260206004820152601a60248201527f73657474696e6720636f6d7074726f6c6c6572206661696c6564000000000000604482015290519081900360640190fd5b61157261291f565b600955670de0b6b3a7640000600a5561158a86612923565b905080156115c95760405162461bcd60e51b81526004018080602001828103825260228152602001806158236022913960400191505060405180910390fd5b83516115dc906001906020870190615634565b5082516115f0906002906020860190615634565b50506003805460ff90921660ff199283161790556000805490911660011790555050505050565b600080610bef83612a98565b60008061162e61291f565b6009549091508082141561164757600092505050610d25565b600061165161253d565b600b54600c54600a54600654604080516315f2405360e01b815260048101879052602481018690526044810185905290519596509394929391926000926001600160a01b03909216916315f24053916064808301926020929190829003018186803b1580156116bf57600080fd5b505afa1580156116d3573d6000803e3d6000fd5b505050506040513d60208110156116e957600080fd5b5051905065048c27395000811115611748576040805162461bcd60e51b815260206004820152601c60248201527f626f72726f772072617465206973206162737572646c79206869676800000000604482015290519081900360640190fd5b6000806117558989612b19565b9092509050600082600381111561176857fe5b146117ba576040805162461bcd60e51b815260206004820152601f60248201527f636f756c64206e6f742063616c63756c61746520626c6f636b2064656c746100604482015290519081900360640190fd5b6117c2615621565b6000806000806117e060405180602001604052808a81525087612b3c565b909750945060008760038111156117f357fe5b14611825576118106009600689600381111561180b57fe5b612ba4565b9e505050505050505050505050505050610d25565b61182f858c6124e9565b9097509350600087600381111561184257fe5b1461185a576118106009600189600381111561180b57fe5b611864848c612c0a565b9097509250600087600381111561187757fe5b1461188f576118106009600489600381111561180b57fe5b6118aa6040518060200160405280600854815250858c612c30565b909750915060008760038111156118bd57fe5b146118d5576118106009600589600381111561180b57fe5b600660009054906101000a90046001600160a01b03166001600160a01b031663e36c26e46040518163ffffffff1660e01b815260040160206040518083038186803b15801561192357600080fd5b505afa158015611937573d6000803e3d6000fd5b505050506040513d602081101561194d57600080fd5b50511561198c57611961888d8d8d88612c8c565b9097509150600087600381111561197457fe5b1461198c576118106009600589600381111561180b57fe5b611997858a8b612c30565b909750905060008760038111156119aa57fe5b146119c2576118106009600389600381111561180b57fe5b60098e9055600a819055600b839055600c829055604080518d8152602081018690528082018390526060810185905290517f4dec04e750ca11537cabcd8a9eab06494de08da3735bc8871cd41250e190bc049181900360800190a160009e50505050505050505050505050505090565b6000805460ff16611a77576040805162461bcd60e51b815260206004820152600a6024820152691c994b595b9d195c995960b21b604482015290519081900360640190fd5b6000805460ff19168155611a8d333386866121b2565b1490506000805460ff1916600117905592915050565b600a5481565b6006546000906001600160a01b031663b8168816611ac561253d565b600b54600c546008546040518563ffffffff1660e01b81526004018085815260200184815260200183815260200182815260200194505050505060206040518083038186803b158015611b1757600080fd5b505afa158015611b2b573d6000803e3d6000fd5b505050506040513d6020811015611b4157600080fd5b5051905090565b6000805460ff16611b8d576040805162461bcd60e51b815260206004820152600a6024820152691c994b595b9d195c995960b21b604482015290519081900360640190fd5b6000805460ff19169055611ba333858585612f01565b90506000805460ff191660011790559392505050565b60035460009061010090046001600160a01b03163314611bdf5761109f60016045612651565b600480546001600160a01b038481166001600160a01b0319831681179093556040805191909216808252602082019390935281517fca4f2f25d0898edd99413412fb94012f9e54ec8142f9b093e7720646a95b16a9929181900390910190a160006111c7565b6000805460ff16611c8a576040805162461bcd60e51b815260206004820152600a6024820152691c994b595b9d195c995960b21b604482015290519081900360640190fd5b6000805460ff19168155611c9c611623565b14611ce7576040805162461bcd60e51b81526020600482015260166024820152751858d8dc9d59481a5b9d195c995cdd0819985a5b195960521b604482015290519081900360640190fd5b611cef610cc5565b90506000805460ff1916600117905590565b6001600160a01b0381166000908152600f6020526040812054819081908190818080611d2c8961286b565b935090506000816003811115611d3e57fe5b14611d5c5760095b975060009650869550859450611d8f9350505050565b611d646120df565b925090506000816003811115611d7657fe5b14611d82576009611d46565b5060009650919450925090505b9193509193565b6000610bdd826130dd565b6000610bdd8261315c565b6001600160a01b03918216600090815260106020908152604080832093909416825291909152205490565b6004546000906001600160a01b031633141580611df2575033155b15611e0a57611e0360016000612651565b9050610d25565b60038054600480546001600160a01b03818116610100818102610100600160a81b0319871617968790556001600160a01b031990931690935560408051948390048216808652929095041660208401528351909391927ff9ffabca9c8276e99321725bcb43fb076a6c66a54b7f21c4e8146d8519b417dc92908290030190a1600454604080516001600160a01b038085168252909216602083015280517fca4f2f25d0898edd99413412fb94012f9e54ec8142f9b093e7720646a95b16a99281900390910190a160009250505090565b600080611ee5611623565b90508015611f0b57611f03816010811115611efc57fe5b6040612651565b915050610bf4565b6111c783612923565b6006546001600160a01b031681565b600080611f318585856131d6565b5095945050505050565b60035461010090046001600160a01b031681565b6006546000906001600160a01b03166315f24053611f6b61253d565b600b54600c546040518463ffffffff1660e01b815260040180848152602001838152602001828152602001935050505060206040518083038186803b158015611b1757600080fd5b6000805460ff16611ff8576040805162461bcd60e51b815260206004820152600a6024820152691c994b595b9d195c995960b21b604482015290519081900360640190fd5b6000805460ff1916815561200a611623565b905080156120285761125881601081111561202157fe5b6046612651565b61126983613308565b600181565b60008054819060ff1661207d576040805162461bcd60e51b815260206004820152600a6024820152691c994b595b9d195c995960b21b604482015290519081900360640190fd5b6000805460ff1916815561208f611623565b905080156120ba576120ad8160108111156120a657fe5b6036612651565b9250600091506120cb9050565b6120c53333866133b0565b92509250505b6000805460ff191660011790559092909150565b600d546000908190806120fa575050600754600091506121ae565b600061210461253d565b600654600b54600c54600d5460408051639dc8bea760e01b81526004810187905260248101949094526044840192909252606483015280519394506001600160a01b0390921692639dc8bea792608480840193919291829003018186803b15801561216e57600080fd5b505afa158015612182573d6000803e3d6000fd5b505050506040513d604081101561219857600080fd5b50805160209091015190945092506121ae915050565b9091565b600554604080516317b9b84b60e31b81523060048201526001600160a01b03868116602483015285811660448301526064820185905291516000938493169163bdcdc25891608480830192602092919082900301818787803b15801561221757600080fd5b505af115801561222b573d6000803e3d6000fd5b505050506040513d602081101561224157600080fd5b505190508015612260576122586003604a83612ba4565b915050611057565b836001600160a01b0316856001600160a01b03161415612286576122586002604b612651565b60006001600160a01b0387811690871614156122a557506000196122cd565b506001600160a01b038086166000908152601060209081526040808320938a16835292905220545b6000806000806122dd8589612b19565b909450925060008460038111156122f057fe5b1461230e576123016009604b612651565b9650505050505050611057565b6001600160a01b038a166000908152600f60205260409020546123319089612b19565b9094509150600084600381111561234457fe5b14612355576123016009604c612651565b6001600160a01b0389166000908152600f60205260409020546123789089612c0a565b9094509050600084600381111561238b57fe5b1461239c576123016009604d612651565b6001600160a01b03808b166000908152600f6020526040808220859055918b1681522081905560001985146123f4576001600160a01b03808b166000908152601060209081526040808320938f168352929052208390555b886001600160a01b03168a6001600160a01b03166000805160206158e18339815191528a6040518082815260200191505060405180910390a35060009a9950505050505050505050565b60008054819060ff16612485576040805162461bcd60e51b815260206004820152600a6024820152691c994b595b9d195c995960b21b604482015290519081900360640190fd5b6000805460ff19168155612497611623565b905080156124c2576124b58160108111156124ae57fe5b6035612651565b9250600091506124d39050565b6124cd3386866133b0565b92509250505b6000805460ff1916600117905590939092509050565b60008060006124f6615621565b6125008686612b3c565b9092509050600082600381111561251357fe5b146125245750915060009050612536565b600061252f826136f0565b9350935050505b9250929050565b601254604080516370a0823160e01b815230600482015290516000926001600160a01b03169182916370a0823191602480820192602092909190829003018186803b15801561258b57600080fd5b505afa15801561259f573d6000803e3d6000fd5b505050506040513d60208110156125b557600080fd5b505191505090565b6000805460ff16612602576040805162461bcd60e51b815260206004820152600a6024820152691c994b595b9d195c995960b21b604482015290519081900360640190fd5b6000805460ff19168155612614611623565b905080156126325761125881601081111561262b57fe5b604e612651565b61263b836136ff565b509150506000805460ff19166001179055919050565b60007f45b96fe442630264581b197e84bbada861235052c5a1aadfff9ea4e40a969aa083601081111561268057fe5b83605281111561268c57fe5b604080519283526020830191909152600082820152519081900360600190a18260108111156111c757fe5b600354600090819061010090046001600160a01b031633146126df57611f0360016031612651565b6126e761291f565b600954146126fb57611f03600a6033612651565b8261270461253d565b101561271657611f03600e6032612651565b600c5483111561272c57611f0360026034612651565b50600c54828103908111156127725760405162461bcd60e51b81526004018080602001828103825260248152602001806159f66024913960400191505060405180910390fd5b600c8190556003546127929061010090046001600160a01b0316846137e7565b600354604080516101009092046001600160a01b0316825260208201859052818101839052517f3bad0c59cf2f06e7314077049f48a93578cd16f5ef92329f1dab1420a99c177e916060908290030190a160006111c7565b6000805460ff1661282f576040805162461bcd60e51b815260206004820152600a6024820152691c994b595b9d195c995960b21b604482015290519081900360640190fd5b6000805460ff19168155612841611623565b9050801561285f5761125881601081111561285857fe5b6027612651565b611269336000856138de565b6001600160a01b0381166000908152601160205260408120805482918291829182916128a257506000945084935061291a92505050565b6128b28160000154600a54614268565b909450925060008460038111156128c557fe5b146128da57509193506000925061291a915050565b6128e88382600101546142a7565b909450915060008460038111156128fb57fe5b1461291057509193506000925061291a915050565b5060009450925050505b915091565b4390565b600354600090819061010090046001600160a01b0316331461294b57611f0360016042612651565b61295361291f565b6009541461296757611f03600a6041612651565b600660009054906101000a90046001600160a01b03169050826001600160a01b0316632191f92a6040518163ffffffff1660e01b815260040160206040518083038186803b1580156129b857600080fd5b505afa1580156129cc573d6000803e3d6000fd5b505050506040513d60208110156129e257600080fd5b5051612a35576040805162461bcd60e51b815260206004820152601c60248201527f6d61726b6572206d6574686f642072657475726e65642066616c736500000000604482015290519081900360640190fd5b600680546001600160a01b0319166001600160a01b03858116918217909255604080519284168352602083019190915280517fedffc32e068c7c95dfd4bdfd5c4d939a084d6b11c4199eac8436ed234d72f9269281900390910190a160006111c7565b60008054819060ff16612adf576040805162461bcd60e51b815260206004820152600a6024820152691c994b595b9d195c995960b21b604482015290519081900360640190fd5b6000805460ff19168155612af1611623565b90508015612b0f576120ad816010811115612b0857fe5b601e612651565b6120c533856142d2565b600080838311612b30575060009050818303612536565b50600390506000612536565b6000612b46615621565b600080612b57866000015186614268565b90925090506000826003811115612b6a57fe5b14612b8957506040805160208101909152600081529092509050612536565b60408051602081019091529081526000969095509350505050565b60007f45b96fe442630264581b197e84bbada861235052c5a1aadfff9ea4e40a969aa0846010811115612bd357fe5b846052811115612bdf57fe5b604080519283526020830191909152818101859052519081900360600190a183601081111561105757fe5b600080838301848110612c2257600092509050612536565b506002915060009050612536565b6000806000612c3d615621565b612c478787612b3c565b90925090506000826003811115612c5a57fe5b14612c6b5750915060009050612c84565b612c7d612c77826136f0565b86612c0a565b9350935050505b935093915050565b60065460408051630dce3c5b60e31b815260048101879052602481018690526044810185905290516000928392839283926001600160a01b031691636e71e2d8916064808301926020929190829003018186803b158015612cec57600080fd5b505afa158015612d00573d6000803e3d6000fd5b505050506040513d6020811015612d1657600080fd5b505160065460085460408051635c0b440b60e11b8152600481018d9052602481018c9052604481018b90526064810192909252519293506000926001600160a01b039092169163b816881691608480820192602092909190829003018186803b158015612d8257600080fd5b505afa158015612d96573d6000803e3d6000fd5b505050506040513d6020811015612dac57600080fd5b50516006546040805163327a176d60e11b8152600481018d9052602481018c9052604481018b905290519293506001600160a01b03909116916364f42eda91606480820192602092909190829003018186803b158015612e0b57600080fd5b505afa158015612e1f573d6000803e3d6000fd5b505050506040513d6020811015612e3557600080fd5b505115612eeb57612e546040518060200160405280848152508b6124e9565b90955092506000856003811115612e6757fe5b14612e79575060009250612ef7915050565b612e838382612b19565b90955092506000856003811115612e9657fe5b14612ea8575060009250612ef7915050565b612ec16040518060200160405280858152508789612c30565b90955093506000856003811115612ed457fe5b14612ee6575060009250612ef7915050565b612ef3565b600094508693505b5050505b9550959350505050565b6005546040805163d02f735160e01b81523060048201526001600160a01b038781166024830152868116604483015285811660648301526084820185905291516000938493169163d02f73519160a480830192602092919082900301818787803b158015612f6e57600080fd5b505af1158015612f82573d6000803e3d6000fd5b505050506040513d6020811015612f9857600080fd5b505190508015612faf576122586003601b83612ba4565b846001600160a01b0316846001600160a01b03161415612fd5576122586006601c612651565b6001600160a01b0384166000908152600f602052604081205481908190612ffc9087612b19565b9093509150600083600381111561300f57fe5b14613032576130276009601a85600381111561180b57fe5b945050505050611057565b6001600160a01b0388166000908152600f60205260409020546130559087612c0a565b9093509050600083600381111561306857fe5b14613080576130276009601985600381111561180b57fe5b6001600160a01b038088166000818152600f60209081526040808320879055938c168083529184902085905583518a8152935191936000805160206158e1833981519152929081900390910190a360009998505050505050505050565b6000805460ff16613122576040805162461bcd60e51b815260206004820152600a6024820152691c994b595b9d195c995960b21b604482015290519081900360640190fd5b6000805460ff19168155613134611623565b905080156131525761125881601081111561314b57fe5b6008612651565b61126933846149bb565b6000805460ff166131a1576040805162461bcd60e51b815260206004820152600a6024820152691c994b595b9d195c995960b21b604482015290519081900360640190fd5b6000805460ff191681556131b3611623565b905080156131ca5761125881601081111561285857fe5b611269338460006138de565b60008054819060ff1661321d576040805162461bcd60e51b815260206004820152600a6024820152691c994b595b9d195c995960b21b604482015290519081900360640190fd5b6000805460ff1916815561322f611623565b9050801561325a5761324d81601081111561324657fe5b600f612651565b9250600091506132f19050565b836001600160a01b031663a6afed956040518163ffffffff1660e01b8152600401602060405180830381600087803b15801561329557600080fd5b505af11580156132a9573d6000803e3d6000fd5b505050506040513d60208110156132bf57600080fd5b5051905080156132df5761324d8160108111156132d857fe5b6010612651565b6132eb33878787614c47565b92509250505b6000805460ff191660011790559094909350915050565b60035460009061010090046001600160a01b0316331461332e5761109f60016047612651565b61333661291f565b6009541461334a5761109f600a6048612651565b670de0b6b3a76400008211156133665761109f60026049612651565b6008805490839055604080518281526020810185905281517faaa68312e2ea9d50e16af5068410ab56e1a1fd06037b1a35664812c30f821460929181900390910190a160006111c7565b60055460408051631200453160e11b81523060048201526001600160a01b0386811660248301528581166044830152606482018590529151600093849384939116916324008a629160848082019260209290919082900301818787803b15801561341957600080fd5b505af115801561342d573d6000803e3d6000fd5b505050506040513d602081101561344357600080fd5b5051905080156134675761345a6003603883612ba4565b925060009150612c849050565b61346f61291f565b600954146134835761345a600a6039612651565b61348b6156b2565b6001600160a01b03861660009081526011602052604090206001015460608201526134b58661286b565b60808301819052602083018260038111156134cc57fe5b60038111156134d757fe5b90525060009050816020015160038111156134ee57fe5b146135185761350a600960378360200151600381111561180b57fe5b935060009250612c84915050565b6000198514156135315760808101516040820152613539565b604081018590525b61354787826040015161513d565b60e08201819052608082015161355c91612b19565b60a083018190526020830182600381111561357357fe5b600381111561357e57fe5b905250600090508160200151600381111561359557fe5b146135d15760405162461bcd60e51b815260040180806020018281038252603a8152602001806158a7603a913960400191505060405180910390fd5b6135e1600b548260e00151612b19565b60c08301819052602083018260038111156135f857fe5b600381111561360357fe5b905250600090508160200151600381111561361a57fe5b146136565760405162461bcd60e51b81526004018080602001828103825260318152602001806159016031913960400191505060405180910390fd5b60a0810180516001600160a01b03808916600081815260116020908152604091829020948555600a5460019095019490945560c0860151600b81905560e087015195518251968752948601949094528481019390935291519192908a16917f1a2a22cb034d26d1854bdc6666a5b91fe25efbbb5dcad3b0355478d6f5c362a19181900360600190a360e00151600097909650945050505050565b51670de0b6b3a7640000900490565b60008060008061370d61291f565b6009541461372c57613721600a604f612651565b9350915061291a9050565b613736338661513d565b905080600c54019150600c54821015613796576040805162461bcd60e51b815260206004820181905260248201527f61646420726573657276657320756e6578706563746564206f766572666c6f77604482015290519081900360640190fd5b600c829055604080513381526020810183905280820184905290517fa91e67c5ea634cd43a12c5a482724b03de01e85ca68702a53d0c2f45cb7c1dc59181900360600190a160009350915050915091565b6012546040805163a9059cbb60e01b81526001600160a01b0385811660048301526024820185905291519190921691829163a9059cbb9160448082019260009290919082900301818387803b15801561383f57600080fd5b505af1158015613853573d6000803e3d6000fd5b5050505060003d6000811461386f576020811461387957600080fd5b6000199150613885565b60206000803e60005191505b50806138d8576040805162461bcd60e51b815260206004820152601960248201527f544f4b454e5f5452414e534645525f4f55545f4641494c454400000000000000604482015290519081900360640190fd5b50505050565b60008215806138eb575081155b6139265760405162461bcd60e51b81526004018080602001828103825260348152602001806159c26034913960400191505060405180910390fd5b61392e6156b2565b6001600160a01b0385166000908152600f6020526040902061394e6120df565b604084018190526020840182600381111561396557fe5b600381111561397057fe5b905250600090508260200151600381111561398757fe5b146139ac576139a36009602b8460200151600381111561180b57fe5b925050506111c7565b6000806000600660009054906101000a90046001600160a01b03166001600160a01b031663e36c26e46040518163ffffffff1660e01b815260040160206040518083038186803b1580156139ff57600080fd5b505afa158015613a13573d6000803e3d6000fd5b505050506040513d6020811015613a2957600080fd5b505190508015613af9576003840154613a40615621565b60405180602001604052808381525090506000613a636009548860020154612b19565b915050613a6e615621565b613a788383612b3c565b915050613a83615621565b613aa36040518060200160405280670de0b6b3a764000081525083615387565b60018b01549092509050613ab5615621565b506040805160208101909152818152613acc615621565b613ad684836153c1565b805160018f01819055909250613aed915084612b19565b9b505050505050505050505b60095460028501556006546001600160a01b031663b8168816613b1a61253d565b600b54600c546008546040518563ffffffff1660e01b81526004018085815260200184815260200183815260200182815260200194505050505060206040518083038186803b158015613b6c57600080fd5b505afa158015613b80573d6000803e3d6000fd5b505050506040513d6020811015613b9657600080fd5b50516003850155808015613c3457506006546001600160a01b03166364f42eda613bbe61253d565b600b54600c546040518463ffffffff1660e01b815260040180848152602001838152602001828152602001935050505060206040518083038186803b158015613c0657600080fd5b505afa158015613c1a573d6000803e3d6000fd5b505050506040513d6020811015613c3057600080fd5b5051155b15613dba576006546000906001600160a01b03166315f24053613c5561253d565b600b54600c546040518463ffffffff1660e01b815260040180848152602001838152602001828152602001935050505060206040518083038186803b158015613c9d57600080fd5b505afa158015613cb1573d6000803e3d6000fd5b505050506040513d6020811015613cc757600080fd5b50516006549091506000906001600160a01b0316636e71e2d8613ce861253d565b600b54600c546040518463ffffffff1660e01b815260040180848152602001838152602001828152602001935050505060206040518083038186803b158015613d3057600080fd5b505afa158015613d44573d6000803e3d6000fd5b505050506040513d6020811015613d5a57600080fd5b50516040805160208101909152838152909150600090613d7a90836124e9565b915050613d8b876003015482612b19565b9550613d979050615621565b613da58689600301546154aa565b915050613db281886124e9565b965050505050505b8715613e9157606085018890528015613e0f57613dd5615621565b613de78660600151866001015461555a565b915050613df2615621565b613e00828760000154615595565b51608089015250613e8c915050565b613e2b60405180602001604052808760400151815250896124e9565b6080870181905260208701826003811115613e4257fe5b6003811115613e4d57fe5b9052506000905085602001516003811115613e6457fe5b14613e8c57613e80600960298760200151600381111561180b57fe5b955050505050506111c7565b613f51565b608085018790528015613ee057613ea6615621565b613eb88660800151866000015461555a565b915050613ec3615621565b613ed1828760010154615595565b51606089015250613f51915050565b613efc87604051806020016040528088604001518152506155b0565b6060870181905260208701826003811115613f1357fe5b6003811115613f1e57fe5b9052506000905085602001516003811115613f3557fe5b14613f5157613e806009602a8760200151600381111561180b57fe5b60055460608601516040805163eabe7d9160e01b81523060048201526001600160a01b038d8116602483015260448201939093529051600093929092169163eabe7d919160648082019260209290919082900301818787803b158015613fb657600080fd5b505af1158015613fca573d6000803e3d6000fd5b505050506040513d6020811015613fe057600080fd5b50519050801561400457613ff76003602883612ba4565b96505050505050506111c7565b61400c61291f565b6009541461402057613ff7600a602c612651565b614030600d548760600151612b19565b60a088018190526020880182600381111561404757fe5b600381111561405257fe5b905250600090508660200151600381111561406957fe5b1461408557613ff76009602e8860200151600381111561180b57fe5b614091600e5484612b19565b60e088015250845460608701516140a89190612b19565b60c08801819052602088018260038111156140bf57fe5b60038111156140ca57fe5b90525060009050866020015160038111156140e157fe5b146140fd57613ff76009602d8860200151600381111561180b57fe5b856080015161410a61253d565b101561411c57613ff7600e602f612651565b61412a8a87608001516137e7565b60a0860151600d5560e0860151600e5560c0860151855560095460028601556060860151604080519182525130916001600160a01b038d16916000805160206158e18339815191529181900360200190a3896001600160a01b03167fe5b754fb1abb7f01b499791d0b820ae3b6af3424ac1c59768edb53f4ec31a92987608001518860600151604051808381526020018281526020019250505060405180910390a260055460808701516060880151604080516351dff98960e01b81523060048201526001600160a01b038f81166024830152604482019490945260648101929092525191909216916351dff98991608480830192600092919082900301818387803b15801561423957600080fd5b505af115801561424d573d6000803e3d6000fd5b506000925061425a915050565b9a9950505050505050505050565b6000808361427b57506000905080612536565b8383028385828161428857fe5b041461429c57506002915060009050612536565b600092509050612536565b600080826142bb5750600190506000612536565b60008385816142c657fe5b04915091509250929050565b60055460408051634ef4c3e160e01b81523060048201526001600160a01b03858116602483015260448201859052915160009384938493911691634ef4c3e19160648082019260209290919082900301818787803b15801561433357600080fd5b505af1158015614347573d6000803e3d6000fd5b505050506040513d602081101561435d57600080fd5b505190508015614381576143746003601f83612ba4565b9250600091506125369050565b61438961291f565b6009541461439d57614374600a6022612651565b6143a56156f8565b6143ad6120df565b60408301819052602083018260038111156143c457fe5b60038111156143cf57fe5b90525060009050816020015160038111156143e657fe5b1461441057614402600960218360200151600381111561180b57fe5b935060009250612536915050565b61441a868661513d565b60c082018190526040805160208101825290830151815261443b91906155b0565b606083018190526020830182600381111561445257fe5b600381111561445d57fe5b905250600090508160200151600381111561447457fe5b146144c6576040805162461bcd60e51b815260206004820181905260248201527f4d494e545f45584348414e47455f43414c43554c4154494f4e5f4641494c4544604482015290519081900360640190fd5b6144d6600d548260600151612c0a565b60808301819052602083018260038111156144ed57fe5b60038111156144f857fe5b905250600090508160200151600381111561450f57fe5b1461454b5760405162461bcd60e51b815260040180806020018281038252602881526020018061599a6028913960400191505060405180910390fd5b6001600160a01b0386166000908152600f602052604090205460608201516145739190612c0a565b60a083018190526020830182600381111561458a57fe5b600381111561459557fe5b90525060009050816020015160038111156145ac57fe5b146145e85760405162461bcd60e51b815260040180806020018281038252602b815260200180615845602b913960400191505060405180910390fd5b6006546000906001600160a01b031663b816881661460461253d565b600b54600c546008546040518563ffffffff1660e01b81526004018085815260200184815260200183815260200182815260200194505050505060206040518083038186803b15801561465657600080fd5b505afa15801561466a573d6000803e3d6000fd5b505050506040513d602081101561468057600080fd5b5051600654604080516338db09b960e21b815290519293506000926001600160a01b039092169163e36c26e491600480820192602092909190829003018186803b1580156146cd57600080fd5b505afa1580156146e1573d6000803e3d6000fd5b505050506040513d60208110156146f757600080fd5b50516001600160a01b0389166000908152600f6020526040902054909150156148cf57614722615621565b811561483f57614730615621565b5060408051602080820183526001600160a01b038c166000818152600f8084529481206003810154855260095492825294909252600290930154919290916147789190612b19565b915050614783615621565b61478d8383612b3c565b915050614798615621565b6147b86040518060200160405280670de0b6b3a764000081525083615387565b6001600160a01b038f166000908152600f60209081526040808320600101548151928301909152808252929450919250906147f390846153c1565b97509050600081600381111561480557fe5b146148345761481d6009602083600381111561180b57fe5b9c5060009b506125369a5050505050505050505050565b5050505050506148be565b6001600160a01b0389166000908152600f60209081526040808320548151808401835281815282519384018352918801518352929161487e91906153c1565b93509050600081600381111561489057fe5b146148bb576148a86009602083600381111561180b57fe5b9850600097506125369650505050505050565b50505b80516148ca9089612c0a565b985050505b608080840151600d5560408051918201815260a0850151825260208083018a815260095484840190815260608086018881526001600160a01b038f166000818152600f8752879020975188559351600188015591516002870155905160039095019490945560c087015193870151835194855291840191909152815190927f4c209b5fc8ad50758f13e2e1088ba56a560dff690a1c6fef26394f4c03821c4f92908290030190a2606083015160408051918252516001600160a01b038a169130916000805160206158e18339815191529181900360200190a3505060c001516000969095509350505050565b6005546040805163368f515360e21b81523060048201526001600160a01b0385811660248301526044820185905291516000938493169163da3d454c91606480830192602092919082900301818787803b158015614a1857600080fd5b505af1158015614a2c573d6000803e3d6000fd5b505050506040513d6020811015614a4257600080fd5b505190508015614a6157614a596003600e83612ba4565b915050610bdd565b614a6961291f565b60095414614a7c57614a59600a80612651565b82614a8561253d565b1015614a9757614a59600e6009612651565b614a9f615736565b614aa88561286b565b6020830181905282826003811115614abc57fe5b6003811115614ac757fe5b9052506000905081516003811115614adb57fe5b14614b0057614af7600960078360000151600381111561180b57fe5b92505050610bdd565b614b0e816020015185612c0a565b6040830181905282826003811115614b2257fe5b6003811115614b2d57fe5b9052506000905081516003811115614b4157fe5b14614b5d57614af76009600c8360000151600381111561180b57fe5b614b69600b5485612c0a565b6060830181905282826003811115614b7d57fe5b6003811115614b8857fe5b9052506000905081516003811115614b9c57fe5b14614bb857614af76009600b8360000151600381111561180b57fe5b614bc285856137e7565b604080820180516001600160a01b03881660008181526011602090815290859020928355600a54600190930192909255606080860151600b819055935185518a8152938401528285019390935292517f13ed6866d4e1ee6da46f845c46d7e54120883d75c5ea9a2dacc1c4ca8984ab80929181900390910190a2600095945050505050565b60055460408051632fe3f38f60e11b81523060048201526001600160a01b0384811660248301528781166044830152868116606483015260848201869052915160009384938493911691635fc7e71e9160a48082019260209290919082900301818787803b158015614cb857600080fd5b505af1158015614ccc573d6000803e3d6000fd5b505050506040513d6020811015614ce257600080fd5b505190508015614d0657614cf96003601283612ba4565b9250600091506151349050565b614d0e61291f565b60095414614d2257614cf9600a6016612651565b614d2a61291f565b846001600160a01b0316636c540baf6040518163ffffffff1660e01b815260040160206040518083038186803b158015614d6357600080fd5b505afa158015614d77573d6000803e3d6000fd5b505050506040513d6020811015614d8d57600080fd5b505114614da057614cf9600a6011612651565b866001600160a01b0316866001600160a01b03161415614dc657614cf960066017612651565b84614dd757614cf960076015612651565b600019851415614ded57614cf960076014612651565b600080614dfb8989896133b0565b90925090508115614e2b57614e1c826010811115614e1557fe5b6018612651565b94506000935061513492505050565b6005546040805163c488847b60e01b81523060048201526001600160a01b038981166024830152604482018590528251600094859492169263c488847b926064808301939192829003018186803b158015614e8557600080fd5b505afa158015614e99573d6000803e3d6000fd5b505050506040513d6040811015614eaf57600080fd5b50805160209091015190925090508115614efa5760405162461bcd60e51b81526004018080602001828103825260338152602001806159326033913960400191505060405180910390fd5b80886001600160a01b03166370a082318c6040518263ffffffff1660e01b815260040180826001600160a01b03166001600160a01b0316815260200191505060206040518083038186803b158015614f5157600080fd5b505afa158015614f65573d6000803e3d6000fd5b505050506040513d6020811015614f7b57600080fd5b50511015614fd0576040805162461bcd60e51b815260206004820152601860248201527f4c49515549444154455f5345495a455f544f4f5f4d5543480000000000000000604482015290519081900360640190fd5b60006001600160a01b038916301415614ff657614fef308d8d85612f01565b9050615080565b6040805163b2a02ff160e01b81526001600160a01b038e811660048301528d81166024830152604482018590529151918b169163b2a02ff1916064808201926020929091908290030181600087803b15801561505157600080fd5b505af1158015615065573d6000803e3d6000fd5b505050506040513d602081101561507b57600080fd5b505190505b80156150ca576040805162461bcd60e51b81526020600482015260146024820152731d1bdad95b881cd95a5e9d5c994819985a5b195960621b604482015290519081900360640190fd5b886001600160a01b03168b6001600160a01b03168d6001600160a01b03167f298637f684da70674f26509b10f07ec2fbc77a335ab1e7d6215a4b2484d8bb528786604051808381526020018281526020019250505060405180910390a46000975092955050505050505b94509492505050565b601254604080516370a0823160e01b815230600482015290516000926001600160a01b031691839183916370a08231916024808301926020929190829003018186803b15801561518c57600080fd5b505afa1580156151a0573d6000803e3d6000fd5b505050506040513d60208110156151b657600080fd5b5051604080516323b872dd60e01b81526001600160a01b038881166004830152306024830152604482018890529151929350908416916323b872dd9160648082019260009290919082900301818387803b15801561521357600080fd5b505af1158015615227573d6000803e3d6000fd5b5050505060003d60008114615243576020811461524d57600080fd5b6000199150615259565b60206000803e60005191505b50806152ac576040805162461bcd60e51b815260206004820152601860248201527f544f4b454e5f5452414e534645525f494e5f4641494c45440000000000000000604482015290519081900360640190fd5b601254604080516370a0823160e01b815230600482015290516000926001600160a01b0316916370a08231916024808301926020929190829003018186803b1580156152f757600080fd5b505afa15801561530b573d6000803e3d6000fd5b505050506040513d602081101561532157600080fd5b505190508281101561537a576040805162461bcd60e51b815260206004820152601a60248201527f544f4b454e5f5452414e534645525f494e5f4f564552464c4f57000000000000604482015290519081900360640190fd5b9190910395945050505050565b6000615391615621565b6000806153a686600001518660000151612c0a565b60408051602081019091529081529097909650945050505050565b60006153cb615621565b6000806153e086600001518660000151614268565b909250905060008260038111156153f357fe5b1461541257506040805160208101909152600081529092509050612536565b6000806154276706f05b59d3b2000084612c0a565b9092509050600082600381111561543a57fe5b1461545c57506040805160208101909152600081529094509250612536915050565b60008061547183670de0b6b3a76400006142a7565b9092509050600082600381111561548457fe5b1461548b57fe5b604080516020810190915290815260009a909950975050505050505050565b60006154b4615621565b6000806154c986670de0b6b3a7640000614268565b909250905060008260038111156154dc57fe5b146154fb57506040805160208101909152600081529092509050612536565b60008061550883886142a7565b9092509050600082600381111561551b57fe5b1461553d57506040805160208101909152600081529094509250612536915050565b604080516020810190915290815260009890975095505050505050565b6000615564615621565b61558a6040518060200160405280868152506040518060200160405280868152506153c1565b915091509250929050565b600061559f615621565b600080612b578660000151866142a7565b60008060006155bd615621565b612500868660006155cc615621565b6000806155e1670de0b6b3a764000087614268565b909250905060008260038111156155f457fe5b1461561357506040805160208101909152600081529092509050612536565b61252f8186600001516154aa565b6040518060200160405280600081525090565b828054600181600116156101000203166002900490600052602060002090601f016020900481019282601f1061567557805160ff19168380011785556156a2565b828001600101855582156156a2579182015b828111156156a2578251825591602001919060010190615687565b506156ae92915061575f565b5090565b6040805161010081019091528060008152602001600081526020016000815260200160008152602001600081526020016000815260200160008152602001600081525090565b6040805160e0810190915280600081526020016000815260200160008152602001600081526020016000815260200160008152602001600081525090565b604080516080810190915280600081526020016000815260200160008152602001600081525090565b610d2591905b808211156156ae576000815560010161576556fe6f6e6c792061646d696e206d617920696e697469616c697a6520746865206d61726b65746d61726b6574206d6179206f6e6c7920626520696e697469616c697a6564206f6e63654345726332303a3a7377656570546f6b656e3a2063616e206e6f7420737765657020756e6465726c79696e6720746f6b656e696e697469616c2065786368616e67652072617465206d7573742062652067726561746572207468616e207a65726f2e73657474696e6720696e7465726573742072617465206d6f64656c206661696c65644d494e545f4e45575f4143434f554e545f42414c414e43455f43414c43554c4154494f4e5f4641494c4544626f72726f7742616c616e636553746f7265643a20626f72726f7742616c616e636553746f726564496e7465726e616c206661696c656452455041595f424f52524f575f4e45575f4143434f554e545f424f52524f575f42414c414e43455f43414c43554c4154494f4e5f4641494c4544ddf252ad1be2c89b69c2b068fc378daa952ba7f163c4a11628f55a4df523b3ef52455041595f424f52524f575f4e45575f544f54414c5f42414c414e43455f43414c43554c4154494f4e5f4641494c45444c49515549444154455f434f4d5054524f4c4c45525f43414c43554c4154455f414d4f554e545f5345495a455f4641494c454465786368616e67655261746553746f7265643a2065786368616e67655261746553746f726564496e7465726e616c206661696c65644d494e545f4e45575f544f54414c5f535550504c595f43414c43554c4154494f4e5f4641494c45446f6e65206f662072656465656d546f6b656e73496e206f722072656465656d416d6f756e74496e206d757374206265207a65726f72656475636520726573657276657320756e657870656374656420756e646572666c6f77a265627a7a72315820562487e1a49c1e85c6cbbb4bb84d3572940188a741468a94d5582d209184045264736f6c634300051100326f6e6c792061646d696e206d617920696e697469616c697a6520746865206d61726b65746d61726b6574206d6179206f6e6c7920626520696e697469616c697a6564206f6e6365696e697469616c2065786368616e67652072617465206d7573742062652067726561746572207468616e207a65726f2e73657474696e6720696e7465726573742072617465206d6f64656c206661696c6564",
  "deployedBytecode": "0x608060405234801561001057600080fd5b50600436106102f15760003560e01c806373acee981161019d578063bd6d894d116100e9578063f2b3abbd116100a2578063f851a4401161007c578063f851a44014610ab4578063f8f9da2814610abc578063fca7820b14610ac4578063fe9c44ae14610ae1576102f1565b8063f2b3abbd14610a50578063f3fdb15a14610a76578063f5e3c46214610a7e576102f1565b8063bd6d894d1461098c578063c37f68e214610994578063c5ebeaec146109e0578063db006a75146109fd578063dd62ed3e14610a1a578063e9c714f214610a48576102f1565b8063a0712d6811610156578063aa5af0fd11610130578063aa5af0fd14610920578063ae9d70b014610928578063b2a02ff114610930578063b71d1a0c14610966576102f1565b8063a0712d68146108cf578063a6afed95146108ec578063a9059cbb146108f4576102f1565b806373acee9814610726578063852a12e31461072e5780638f840ddd1461074b57806395d89b411461075357806395dd91931461075b57806399d8c1b414610781576102f1565b8063267822471161025c57806347bd371811610215578063675d972c116101ef578063675d972c146106e85780636c540baf146106f05780636f307dc3146106f857806370a0823114610700576102f1565b806347bd3718146106bb5780635fe3b567146106c3578063601a0bf1146106cb576102f1565b80632678224714610608578063313ce5671461062c5780633af9e6691461064a5780633b1d21a2146106705780633e941010146106785780634576b5db14610695576102f1565b8063182df0f5116102ae578063182df0f5146104185780631a31d465146104205780631be19560146105785780631df0ba9d1461059e57806323b872dd146105a65780632608f818146105dc576102f1565b806306fdde03146102f6578063095ea7b3146103735780630e752702146103b3578063173b9904146103e257806317bfdfbc146103ea57806318160ddd14610410575b600080fd5b6102fe610ae9565b6040805160208082528351818301528351919283929083019185019080838360005b83811015610338578181015183820152602001610320565b50505050905090810190601f1680156103655780820380516001836020036101000a031916815260200191505b509250505060405180910390f35b61039f6004803603604081101561038957600080fd5b506001600160a01b038135169060200135610b76565b604080519115158252519081900360200190f35b6103d0600480360360208110156103c957600080fd5b5035610be3565b60408051918252519081900360200190f35b6103d0610bf9565b6103d06004803603602081101561040057600080fd5b50356001600160a01b0316610bff565b6103d0610cbf565b6103d0610cc5565b610576600480360360e081101561043657600080fd5b6001600160a01b03823581169260208101358216926040820135909216916060820135919081019060a081016080820135600160201b81111561047857600080fd5b82018360208201111561048a57600080fd5b803590602001918460018302840111600160201b831117156104ab57600080fd5b91908080601f0160208091040260200160405190810160405280939291908181526020018383808284376000920191909152509295949360208101935035915050600160201b8111156104fd57600080fd5b82018360208201111561050f57600080fd5b803590602001918460018302840111600160201b8311171561053057600080fd5b91908080601f0160208091040260200160405190810160405280939291908181526020018383808284376000920191909152509295505050903560ff169150610d289050565b005b6105766004803603602081101561058e57600080fd5b50356001600160a01b0316610dc7565b6103d0610f03565b61039f600480360360608110156105bc57600080fd5b506001600160a01b03813581169160208101359091169060400135610f09565b6103d0600480360360408110156105f257600080fd5b506001600160a01b038135169060200135610f7b565b610610610f91565b604080516001600160a01b039092168252519081900360200190f35b610634610fa0565b6040805160ff9092168252519081900360200190f35b6103d06004803603602081101561066057600080fd5b50356001600160a01b0316610fa9565b6103d061105f565b6103d06004803603602081101561068e57600080fd5b503561106e565b6103d0600480360360208110156106ab57600080fd5b50356001600160a01b0316611079565b6103d06111ce565b6106106111d4565b6103d0600480360360208110156106e157600080fd5b50356111e3565b6103d061127e565b6103d0611284565b61061061128a565b6103d06004803603602081101561071657600080fd5b50356001600160a01b0316611299565b6103d06112b4565b6103d06004803603602081101561074457600080fd5b503561136a565b6103d0611375565b6102fe61137b565b6103d06004803603602081101561077157600080fd5b50356001600160a01b03166113d3565b610576600480360360c081101561079757600080fd5b6001600160a01b03823581169260208101359091169160408201359190810190608081016060820135600160201b8111156107d157600080fd5b8201836020820111156107e357600080fd5b803590602001918460018302840111600160201b8311171561080457600080fd5b91908080601f0160208091040260200160405190810160405280939291908181526020018383808284376000920191909152509295949360208101935035915050600160201b81111561085657600080fd5b82018360208201111561086857600080fd5b803590602001918460018302840111600160201b8311171561088957600080fd5b91908080601f0160208091040260200160405190810160405280939291908181526020018383808284376000920191909152509295505050903560ff1691506114309050565b6103d0600480360360208110156108e557600080fd5b5035611617565b6103d0611623565b61039f6004803603604081101561090a57600080fd5b506001600160a01b038135169060200135611a32565b6103d0611aa3565b6103d0611aa9565b6103d06004803603606081101561094657600080fd5b506001600160a01b03813581169160208101359091169060400135611b48565b6103d06004803603602081101561097c57600080fd5b50356001600160a01b0316611bb9565b6103d0611c45565b6109ba600480360360208110156109aa57600080fd5b50356001600160a01b0316611d01565b604080519485526020850193909352838301919091526060830152519081900360800190f35b6103d0600480360360208110156109f657600080fd5b5035611d96565b6103d060048036036020811015610a1357600080fd5b5035611da1565b6103d060048036036040811015610a3057600080fd5b506001600160a01b0381358116916020013516611dac565b6103d0611dd7565b6103d060048036036020811015610a6657600080fd5b50356001600160a01b0316611eda565b610610611f14565b6103d060048036036060811015610a9457600080fd5b506001600160a01b03813581169160208101359160409091013516611f23565b610610611f3b565b6103d0611f4f565b6103d060048036036020811015610ada57600080fd5b5035611fb3565b61039f612031565b60018054604080516020600284861615610100026000190190941693909304601f81018490048402820184019092528181529291830182828015610b6e5780601f10610b4357610100808354040283529160200191610b6e565b820191906000526020600020905b815481529060010190602001808311610b5157829003601f168201915b505050505081565b3360008181526010602090815260408083206001600160a01b03871680855290835281842086905581518681529151939493909284927f8c5be1e5ebec7d5bd14f71427d1e84f3dd0314c0f7b2291e5b200ac8c7c3b925929081900390910190a360019150505b92915050565b600080610bef83612036565b509150505b919050565b60085481565b6000805460ff16610c44576040805162461bcd60e51b815260206004820152600a6024820152691c994b595b9d195c995960b21b604482015290519081900360640190fd5b6000805460ff19168155610c56611623565b14610ca1576040805162461bcd60e51b81526020600482015260166024820152751858d8dc9d59481a5b9d195c995cdd0819985a5b195960521b604482015290519081900360640190fd5b610caa826113d3565b90505b6000805460ff19166001179055919050565b600d5481565b6000806000610cd26120df565b90925090506000826003811115610ce557fe5b14610d215760405162461bcd60e51b81526004018080602001828103825260358152602001806159656035913960400191505060405180910390fd5b9150505b90565b610d36868686868686611430565b601280546001600160a01b0319166001600160a01b038981169190911791829055604080516318160ddd60e01b8152905192909116916318160ddd91600480820192602092909190829003018186803b158015610d9257600080fd5b505afa158015610da6573d6000803e3d6000fd5b505050506040513d6020811015610dbc57600080fd5b505050505050505050565b6012546001600160a01b0382811691161415610e145760405162461bcd60e51b81526004018080602001828103825260328152602001806157c16032913960400191505060405180910390fd5b604080516370a0823160e01b815230600482015290516000916001600160a01b038416916370a0823191602480820192602092909190829003018186803b158015610e5e57600080fd5b505afa158015610e72573d6000803e3d6000fd5b505050506040513d6020811015610e8857600080fd5b50516003546040805163a9059cbb60e01b81526101009092046001600160a01b03908116600484015260248301849052905192935084169163a9059cbb9160448082019260009290919082900301818387803b158015610ee757600080fd5b505af1158015610efb573d6000803e3d6000fd5b505050505050565b600e5481565b6000805460ff16610f4e576040805162461bcd60e51b815260206004820152600a6024820152691c994b595b9d195c995960b21b604482015290519081900360640190fd5b6000805460ff19168155610f64338686866121b2565b1490506000805460ff191660011790559392505050565b600080610f88848461243e565b50949350505050565b6004546001600160a01b031681565b60035460ff1681565b6000610fb3615621565b6040518060200160405280610fc6611c45565b90526001600160a01b0384166000908152600f6020526040812054919250908190610ff29084906124e9565b9092509050600082600381111561100557fe5b14611057576040805162461bcd60e51b815260206004820152601f60248201527f62616c616e636520636f756c64206e6f742062652063616c63756c6174656400604482015290519081900360640190fd5b949350505050565b600061106961253d565b905090565b6000610bdd826125bd565b60035460009061010090046001600160a01b031633146110a65761109f6001603f612651565b9050610bf4565b60055460408051623f1ee960e11b815290516001600160a01b0392831692851691627e3dd2916004808301926020929190829003018186803b1580156110eb57600080fd5b505afa1580156110ff573d6000803e3d6000fd5b505050506040513d602081101561111557600080fd5b5051611168576040805162461bcd60e51b815260206004820152601c60248201527f6d61726b6572206d6574686f642072657475726e65642066616c736500000000604482015290519081900360640190fd5b600580546001600160a01b0319166001600160a01b03858116918217909255604080519284168352602083019190915280517f7ac369dbd14fa5ea3f473ed67cc9d598964a77501540ba6751eb0b3decf5870d9281900390910190a160005b9392505050565b600b5481565b6005546001600160a01b031681565b6000805460ff16611228576040805162461bcd60e51b815260206004820152600a6024820152691c994b595b9d195c995960b21b604482015290519081900360640190fd5b6000805460ff1916815561123a611623565b905080156112605761125881601081111561125157fe5b6030612651565b915050610cad565b611269836126b7565b9150506000805460ff19166001179055919050565b60075481565b60095481565b6012546001600160a01b031681565b6001600160a01b03166000908152600f602052604090205490565b6000805460ff166112f9576040805162461bcd60e51b815260206004820152600a6024820152691c994b595b9d195c995960b21b604482015290519081900360640190fd5b6000805460ff1916815561130b611623565b14611356576040805162461bcd60e51b81526020600482015260166024820152751858d8dc9d59481a5b9d195c995cdd0819985a5b195960521b604482015290519081900360640190fd5b50600b546000805460ff1916600117905590565b6000610bdd826127ea565b600c5481565b6002805460408051602060018416156101000260001901909316849004601f81018490048402820184019092528181529291830182828015610b6e5780601f10610b4357610100808354040283529160200191610b6e565b60008060006113e18461286b565b909250905060008260038111156113f457fe5b146111c75760405162461bcd60e51b81526004018080602001828103825260378152602001806158706037913960400191505060405180910390fd5b60035461010090046001600160a01b0316331461147e5760405162461bcd60e51b815260040180806020018281038252602481526020018061577a6024913960400191505060405180910390fd5b60095415801561148e5750600a54155b6114c95760405162461bcd60e51b815260040180806020018281038252602381526020018061579e6023913960400191505060405180910390fd5b60078490558361150a5760405162461bcd60e51b81526004018080602001828103825260308152602001806157f36030913960400191505060405180910390fd5b600061151587611079565b9050801561156a576040805162461bcd60e51b815260206004820152601a60248201527f73657474696e6720636f6d7074726f6c6c6572206661696c6564000000000000604482015290519081900360640190fd5b61157261291f565b600955670de0b6b3a7640000600a5561158a86612923565b905080156115c95760405162461bcd60e51b81526004018080602001828103825260228152602001806158236022913960400191505060405180910390fd5b83516115dc906001906020870190615634565b5082516115f0906002906020860190615634565b50506003805460ff90921660ff199283161790556000805490911660011790555050505050565b600080610bef83612a98565b60008061162e61291f565b6009549091508082141561164757600092505050610d25565b600061165161253d565b600b54600c54600a54600654604080516315f2405360e01b815260048101879052602481018690526044810185905290519596509394929391926000926001600160a01b03909216916315f24053916064808301926020929190829003018186803b1580156116bf57600080fd5b505afa1580156116d3573d6000803e3d6000fd5b505050506040513d60208110156116e957600080fd5b5051905065048c27395000811115611748576040805162461bcd60e51b815260206004820152601c60248201527f626f72726f772072617465206973206162737572646c79206869676800000000604482015290519081900360640190fd5b6000806117558989612b19565b9092509050600082600381111561176857fe5b146117ba576040805162461bcd60e51b815260206004820152601f60248201527f636f756c64206e6f742063616c63756c61746520626c6f636b2064656c746100604482015290519081900360640190fd5b6117c2615621565b6000806000806117e060405180602001604052808a81525087612b3c565b909750945060008760038111156117f357fe5b14611825576118106009600689600381111561180b57fe5b612ba4565b9e505050505050505050505050505050610d25565b61182f858c6124e9565b9097509350600087600381111561184257fe5b1461185a576118106009600189600381111561180b57fe5b611864848c612c0a565b9097509250600087600381111561187757fe5b1461188f576118106009600489600381111561180b57fe5b6118aa6040518060200160405280600854815250858c612c30565b909750915060008760038111156118bd57fe5b146118d5576118106009600589600381111561180b57fe5b600660009054906101000a90046001600160a01b03166001600160a01b031663e36c26e46040518163ffffffff1660e01b815260040160206040518083038186803b15801561192357600080fd5b505afa158015611937573d6000803e3d6000fd5b505050506040513d602081101561194d57600080fd5b50511561198c57611961888d8d8d88612c8c565b9097509150600087600381111561197457fe5b1461198c576118106009600589600381111561180b57fe5b611997858a8b612c30565b909750905060008760038111156119aa57fe5b146119c2576118106009600389600381111561180b57fe5b60098e9055600a819055600b839055600c829055604080518d8152602081018690528082018390526060810185905290517f4dec04e750ca11537cabcd8a9eab06494de08da3735bc8871cd41250e190bc049181900360800190a160009e50505050505050505050505050505090565b6000805460ff16611a77576040805162461bcd60e51b815260206004820152600a6024820152691c994b595b9d195c995960b21b604482015290519081900360640190fd5b6000805460ff19168155611a8d333386866121b2565b1490506000805460ff1916600117905592915050565b600a5481565b6006546000906001600160a01b031663b8168816611ac561253d565b600b54600c546008546040518563ffffffff1660e01b81526004018085815260200184815260200183815260200182815260200194505050505060206040518083038186803b158015611b1757600080fd5b505afa158015611b2b573d6000803e3d6000fd5b505050506040513d6020811015611b4157600080fd5b5051905090565b6000805460ff16611b8d576040805162461bcd60e51b815260206004820152600a6024820152691c994b595b9d195c995960b21b604482015290519081900360640190fd5b6000805460ff19169055611ba333858585612f01565b90506000805460ff191660011790559392505050565b60035460009061010090046001600160a01b03163314611bdf5761109f60016045612651565b600480546001600160a01b038481166001600160a01b0319831681179093556040805191909216808252602082019390935281517fca4f2f25d0898edd99413412fb94012f9e54ec8142f9b093e7720646a95b16a9929181900390910190a160006111c7565b6000805460ff16611c8a576040805162461bcd60e51b815260206004820152600a6024820152691c994b595b9d195c995960b21b604482015290519081900360640190fd5b6000805460ff19168155611c9c611623565b14611ce7576040805162461bcd60e51b81526020600482015260166024820152751858d8dc9d59481a5b9d195c995cdd0819985a5b195960521b604482015290519081900360640190fd5b611cef610cc5565b90506000805460ff1916600117905590565b6001600160a01b0381166000908152600f6020526040812054819081908190818080611d2c8961286b565b935090506000816003811115611d3e57fe5b14611d5c5760095b975060009650869550859450611d8f9350505050565b611d646120df565b925090506000816003811115611d7657fe5b14611d82576009611d46565b5060009650919450925090505b9193509193565b6000610bdd826130dd565b6000610bdd8261315c565b6001600160a01b03918216600090815260106020908152604080832093909416825291909152205490565b6004546000906001600160a01b031633141580611df2575033155b15611e0a57611e0360016000612651565b9050610d25565b60038054600480546001600160a01b03818116610100818102610100600160a81b0319871617968790556001600160a01b031990931690935560408051948390048216808652929095041660208401528351909391927ff9ffabca9c8276e99321725bcb43fb076a6c66a54b7f21c4e8146d8519b417dc92908290030190a1600454604080516001600160a01b038085168252909216602083015280517fca4f2f25d0898edd99413412fb94012f9e54ec8142f9b093e7720646a95b16a99281900390910190a160009250505090565b600080611ee5611623565b90508015611f0b57611f03816010811115611efc57fe5b6040612651565b915050610bf4565b6111c783612923565b6006546001600160a01b031681565b600080611f318585856131d6565b5095945050505050565b60035461010090046001600160a01b031681565b6006546000906001600160a01b03166315f24053611f6b61253d565b600b54600c546040518463ffffffff1660e01b815260040180848152602001838152602001828152602001935050505060206040518083038186803b158015611b1757600080fd5b6000805460ff16611ff8576040805162461bcd60e51b815260206004820152600a6024820152691c994b595b9d195c995960b21b604482015290519081900360640190fd5b6000805460ff1916815561200a611623565b905080156120285761125881601081111561202157fe5b6046612651565b61126983613308565b600181565b60008054819060ff1661207d576040805162461bcd60e51b815260206004820152600a6024820152691c994b595b9d195c995960b21b604482015290519081900360640190fd5b6000805460ff1916815561208f611623565b905080156120ba576120ad8160108111156120a657fe5b6036612651565b9250600091506120cb9050565b6120c53333866133b0565b92509250505b6000805460ff191660011790559092909150565b600d546000908190806120fa575050600754600091506121ae565b600061210461253d565b600654600b54600c54600d5460408051639dc8bea760e01b81526004810187905260248101949094526044840192909252606483015280519394506001600160a01b0390921692639dc8bea792608480840193919291829003018186803b15801561216e57600080fd5b505afa158015612182573d6000803e3d6000fd5b505050506040513d604081101561219857600080fd5b50805160209091015190945092506121ae915050565b9091565b600554604080516317b9b84b60e31b81523060048201526001600160a01b03868116602483015285811660448301526064820185905291516000938493169163bdcdc25891608480830192602092919082900301818787803b15801561221757600080fd5b505af115801561222b573d6000803e3d6000fd5b505050506040513d602081101561224157600080fd5b505190508015612260576122586003604a83612ba4565b915050611057565b836001600160a01b0316856001600160a01b03161415612286576122586002604b612651565b60006001600160a01b0387811690871614156122a557506000196122cd565b506001600160a01b038086166000908152601060209081526040808320938a16835292905220545b6000806000806122dd8589612b19565b909450925060008460038111156122f057fe5b1461230e576123016009604b612651565b9650505050505050611057565b6001600160a01b038a166000908152600f60205260409020546123319089612b19565b9094509150600084600381111561234457fe5b14612355576123016009604c612651565b6001600160a01b0389166000908152600f60205260409020546123789089612c0a565b9094509050600084600381111561238b57fe5b1461239c576123016009604d612651565b6001600160a01b03808b166000908152600f6020526040808220859055918b1681522081905560001985146123f4576001600160a01b03808b166000908152601060209081526040808320938f168352929052208390555b886001600160a01b03168a6001600160a01b03166000805160206158e18339815191528a6040518082815260200191505060405180910390a35060009a9950505050505050505050565b60008054819060ff16612485576040805162461bcd60e51b815260206004820152600a6024820152691c994b595b9d195c995960b21b604482015290519081900360640190fd5b6000805460ff19168155612497611623565b905080156124c2576124b58160108111156124ae57fe5b6035612651565b9250600091506124d39050565b6124cd3386866133b0565b92509250505b6000805460ff1916600117905590939092509050565b60008060006124f6615621565b6125008686612b3c565b9092509050600082600381111561251357fe5b146125245750915060009050612536565b600061252f826136f0565b9350935050505b9250929050565b601254604080516370a0823160e01b815230600482015290516000926001600160a01b03169182916370a0823191602480820192602092909190829003018186803b15801561258b57600080fd5b505afa15801561259f573d6000803e3d6000fd5b505050506040513d60208110156125b557600080fd5b505191505090565b6000805460ff16612602576040805162461bcd60e51b815260206004820152600a6024820152691c994b595b9d195c995960b21b604482015290519081900360640190fd5b6000805460ff19168155612614611623565b905080156126325761125881601081111561262b57fe5b604e612651565b61263b836136ff565b509150506000805460ff19166001179055919050565b60007f45b96fe442630264581b197e84bbada861235052c5a1aadfff9ea4e40a969aa083601081111561268057fe5b83605281111561268c57fe5b604080519283526020830191909152600082820152519081900360600190a18260108111156111c757fe5b600354600090819061010090046001600160a01b031633146126df57611f0360016031612651565b6126e761291f565b600954146126fb57611f03600a6033612651565b8261270461253d565b101561271657611f03600e6032612651565b600c5483111561272c57611f0360026034612651565b50600c54828103908111156127725760405162461bcd60e51b81526004018080602001828103825260248152602001806159f66024913960400191505060405180910390fd5b600c8190556003546127929061010090046001600160a01b0316846137e7565b600354604080516101009092046001600160a01b0316825260208201859052818101839052517f3bad0c59cf2f06e7314077049f48a93578cd16f5ef92329f1dab1420a99c177e916060908290030190a160006111c7565b6000805460ff1661282f576040805162461bcd60e51b815260206004820152600a6024820152691c994b595b9d195c995960b21b604482015290519081900360640190fd5b6000805460ff19168155612841611623565b9050801561285f5761125881601081111561285857fe5b6027612651565b611269336000856138de565b6001600160a01b0381166000908152601160205260408120805482918291829182916128a257506000945084935061291a92505050565b6128b28160000154600a54614268565b909450925060008460038111156128c557fe5b146128da57509193506000925061291a915050565b6128e88382600101546142a7565b909450915060008460038111156128fb57fe5b1461291057509193506000925061291a915050565b5060009450925050505b915091565b4390565b600354600090819061010090046001600160a01b0316331461294b57611f0360016042612651565b61295361291f565b6009541461296757611f03600a6041612651565b600660009054906101000a90046001600160a01b03169050826001600160a01b0316632191f92a6040518163ffffffff1660e01b815260040160206040518083038186803b1580156129b857600080fd5b505afa1580156129cc573d6000803e3d6000fd5b505050506040513d60208110156129e257600080fd5b5051612a35576040805162461bcd60e51b815260206004820152601c60248201527f6d61726b6572206d6574686f642072657475726e65642066616c736500000000604482015290519081900360640190fd5b600680546001600160a01b0319166001600160a01b03858116918217909255604080519284168352602083019190915280517fedffc32e068c7c95dfd4bdfd5c4d939a084d6b11c4199eac8436ed234d72f9269281900390910190a160006111c7565b60008054819060ff16612adf576040805162461bcd60e51b815260206004820152600a6024820152691c994b595b9d195c995960b21b604482015290519081900360640190fd5b6000805460ff19168155612af1611623565b90508015612b0f576120ad816010811115612b0857fe5b601e612651565b6120c533856142d2565b600080838311612b30575060009050818303612536565b50600390506000612536565b6000612b46615621565b600080612b57866000015186614268565b90925090506000826003811115612b6a57fe5b14612b8957506040805160208101909152600081529092509050612536565b60408051602081019091529081526000969095509350505050565b60007f45b96fe442630264581b197e84bbada861235052c5a1aadfff9ea4e40a969aa0846010811115612bd357fe5b846052811115612bdf57fe5b604080519283526020830191909152818101859052519081900360600190a183601081111561105757fe5b600080838301848110612c2257600092509050612536565b506002915060009050612536565b6000806000612c3d615621565b612c478787612b3c565b90925090506000826003811115612c5a57fe5b14612c6b5750915060009050612c84565b612c7d612c77826136f0565b86612c0a565b9350935050505b935093915050565b60065460408051630dce3c5b60e31b815260048101879052602481018690526044810185905290516000928392839283926001600160a01b031691636e71e2d8916064808301926020929190829003018186803b158015612cec57600080fd5b505afa158015612d00573d6000803e3d6000fd5b505050506040513d6020811015612d1657600080fd5b505160065460085460408051635c0b440b60e11b8152600481018d9052602481018c9052604481018b90526064810192909252519293506000926001600160a01b039092169163b816881691608480820192602092909190829003018186803b158015612d8257600080fd5b505afa158015612d96573d6000803e3d6000fd5b505050506040513d6020811015612dac57600080fd5b50516006546040805163327a176d60e11b8152600481018d9052602481018c9052604481018b905290519293506001600160a01b03909116916364f42eda91606480820192602092909190829003018186803b158015612e0b57600080fd5b505afa158015612e1f573d6000803e3d6000fd5b505050506040513d6020811015612e3557600080fd5b505115612eeb57612e546040518060200160405280848152508b6124e9565b90955092506000856003811115612e6757fe5b14612e79575060009250612ef7915050565b612e838382612b19565b90955092506000856003811115612e9657fe5b14612ea8575060009250612ef7915050565b612ec16040518060200160405280858152508789612c30565b90955093506000856003811115612ed457fe5b14612ee6575060009250612ef7915050565b612ef3565b600094508693505b5050505b9550959350505050565b6005546040805163d02f735160e01b81523060048201526001600160a01b038781166024830152868116604483015285811660648301526084820185905291516000938493169163d02f73519160a480830192602092919082900301818787803b158015612f6e57600080fd5b505af1158015612f82573d6000803e3d6000fd5b505050506040513d6020811015612f9857600080fd5b505190508015612faf576122586003601b83612ba4565b846001600160a01b0316846001600160a01b03161415612fd5576122586006601c612651565b6001600160a01b0384166000908152600f602052604081205481908190612ffc9087612b19565b9093509150600083600381111561300f57fe5b14613032576130276009601a85600381111561180b57fe5b945050505050611057565b6001600160a01b0388166000908152600f60205260409020546130559087612c0a565b9093509050600083600381111561306857fe5b14613080576130276009601985600381111561180b57fe5b6001600160a01b038088166000818152600f60209081526040808320879055938c168083529184902085905583518a8152935191936000805160206158e1833981519152929081900390910190a360009998505050505050505050565b6000805460ff16613122576040805162461bcd60e51b815260206004820152600a6024820152691c994b595b9d195c995960b21b604482015290519081900360640190fd5b6000805460ff19168155613134611623565b905080156131525761125881601081111561314b57fe5b6008612651565b61126933846149bb565b6000805460ff166131a1576040805162461bcd60e51b815260206004820152600a6024820152691c994b595b9d195c995960b21b604482015290519081900360640190fd5b6000805460ff191681556131b3611623565b905080156131ca5761125881601081111561285857fe5b611269338460006138de565b60008054819060ff1661321d576040805162461bcd60e51b815260206004820152600a6024820152691c994b595b9d195c995960b21b604482015290519081900360640190fd5b6000805460ff1916815561322f611623565b9050801561325a5761324d81601081111561324657fe5b600f612651565b9250600091506132f19050565b836001600160a01b031663a6afed956040518163ffffffff1660e01b8152600401602060405180830381600087803b15801561329557600080fd5b505af11580156132a9573d6000803e3d6000fd5b505050506040513d60208110156132bf57600080fd5b5051905080156132df5761324d8160108111156132d857fe5b6010612651565b6132eb33878787614c47565b92509250505b6000805460ff191660011790559094909350915050565b60035460009061010090046001600160a01b0316331461332e5761109f60016047612651565b61333661291f565b6009541461334a5761109f600a6048612651565b670de0b6b3a76400008211156133665761109f60026049612651565b6008805490839055604080518281526020810185905281517faaa68312e2ea9d50e16af5068410ab56e1a1fd06037b1a35664812c30f821460929181900390910190a160006111c7565b60055460408051631200453160e11b81523060048201526001600160a01b0386811660248301528581166044830152606482018590529151600093849384939116916324008a629160848082019260209290919082900301818787803b15801561341957600080fd5b505af115801561342d573d6000803e3d6000fd5b505050506040513d602081101561344357600080fd5b5051905080156134675761345a6003603883612ba4565b925060009150612c849050565b61346f61291f565b600954146134835761345a600a6039612651565b61348b6156b2565b6001600160a01b03861660009081526011602052604090206001015460608201526134b58661286b565b60808301819052602083018260038111156134cc57fe5b60038111156134d757fe5b90525060009050816020015160038111156134ee57fe5b146135185761350a600960378360200151600381111561180b57fe5b935060009250612c84915050565b6000198514156135315760808101516040820152613539565b604081018590525b61354787826040015161513d565b60e08201819052608082015161355c91612b19565b60a083018190526020830182600381111561357357fe5b600381111561357e57fe5b905250600090508160200151600381111561359557fe5b146135d15760405162461bcd60e51b815260040180806020018281038252603a8152602001806158a7603a913960400191505060405180910390fd5b6135e1600b548260e00151612b19565b60c08301819052602083018260038111156135f857fe5b600381111561360357fe5b905250600090508160200151600381111561361a57fe5b146136565760405162461bcd60e51b81526004018080602001828103825260318152602001806159016031913960400191505060405180910390fd5b60a0810180516001600160a01b03808916600081815260116020908152604091829020948555600a5460019095019490945560c0860151600b81905560e087015195518251968752948601949094528481019390935291519192908a16917f1a2a22cb034d26d1854bdc6666a5b91fe25efbbb5dcad3b0355478d6f5c362a19181900360600190a360e00151600097909650945050505050565b51670de0b6b3a7640000900490565b60008060008061370d61291f565b6009541461372c57613721600a604f612651565b9350915061291a9050565b613736338661513d565b905080600c54019150600c54821015613796576040805162461bcd60e51b815260206004820181905260248201527f61646420726573657276657320756e6578706563746564206f766572666c6f77604482015290519081900360640190fd5b600c829055604080513381526020810183905280820184905290517fa91e67c5ea634cd43a12c5a482724b03de01e85ca68702a53d0c2f45cb7c1dc59181900360600190a160009350915050915091565b6012546040805163a9059cbb60e01b81526001600160a01b0385811660048301526024820185905291519190921691829163a9059cbb9160448082019260009290919082900301818387803b15801561383f57600080fd5b505af1158015613853573d6000803e3d6000fd5b5050505060003d6000811461386f576020811461387957600080fd5b6000199150613885565b60206000803e60005191505b50806138d8576040805162461bcd60e51b815260206004820152601960248201527f544f4b454e5f5452414e534645525f4f55545f4641494c454400000000000000604482015290519081900360640190fd5b50505050565b60008215806138eb575081155b6139265760405162461bcd60e51b81526004018080602001828103825260348152602001806159c26034913960400191505060405180910390fd5b61392e6156b2565b6001600160a01b0385166000908152600f6020526040902061394e6120df565b604084018190526020840182600381111561396557fe5b600381111561397057fe5b905250600090508260200151600381111561398757fe5b146139ac576139a36009602b8460200151600381111561180b57fe5b925050506111c7565b6000806000600660009054906101000a90046001600160a01b03166001600160a01b031663e36c26e46040518163ffffffff1660e01b815260040160206040518083038186803b1580156139ff57600080fd5b505afa158015613a13573d6000803e3d6000fd5b505050506040513d6020811015613a2957600080fd5b505190508015613af9576003840154613a40615621565b60405180602001604052808381525090506000613a636009548860020154612b19565b915050613a6e615621565b613a788383612b3c565b915050613a83615621565b613aa36040518060200160405280670de0b6b3a764000081525083615387565b60018b01549092509050613ab5615621565b506040805160208101909152818152613acc615621565b613ad684836153c1565b805160018f01819055909250613aed915084612b19565b9b505050505050505050505b60095460028501556006546001600160a01b031663b8168816613b1a61253d565b600b54600c546008546040518563ffffffff1660e01b81526004018085815260200184815260200183815260200182815260200194505050505060206040518083038186803b158015613b6c57600080fd5b505afa158015613b80573d6000803e3d6000fd5b505050506040513d6020811015613b9657600080fd5b50516003850155808015613c3457506006546001600160a01b03166364f42eda613bbe61253d565b600b54600c546040518463ffffffff1660e01b815260040180848152602001838152602001828152602001935050505060206040518083038186803b158015613c0657600080fd5b505afa158015613c1a573d6000803e3d6000fd5b505050506040513d6020811015613c3057600080fd5b5051155b15613dba576006546000906001600160a01b03166315f24053613c5561253d565b600b54600c546040518463ffffffff1660e01b815260040180848152602001838152602001828152602001935050505060206040518083038186803b158015613c9d57600080fd5b505afa158015613cb1573d6000803e3d6000fd5b505050506040513d6020811015613cc757600080fd5b50516006549091506000906001600160a01b0316636e71e2d8613ce861253d565b600b54600c546040518463ffffffff1660e01b815260040180848152602001838152602001828152602001935050505060206040518083038186803b158015613d3057600080fd5b505afa158015613d44573d6000803e3d6000fd5b505050506040513d6020811015613d5a57600080fd5b50516040805160208101909152838152909150600090613d7a90836124e9565b915050613d8b876003015482612b19565b9550613d979050615621565b613da58689600301546154aa565b915050613db281886124e9565b965050505050505b8715613e9157606085018890528015613e0f57613dd5615621565b613de78660600151866001015461555a565b915050613df2615621565b613e00828760000154615595565b51608089015250613e8c915050565b613e2b60405180602001604052808760400151815250896124e9565b6080870181905260208701826003811115613e4257fe5b6003811115613e4d57fe5b9052506000905085602001516003811115613e6457fe5b14613e8c57613e80600960298760200151600381111561180b57fe5b955050505050506111c7565b613f51565b608085018790528015613ee057613ea6615621565b613eb88660800151866000015461555a565b915050613ec3615621565b613ed1828760010154615595565b51606089015250613f51915050565b613efc87604051806020016040528088604001518152506155b0565b6060870181905260208701826003811115613f1357fe5b6003811115613f1e57fe5b9052506000905085602001516003811115613f3557fe5b14613f5157613e806009602a8760200151600381111561180b57fe5b60055460608601516040805163eabe7d9160e01b81523060048201526001600160a01b038d8116602483015260448201939093529051600093929092169163eabe7d919160648082019260209290919082900301818787803b158015613fb657600080fd5b505af1158015613fca573d6000803e3d6000fd5b505050506040513d6020811015613fe057600080fd5b50519050801561400457613ff76003602883612ba4565b96505050505050506111c7565b61400c61291f565b6009541461402057613ff7600a602c612651565b614030600d548760600151612b19565b60a088018190526020880182600381111561404757fe5b600381111561405257fe5b905250600090508660200151600381111561406957fe5b1461408557613ff76009602e8860200151600381111561180b57fe5b614091600e5484612b19565b60e088015250845460608701516140a89190612b19565b60c08801819052602088018260038111156140bf57fe5b60038111156140ca57fe5b90525060009050866020015160038111156140e157fe5b146140fd57613ff76009602d8860200151600381111561180b57fe5b856080015161410a61253d565b101561411c57613ff7600e602f612651565b61412a8a87608001516137e7565b60a0860151600d5560e0860151600e5560c0860151855560095460028601556060860151604080519182525130916001600160a01b038d16916000805160206158e18339815191529181900360200190a3896001600160a01b03167fe5b754fb1abb7f01b499791d0b820ae3b6af3424ac1c59768edb53f4ec31a92987608001518860600151604051808381526020018281526020019250505060405180910390a260055460808701516060880151604080516351dff98960e01b81523060048201526001600160a01b038f81166024830152604482019490945260648101929092525191909216916351dff98991608480830192600092919082900301818387803b15801561423957600080fd5b505af115801561424d573d6000803e3d6000fd5b506000925061425a915050565b9a9950505050505050505050565b6000808361427b57506000905080612536565b8383028385828161428857fe5b041461429c57506002915060009050612536565b600092509050612536565b600080826142bb5750600190506000612536565b60008385816142c657fe5b04915091509250929050565b60055460408051634ef4c3e160e01b81523060048201526001600160a01b03858116602483015260448201859052915160009384938493911691634ef4c3e19160648082019260209290919082900301818787803b15801561433357600080fd5b505af1158015614347573d6000803e3d6000fd5b505050506040513d602081101561435d57600080fd5b505190508015614381576143746003601f83612ba4565b9250600091506125369050565b61438961291f565b6009541461439d57614374600a6022612651565b6143a56156f8565b6143ad6120df565b60408301819052602083018260038111156143c457fe5b60038111156143cf57fe5b90525060009050816020015160038111156143e657fe5b1461441057614402600960218360200151600381111561180b57fe5b935060009250612536915050565b61441a868661513d565b60c082018190526040805160208101825290830151815261443b91906155b0565b606083018190526020830182600381111561445257fe5b600381111561445d57fe5b905250600090508160200151600381111561447457fe5b146144c6576040805162461bcd60e51b815260206004820181905260248201527f4d494e545f45584348414e47455f43414c43554c4154494f4e5f4641494c4544604482015290519081900360640190fd5b6144d6600d548260600151612c0a565b60808301819052602083018260038111156144ed57fe5b60038111156144f857fe5b905250600090508160200151600381111561450f57fe5b1461454b5760405162461bcd60e51b815260040180806020018281038252602881526020018061599a6028913960400191505060405180910390fd5b6001600160a01b0386166000908152600f602052604090205460608201516145739190612c0a565b60a083018190526020830182600381111561458a57fe5b600381111561459557fe5b90525060009050816020015160038111156145ac57fe5b146145e85760405162461bcd60e51b815260040180806020018281038252602b815260200180615845602b913960400191505060405180910390fd5b6006546000906001600160a01b031663b816881661460461253d565b600b54600c546008546040518563ffffffff1660e01b81526004018085815260200184815260200183815260200182815260200194505050505060206040518083038186803b15801561465657600080fd5b505afa15801561466a573d6000803e3d6000fd5b505050506040513d602081101561468057600080fd5b5051600654604080516338db09b960e21b815290519293506000926001600160a01b039092169163e36c26e491600480820192602092909190829003018186803b1580156146cd57600080fd5b505afa1580156146e1573d6000803e3d6000fd5b505050506040513d60208110156146f757600080fd5b50516001600160a01b0389166000908152600f6020526040902054909150156148cf57614722615621565b811561483f57614730615621565b5060408051602080820183526001600160a01b038c166000818152600f8084529481206003810154855260095492825294909252600290930154919290916147789190612b19565b915050614783615621565b61478d8383612b3c565b915050614798615621565b6147b86040518060200160405280670de0b6b3a764000081525083615387565b6001600160a01b038f166000908152600f60209081526040808320600101548151928301909152808252929450919250906147f390846153c1565b97509050600081600381111561480557fe5b146148345761481d6009602083600381111561180b57fe5b9c5060009b506125369a5050505050505050505050565b5050505050506148be565b6001600160a01b0389166000908152600f60209081526040808320548151808401835281815282519384018352918801518352929161487e91906153c1565b93509050600081600381111561489057fe5b146148bb576148a86009602083600381111561180b57fe5b9850600097506125369650505050505050565b50505b80516148ca9089612c0a565b985050505b608080840151600d5560408051918201815260a0850151825260208083018a815260095484840190815260608086018881526001600160a01b038f166000818152600f8752879020975188559351600188015591516002870155905160039095019490945560c087015193870151835194855291840191909152815190927f4c209b5fc8ad50758f13e2e1088ba56a560dff690a1c6fef26394f4c03821c4f92908290030190a2606083015160408051918252516001600160a01b038a169130916000805160206158e18339815191529181900360200190a3505060c001516000969095509350505050565b6005546040805163368f515360e21b81523060048201526001600160a01b0385811660248301526044820185905291516000938493169163da3d454c91606480830192602092919082900301818787803b158015614a1857600080fd5b505af1158015614a2c573d6000803e3d6000fd5b505050506040513d6020811015614a4257600080fd5b505190508015614a6157614a596003600e83612ba4565b915050610bdd565b614a6961291f565b60095414614a7c57614a59600a80612651565b82614a8561253d565b1015614a9757614a59600e6009612651565b614a9f615736565b614aa88561286b565b6020830181905282826003811115614abc57fe5b6003811115614ac757fe5b9052506000905081516003811115614adb57fe5b14614b0057614af7600960078360000151600381111561180b57fe5b92505050610bdd565b614b0e816020015185612c0a565b6040830181905282826003811115614b2257fe5b6003811115614b2d57fe5b9052506000905081516003811115614b4157fe5b14614b5d57614af76009600c8360000151600381111561180b57fe5b614b69600b5485612c0a565b6060830181905282826003811115614b7d57fe5b6003811115614b8857fe5b9052506000905081516003811115614b9c57fe5b14614bb857614af76009600b8360000151600381111561180b57fe5b614bc285856137e7565b604080820180516001600160a01b03881660008181526011602090815290859020928355600a54600190930192909255606080860151600b819055935185518a8152938401528285019390935292517f13ed6866d4e1ee6da46f845c46d7e54120883d75c5ea9a2dacc1c4ca8984ab80929181900390910190a2600095945050505050565b60055460408051632fe3f38f60e11b81523060048201526001600160a01b0384811660248301528781166044830152868116606483015260848201869052915160009384938493911691635fc7e71e9160a48082019260209290919082900301818787803b158015614cb857600080fd5b505af1158015614ccc573d6000803e3d6000fd5b505050506040513d6020811015614ce257600080fd5b505190508015614d0657614cf96003601283612ba4565b9250600091506151349050565b614d0e61291f565b60095414614d2257614cf9600a6016612651565b614d2a61291f565b846001600160a01b0316636c540baf6040518163ffffffff1660e01b815260040160206040518083038186803b158015614d6357600080fd5b505afa158015614d77573d6000803e3d6000fd5b505050506040513d6020811015614d8d57600080fd5b505114614da057614cf9600a6011612651565b866001600160a01b0316866001600160a01b03161415614dc657614cf960066017612651565b84614dd757614cf960076015612651565b600019851415614ded57614cf960076014612651565b600080614dfb8989896133b0565b90925090508115614e2b57614e1c826010811115614e1557fe5b6018612651565b94506000935061513492505050565b6005546040805163c488847b60e01b81523060048201526001600160a01b038981166024830152604482018590528251600094859492169263c488847b926064808301939192829003018186803b158015614e8557600080fd5b505afa158015614e99573d6000803e3d6000fd5b505050506040513d6040811015614eaf57600080fd5b50805160209091015190925090508115614efa5760405162461bcd60e51b81526004018080602001828103825260338152602001806159326033913960400191505060405180910390fd5b80886001600160a01b03166370a082318c6040518263ffffffff1660e01b815260040180826001600160a01b03166001600160a01b0316815260200191505060206040518083038186803b158015614f5157600080fd5b505afa158015614f65573d6000803e3d6000fd5b505050506040513d6020811015614f7b57600080fd5b50511015614fd0576040805162461bcd60e51b815260206004820152601860248201527f4c49515549444154455f5345495a455f544f4f5f4d5543480000000000000000604482015290519081900360640190fd5b60006001600160a01b038916301415614ff657614fef308d8d85612f01565b9050615080565b6040805163b2a02ff160e01b81526001600160a01b038e811660048301528d81166024830152604482018590529151918b169163b2a02ff1916064808201926020929091908290030181600087803b15801561505157600080fd5b505af1158015615065573d6000803e3d6000fd5b505050506040513d602081101561507b57600080fd5b505190505b80156150ca576040805162461bcd60e51b81526020600482015260146024820152731d1bdad95b881cd95a5e9d5c994819985a5b195960621b604482015290519081900360640190fd5b886001600160a01b03168b6001600160a01b03168d6001600160a01b03167f298637f684da70674f26509b10f07ec2fbc77a335ab1e7d6215a4b2484d8bb528786604051808381526020018281526020019250505060405180910390a46000975092955050505050505b94509492505050565b601254604080516370a0823160e01b815230600482015290516000926001600160a01b031691839183916370a08231916024808301926020929190829003018186803b15801561518c57600080fd5b505afa1580156151a0573d6000803e3d6000fd5b505050506040513d60208110156151b657600080fd5b5051604080516323b872dd60e01b81526001600160a01b038881166004830152306024830152604482018890529151929350908416916323b872dd9160648082019260009290919082900301818387803b15801561521357600080fd5b505af1158015615227573d6000803e3d6000fd5b5050505060003d60008114615243576020811461524d57600080fd5b6000199150615259565b60206000803e60005191505b50806152ac576040805162461bcd60e51b815260206004820152601860248201527f544f4b454e5f5452414e534645525f494e5f4641494c45440000000000000000604482015290519081900360640190fd5b601254604080516370a0823160e01b815230600482015290516000926001600160a01b0316916370a08231916024808301926020929190829003018186803b1580156152f757600080fd5b505afa15801561530b573d6000803e3d6000fd5b505050506040513d602081101561532157600080fd5b505190508281101561537a576040805162461bcd60e51b815260206004820152601a60248201527f544f4b454e5f5452414e534645525f494e5f4f564552464c4f57000000000000604482015290519081900360640190fd5b9190910395945050505050565b6000615391615621565b6000806153a686600001518660000151612c0a565b60408051602081019091529081529097909650945050505050565b60006153cb615621565b6000806153e086600001518660000151614268565b909250905060008260038111156153f357fe5b1461541257506040805160208101909152600081529092509050612536565b6000806154276706f05b59d3b2000084612c0a565b9092509050600082600381111561543a57fe5b1461545c57506040805160208101909152600081529094509250612536915050565b60008061547183670de0b6b3a76400006142a7565b9092509050600082600381111561548457fe5b1461548b57fe5b604080516020810190915290815260009a909950975050505050505050565b60006154b4615621565b6000806154c986670de0b6b3a7640000614268565b909250905060008260038111156154dc57fe5b146154fb57506040805160208101909152600081529092509050612536565b60008061550883886142a7565b9092509050600082600381111561551b57fe5b1461553d57506040805160208101909152600081529094509250612536915050565b604080516020810190915290815260009890975095505050505050565b6000615564615621565b61558a6040518060200160405280868152506040518060200160405280868152506153c1565b915091509250929050565b600061559f615621565b600080612b578660000151866142a7565b60008060006155bd615621565b612500868660006155cc615621565b6000806155e1670de0b6b3a764000087614268565b909250905060008260038111156155f457fe5b1461561357506040805160208101909152600081529092509050612536565b61252f8186600001516154aa565b6040518060200160405280600081525090565b828054600181600116156101000203166002900490600052602060002090601f016020900481019282601f1061567557805160ff19168380011785556156a2565b828001600101855582156156a2579182015b828111156156a2578251825591602001919060010190615687565b506156ae92915061575f565b5090565b6040805161010081019091528060008152602001600081526020016000815260200160008152602001600081526020016000815260200160008152602001600081525090565b6040805160e0810190915280600081526020016000815260200160008152602001600081526020016000815260200160008152602001600081525090565b604080516080810190915280600081526020016000815260200160008152602001600081525090565b610d2591905b808211156156ae576000815560010161576556fe6f6e6c792061646d696e206d617920696e697469616c697a6520746865206d61726b65746d61726b6574206d6179206f6e6c7920626520696e697469616c697a6564206f6e63654345726332303a3a7377656570546f6b656e3a2063616e206e6f7420737765657020756e6465726c79696e6720746f6b656e696e697469616c2065786368616e67652072617465206d7573742062652067726561746572207468616e207a65726f2e73657474696e6720696e7465726573742072617465206d6f64656c206661696c65644d494e545f4e45575f4143434f554e545f42414c414e43455f43414c43554c4154494f4e5f4641494c4544626f72726f7742616c616e636553746f7265643a20626f72726f7742616c616e636553746f726564496e7465726e616c206661696c656452455041595f424f52524f575f4e45575f4143434f554e545f424f52524f575f42414c414e43455f43414c43554c4154494f4e5f4641494c4544ddf252ad1be2c89b69c2b068fc378daa952ba7f163c4a11628f55a4df523b3ef52455041595f424f52524f575f4e45575f544f54414c5f42414c414e43455f43414c43554c4154494f4e5f4641494c45444c49515549444154455f434f4d5054524f4c4c45525f43414c43554c4154455f414d4f554e545f5345495a455f4641494c454465786368616e67655261746553746f7265643a2065786368616e67655261746553746f726564496e7465726e616c206661696c65644d494e545f4e45575f544f54414c5f535550504c595f43414c43554c4154494f4e5f4641494c45446f6e65206f662072656465656d546f6b656e73496e206f722072656465656d416d6f756e74496e206d757374206265207a65726f72656475636520726573657276657320756e657870656374656420756e646572666c6f77a265627a7a72315820562487e1a49c1e85c6cbbb4bb84d3572940188a741468a94d5582d209184045264736f6c63430005110032",
  "devdoc": {
    "author": "tropykus",
    "methods": {
      "_acceptAdmin()": {
        "details": "Admin function for pending admin to accept role and update admin",
        "return": "uint 0=success, otherwise a failure (see ErrorReporter.sol for details)"
      },
      "_addReserves(uint256)": {
        "params": {
          "addAmount": "The amount fo underlying token to add as reserves"
        },
        "return": "uint 0=success, otherwise a failure (see ErrorReporter.sol for details)"
      },
      "_reduceReserves(uint256)": {
        "params": {
          "reduceAmount": "Amount of reduction to reserves"
        },
        "return": "uint 0=success, otherwise a failure (see ErrorReporter.sol for details)"
      },
      "_setComptroller(address)": {
        "details": "Admin function to set a new comptroller",
        "return": "uint 0=success, otherwise a failure (see ErrorReporter.sol for details)"
      },
      "_setInterestRateModel(address)": {
        "details": "Admin function to accrue interest and update the interest rate model",
        "params": {
          "newInterestRateModel": "the new interest rate model to use"
        },
        "return": "uint 0=success, otherwise a failure (see ErrorReporter.sol for details)"
      },
      "_setPendingAdmin(address)": {
        "details": "Admin function to begin change of admin. The newPendingAdmin must call `_acceptAdmin` to finalize the transfer.",
        "params": {
          "newPendingAdmin": "New pending admin."
        },
        "return": "uint 0=success, otherwise a failure (see ErrorReporter.sol for details)"
      },
      "_setReserveFactor(uint256)": {
        "details": "Admin function to accrue interest and set a new reserve factor",
        "return": "uint 0=success, otherwise a failure (see ErrorReporter.sol for details)"
      },
      "accrueInterest()": {
        "details": "This calculates interest accrued from the last checkpointed block  up to the current block and writes new checkpoint to storage."
      },
      "allowance(address,address)": {
        "params": {
          "owner": "The address of the account which owns the tokens to be spent",
          "spender": "The address of the account which may transfer tokens"
        },
        "return": "The number of tokens allowed to be spent (-1 means infinite)"
      },
      "approve(address,uint256)": {
        "details": "This will overwrite the approval amount for `spender` and is subject to issues noted [here](https://eips.ethereum.org/EIPS/eip-20#approve)",
        "params": {
          "amount": "The number of tokens that are approved (-1 means infinite)",
          "spender": "The address of the account which may transfer tokens"
        },
        "return": "Whether or not the approval succeeded"
      },
      "balanceOf(address)": {
        "params": {
          "owner": "The address of the account to query"
        },
        "return": "The number of tokens owned by `owner`"
      },
      "balanceOfUnderlying(address)": {
        "details": "This also accrues interest in a transaction",
        "params": {
          "owner": "The address of the account to query"
        },
        "return": "The amount of underlying owned by `owner`"
      },
      "borrow(uint256)": {
        "params": {
          "borrowAmount": "The amount of the underlying asset to borrow"
        },
        "return": "uint 0=success, otherwise a failure (see ErrorReporter.sol for details)"
      },
      "borrowBalanceCurrent(address)": {
        "params": {
          "account": "The address whose balance should be calculated after updating borrowIndex"
        },
        "return": "The calculated balance"
      },
      "borrowBalanceStored(address)": {
        "params": {
          "account": "The address whose balance should be calculated"
        },
        "return": "The calculated balance"
      },
      "borrowRatePerBlock()": {
        "return": "The borrow interest rate per block, scaled by 1e18"
      },
      "constructor": {
        "params": {
          "admin_": "Address of the administrator of this token",
          "comptroller_": "The address of the Comptroller",
          "decimals_": "ERC-20 decimal precision of this token",
          "initialExchangeRateMantissa_": "The initial exchange rate, scaled by 1e18",
          "interestRateModel_": "The address of the interest rate model",
          "name_": "ERC-20 name of this token",
          "symbol_": "ERC-20 symbol of this token",
          "underlying_": "The address of the underlying asset"
        }
      },
      "exchangeRateCurrent()": {
        "return": "Calculated exchange rate scaled by 1e18"
      },
      "exchangeRateStored()": {
        "details": "This function does not accrue interest before calculating the exchange rate",
        "return": "Calculated exchange rate scaled by 1e18"
      },
      "getAccountSnapshot(address)": {
        "details": "This is used by comptroller to more efficiently perform liquidity checks.",
        "params": {
          "account": "Address of the account to snapshot"
        },
        "return": "(possible error, token balance, borrow balance, exchange rate mantissa)"
      },
      "getCash()": {
        "return": "The quantity of underlying asset owned by this contract"
      },
      "initialize(address,address,address,uint256,string,string,uint8)": {
        "params": {
          "comptroller_": "The address of the Comptroller",
          "decimals_": "ERC-20 decimal precision of this token",
          "initialExchangeRateMantissa_": "The initial exchange rate, scaled by 1e18",
          "interestRateModel_": "The address of the interest rate model",
          "name_": "ERC-20 name of this token",
          "symbol_": "ERC-20 symbol of this token",
          "underlying_": "The address of the underlying asset"
        }
      },
      "initialize(address,address,uint256,string,string,uint8)": {
        "params": {
          "comptroller_": "The address of the Comptroller",
          "decimals_": "EIP-20 decimal precision of this token",
          "initialExchangeRateMantissa_": "The initial exchange rate, scaled by 1e18",
          "interestRateModel_": "The address of the interest rate model",
          "name_": "EIP-20 name of this token",
          "symbol_": "EIP-20 symbol of this token"
        }
      },
      "liquidateBorrow(address,uint256,address)": {
        "params": {
          "borrower": "The borrower of this cToken to be liquidated",
          "cTokenCollateral": "The market in which to seize collateral from the borrower",
          "repayAmount": "The amount of the underlying borrowed asset to repay"
        },
        "return": "uint 0=success, otherwise a failure (see ErrorReporter.sol for details)"
      },
      "mint(uint256)": {
        "details": "Accrues interest whether or not the operation succeeds, unless reverted",
        "params": {
          "mintAmount": "The amount of the underlying asset to supply"
        },
        "return": "uint 0=success, otherwise a failure (see ErrorReporter.sol for details)"
      },
      "redeem(uint256)": {
        "details": "Accrues interest whether or not the operation succeeds, unless reverted",
        "params": {
          "redeemTokens": "The number of cTokens to redeem into underlying"
        },
        "return": "uint 0=success, otherwise a failure (see ErrorReporter.sol for details)"
      },
      "redeemUnderlying(uint256)": {
        "details": "Accrues interest whether or not the operation succeeds, unless reverted",
        "params": {
          "redeemAmount": "The amount of underlying to redeem"
        },
        "return": "uint 0=success, otherwise a failure (see ErrorReporter.sol for details)"
      },
      "repayBorrow(uint256)": {
        "params": {
          "repayAmount": "The amount to repay"
        },
        "return": "uint 0=success, otherwise a failure (see ErrorReporter.sol for details)"
      },
      "repayBorrowBehalf(address,uint256)": {
        "params": {
          "borrower": "the account with the debt being payed off",
          "repayAmount": "The amount to repay"
        },
        "return": "uint 0=success, otherwise a failure (see ErrorReporter.sol for details)"
      },
      "seize(address,address,uint256)": {
        "details": "Will fail unless called by another cToken during the process of liquidation. Its absolutely critical to use msg.sender as the borrowed cToken and not a parameter.",
        "params": {
          "borrower": "The account having collateral seized",
          "liquidator": "The account receiving seized collateral",
          "seizeTokens": "The number of cTokens to seize"
        },
        "return": "uint 0=success, otherwise a failure (see ErrorReporter.sol for details)"
      },
      "supplyRatePerBlock()": {
        "return": "The supply interest rate per block, scaled by 1e18"
      },
      "sweepToken(address)": {
        "params": {
          "token": "The address of the ERC-20 token to sweep"
        }
      },
      "totalBorrowsCurrent()": {
        "return": "The total borrows with interest"
      },
      "transfer(address,uint256)": {
        "params": {
          "amount": "The number of tokens to transfer",
          "dst": "The address of the destination account"
        },
        "return": "Whether or not the transfer succeeded"
      },
      "transferFrom(address,address,uint256)": {
        "params": {
          "amount": "The number of tokens to transfer",
          "dst": "The address of the destination account",
          "src": "The address of the source account"
        },
        "return": "Whether or not the transfer succeeded"
      }
    },
    "title": "tropykus CErc20Immutable Contract"
  },
  "userdoc": {
    "methods": {
      "_acceptAdmin()": {
        "notice": "Accepts transfer of admin rights. msg.sender must be pendingAdmin"
      },
      "_addReserves(uint256)": {
        "notice": "The sender adds to reserves."
      },
      "_reduceReserves(uint256)": {
        "notice": "Accrues interest and reduces reserves by transferring to admin"
      },
      "_setComptroller(address)": {
        "notice": "Sets a new comptroller for the market"
      },
      "_setInterestRateModel(address)": {
        "notice": "accrues interest and updates the interest rate model using _setInterestRateModelFresh"
      },
      "_setPendingAdmin(address)": {
        "notice": "Begins transfer of admin rights. The newPendingAdmin must call `_acceptAdmin` to finalize the transfer."
      },
      "_setReserveFactor(uint256)": {
        "notice": "accrues interest and sets a new reserve factor for the protocol using _setReserveFactorFresh"
      },
      "accrueInterest()": {
        "notice": "Applies accrued interest to total borrows and reserves"
      },
      "allowance(address,address)": {
        "notice": "Get the current allowance from `owner` for `spender`"
      },
      "approve(address,uint256)": {
        "notice": "Approve `spender` to transfer up to `amount` from `src`"
      },
      "balanceOf(address)": {
        "notice": "Get the token balance of the `owner`"
      },
      "balanceOfUnderlying(address)": {
        "notice": "Get the underlying balance of the `owner`"
      },
      "borrow(uint256)": {
        "notice": "Sender borrows assets from the protocol to their own address"
      },
      "borrowBalanceCurrent(address)": {
        "notice": "Accrue interest to updated borrowIndex and then calculate account's borrow balance using the updated borrowIndex"
      },
      "borrowBalanceStored(address)": {
        "notice": "Return the borrow balance of account based on stored data"
      },
      "borrowRatePerBlock()": {
        "notice": "Returns the current per-block borrow interest rate for this cToken"
      },
      "constructor": "Construct a new money market",
      "exchangeRateCurrent()": {
        "notice": "Accrue interest then return the up-to-date exchange rate"
      },
      "exchangeRateStored()": {
        "notice": "Calculates the exchange rate from the underlying to the CToken"
      },
      "getAccountSnapshot(address)": {
        "notice": "Get a snapshot of the account's balances, and the cached exchange rate"
      },
      "getCash()": {
        "notice": "Get cash balance of this cToken in the underlying asset"
      },
      "initialize(address,address,address,uint256,string,string,uint8)": {
        "notice": "Initialize the new money market"
      },
      "initialize(address,address,uint256,string,string,uint8)": {
        "notice": "Initialize the money market"
      },
      "liquidateBorrow(address,uint256,address)": {
        "notice": "The sender liquidates the borrowers collateral. The collateral seized is transferred to the liquidator."
      },
      "mint(uint256)": {
        "notice": "Sender supplies assets into the market and receives cTokens in exchange"
      },
      "redeem(uint256)": {
        "notice": "Sender redeems cTokens in exchange for the underlying asset"
      },
      "redeemUnderlying(uint256)": {
        "notice": "Sender redeems cTokens in exchange for a specified amount of underlying asset"
      },
      "repayBorrow(uint256)": {
        "notice": "Sender repays their own borrow"
      },
      "repayBorrowBehalf(address,uint256)": {
        "notice": "Sender repays a borrow belonging to borrower"
      },
      "seize(address,address,uint256)": {
        "notice": "Transfers collateral tokens (this market) to the liquidator."
      },
      "supplyRatePerBlock()": {
        "notice": "Returns the current per-block supply interest rate for this cToken"
      },
      "sweepToken(address)": {
        "notice": "A public function to sweep accidental ERC-20 transfers to this contract. Tokens are sent to admin (timelock)"
      },
      "totalBorrowsCurrent()": {
        "notice": "Returns the current total borrows plus accrued interest"
      },
      "transfer(address,uint256)": {
        "notice": "Transfer `amount` tokens from `msg.sender` to `dst`"
      },
      "transferFrom(address,address,uint256)": {
        "notice": "Transfer `amount` tokens from `src` to `dst`"
      }
    },
    "notice": "CTokens which wrap an EIP-20 underlying and are immutable"
  },
  "storageLayout": {
    "storage": [
      {
        "astId": 6450,
        "contract": "contracts/CErc20Immutable.sol:CErc20Immutable",
        "label": "_notEntered",
        "offset": 0,
        "slot": "0",
        "type": "t_bool"
      },
      {
        "astId": 6452,
        "contract": "contracts/CErc20Immutable.sol:CErc20Immutable",
        "label": "name",
        "offset": 0,
        "slot": "1",
        "type": "t_string_storage"
      },
      {
        "astId": 6454,
        "contract": "contracts/CErc20Immutable.sol:CErc20Immutable",
        "label": "symbol",
        "offset": 0,
        "slot": "2",
        "type": "t_string_storage"
      },
      {
        "astId": 6456,
        "contract": "contracts/CErc20Immutable.sol:CErc20Immutable",
        "label": "decimals",
        "offset": 0,
        "slot": "3",
        "type": "t_uint8"
      },
      {
        "astId": 6464,
        "contract": "contracts/CErc20Immutable.sol:CErc20Immutable",
        "label": "admin",
        "offset": 1,
        "slot": "3",
        "type": "t_address_payable"
      },
      {
        "astId": 6466,
        "contract": "contracts/CErc20Immutable.sol:CErc20Immutable",
        "label": "pendingAdmin",
        "offset": 0,
        "slot": "4",
        "type": "t_address_payable"
      },
      {
        "astId": 6468,
        "contract": "contracts/CErc20Immutable.sol:CErc20Immutable",
        "label": "comptroller",
        "offset": 0,
        "slot": "5",
        "type": "t_contract(ComptrollerInterface)30688"
      },
      {
        "astId": 6470,
        "contract": "contracts/CErc20Immutable.sol:CErc20Immutable",
        "label": "interestRateModel",
        "offset": 0,
        "slot": "6",
        "type": "t_contract(InterestRateModel)35666"
      },
      {
        "astId": 6472,
        "contract": "contracts/CErc20Immutable.sol:CErc20Immutable",
        "label": "initialExchangeRateMantissa",
        "offset": 0,
        "slot": "7",
        "type": "t_uint256"
      },
      {
        "astId": 6474,
        "contract": "contracts/CErc20Immutable.sol:CErc20Immutable",
        "label": "reserveFactorMantissa",
        "offset": 0,
        "slot": "8",
        "type": "t_uint256"
      },
      {
        "astId": 6476,
        "contract": "contracts/CErc20Immutable.sol:CErc20Immutable",
        "label": "accrualBlockNumber",
        "offset": 0,
        "slot": "9",
        "type": "t_uint256"
      },
      {
        "astId": 6478,
        "contract": "contracts/CErc20Immutable.sol:CErc20Immutable",
        "label": "borrowIndex",
        "offset": 0,
        "slot": "10",
        "type": "t_uint256"
      },
      {
        "astId": 6480,
        "contract": "contracts/CErc20Immutable.sol:CErc20Immutable",
        "label": "totalBorrows",
        "offset": 0,
        "slot": "11",
        "type": "t_uint256"
      },
      {
        "astId": 6482,
        "contract": "contracts/CErc20Immutable.sol:CErc20Immutable",
        "label": "totalReserves",
        "offset": 0,
        "slot": "12",
        "type": "t_uint256"
      },
      {
        "astId": 6484,
        "contract": "contracts/CErc20Immutable.sol:CErc20Immutable",
        "label": "totalSupply",
        "offset": 0,
        "slot": "13",
        "type": "t_uint256"
      },
      {
        "astId": 6486,
        "contract": "contracts/CErc20Immutable.sol:CErc20Immutable",
        "label": "subsidyFund",
        "offset": 0,
        "slot": "14",
        "type": "t_uint256"
      },
      {
        "astId": 6499,
        "contract": "contracts/CErc20Immutable.sol:CErc20Immutable",
        "label": "accountTokens",
        "offset": 0,
        "slot": "15",
        "type": "t_mapping(t_address,t_struct(SupplySnapshot)6495_storage)"
      },
      {
        "astId": 6505,
        "contract": "contracts/CErc20Immutable.sol:CErc20Immutable",
        "label": "transferAllowances",
        "offset": 0,
        "slot": "16",
        "type": "t_mapping(t_address,t_mapping(t_address,t_uint256))"
      },
      {
        "astId": 6514,
        "contract": "contracts/CErc20Immutable.sol:CErc20Immutable",
        "label": "accountBorrows",
        "offset": 0,
        "slot": "17",
        "type": "t_mapping(t_address,t_struct(BorrowSnapshot)6510_storage)"
      },
      {
        "astId": 6826,
        "contract": "contracts/CErc20Immutable.sol:CErc20Immutable",
        "label": "underlying",
        "offset": 0,
        "slot": "18",
        "type": "t_address"
      }
    ],
    "types": {
      "t_address": {
        "encoding": "inplace",
        "label": "address",
        "numberOfBytes": "20"
      },
      "t_address_payable": {
        "encoding": "inplace",
        "label": "address payable",
        "numberOfBytes": "20"
      },
      "t_bool": {
        "encoding": "inplace",
        "label": "bool",
        "numberOfBytes": "1"
      },
      "t_contract(ComptrollerInterface)30688": {
        "encoding": "inplace",
        "label": "contract ComptrollerInterface",
        "numberOfBytes": "20"
      },
      "t_contract(InterestRateModel)35666": {
        "encoding": "inplace",
        "label": "contract InterestRateModel",
        "numberOfBytes": "20"
      },
      "t_mapping(t_address,t_mapping(t_address,t_uint256))": {
        "encoding": "mapping",
        "key": "t_address",
        "label": "mapping(address => mapping(address => uint256))",
        "numberOfBytes": "32",
        "value": "t_mapping(t_address,t_uint256)"
      },
      "t_mapping(t_address,t_struct(BorrowSnapshot)6510_storage)": {
        "encoding": "mapping",
        "key": "t_address",
        "label": "mapping(address => struct CTokenStorage.BorrowSnapshot)",
        "numberOfBytes": "32",
        "value": "t_struct(BorrowSnapshot)6510_storage"
      },
      "t_mapping(t_address,t_struct(SupplySnapshot)6495_storage)": {
        "encoding": "mapping",
        "key": "t_address",
        "label": "mapping(address => struct CTokenStorage.SupplySnapshot)",
        "numberOfBytes": "32",
        "value": "t_struct(SupplySnapshot)6495_storage"
      },
      "t_mapping(t_address,t_uint256)": {
        "encoding": "mapping",
        "key": "t_address",
        "label": "mapping(address => uint256)",
        "numberOfBytes": "32",
        "value": "t_uint256"
      },
      "t_string_storage": {
        "encoding": "bytes",
        "label": "string",
        "numberOfBytes": "32"
      },
      "t_struct(BorrowSnapshot)6510_storage": {
        "encoding": "inplace",
        "label": "struct CTokenStorage.BorrowSnapshot",
        "members": [
          {
            "astId": 6507,
            "contract": "contracts/CErc20Immutable.sol:CErc20Immutable",
            "label": "principal",
            "offset": 0,
            "slot": "0",
            "type": "t_uint256"
          },
          {
            "astId": 6509,
            "contract": "contracts/CErc20Immutable.sol:CErc20Immutable",
            "label": "interestIndex",
            "offset": 0,
            "slot": "1",
            "type": "t_uint256"
          }
        ],
        "numberOfBytes": "64"
      },
      "t_struct(SupplySnapshot)6495_storage": {
        "encoding": "inplace",
        "label": "struct CTokenStorage.SupplySnapshot",
        "members": [
          {
            "astId": 6488,
            "contract": "contracts/CErc20Immutable.sol:CErc20Immutable",
            "label": "tokens",
            "offset": 0,
            "slot": "0",
            "type": "t_uint256"
          },
          {
            "astId": 6490,
            "contract": "contracts/CErc20Immutable.sol:CErc20Immutable",
            "label": "underlyingAmount",
            "offset": 0,
            "slot": "1",
            "type": "t_uint256"
          },
          {
            "astId": 6492,
            "contract": "contracts/CErc20Immutable.sol:CErc20Immutable",
            "label": "suppliedAt",
            "offset": 0,
            "slot": "2",
            "type": "t_uint256"
          },
          {
            "astId": 6494,
            "contract": "contracts/CErc20Immutable.sol:CErc20Immutable",
            "label": "promisedSupplyRate",
            "offset": 0,
            "slot": "3",
            "type": "t_uint256"
          }
        ],
        "numberOfBytes": "128"
      },
      "t_uint256": {
        "encoding": "inplace",
        "label": "uint256",
        "numberOfBytes": "32"
      },
      "t_uint8": {
        "encoding": "inplace",
        "label": "uint8",
        "numberOfBytes": "1"
      }
    }
  }
}